Phone,Founded,Longitude_4,Country,Location_description_5,Location_description_0,Longitude_0,Latitude_2,Location,City_3,Location_description_4,Longitude_5,Website,Name,Address_5,Location_description_2,Type,Latitude_0,Location_description_1,Latitude_4,City_4,Latitude_1,City_2,Company Size,Address_3,Linked In URL,City_5,Latitude_3,Address_4,Longitude_3,Industry,Location_description_3,Address_2,Address_0,Headquarter,City_0,Longitude_1,Overview,Longitude_2,Latitude_5,City_1,Address_1
null,1994,null,null,null,null,null,null,"1310 Hay Street, WEST PERTH, Western Australia 6005, AU",null,null,null,http://www.buyabusiness.com.au,GMO | WA's Business Broker,null,null,Privately Held,null,null,null,null,null,null,11-50 employees,null,https://www.linkedin.com/company/goodwin-mitchell-o'hehir/,null,null,null,null,null,null,null,null,"WEST PERTH, Western Australia",null,null,"GMO WA's Business Broker, the name trusted by professionals.Perth Accountants know that GMO Business Sales is the most respected business broker in WA. GMO receives over 50% of its seller listings through accounting referrals.Perth Migration Agents understand that GMO Business Sales will look after their business migration client with sound, ethical advice and service on Perth businesses for sale. Perth Bankers appreciate the GMO business newsletter because it has valuable sale evidence on the state of the market for WA business sales. The GMO newsletter gives them accurate information on typical prices and profits across fifty different WA business for sale categories.Perth Lawyers entrust their family court valuation work to GMO principal Graham O'Hehir and his valuation team, because they know GMO Business Valuations is Perth's most respected and most utilised business valuation service in Western Australia.Perth Finance Brokers know that when GMO business brokers put forward a business under offer for finance approval, that the GMO business broker will have produced a sensible and reliable information memorandum and a sensible contract of sale.GMO business broking customers offer us constant repeat business and we have been helping our loyal business proprietor customer base buy businesses in Perth and sell businesses in WA for twenty one years!",null,null,null,null
null,2012,null,null,null,null,null,null,"407 Bay Street, Brighton, VIC 3186, AU",null,null,null,http://www.apgroup.com.au,Australian Pharmacy Group,null,null,Privately Held,null,null,null,null,null,null,2-10 employees,null,https://www.linkedin.com/company/australian-pharmacy-group/,null,null,null,null,null,null,null,null,"Brighton, VIC",null,null,"Since launch in 2012, Australian Pharmacy Group (AP Group) has grown into the largest and most progressive pharmacy brokerage in the country.The market leading AP Group Data Room allows us to showcase your pharmacy to our network of 5000+ qualified buyers right across the country.AP Group also offer a complete suite of professional pharmacy services. So whether you are selling your business or looking for finance, legal or lease support, AP Group is the only call you need to make.Andrew Whelan is a Credit Representative (credit representative number 474967) of BLSSA Pty Ltd ACN 117 651 760 (Australian Credit Licence 391237).Sarah Tipping is a Credit Representative (credit representative number 474740) of BLSSA Pty Ltd CAN 117 651 760 (Australian Credit Licence 391237).",null,null,null,null
(03) 98564577,2010,null,null,null,null,null,null,"Level 8, 468 St Kilda Rd, Office, Melbourne, Victoria 3004, AU",null,null,null,https://www.fawknerproperty.com.au/,Fawkner Property,null,null,Privately Held,null,null,null,null,null,null,11-50 employees,null,https://www.linkedin.com/company/fawkner-property/,null,null,null,null,null,null,null,null,"Melbourne, Victoria",null,null,"Fawkner Property is a private boutique property syndication company, licensed by ASIC to promote property syndicates to retail, sophisticated and high net worth investors.For nearly a decade Investors have put their trust in Fawkner Property to increase their personal wealth, through investment in quality commercial property syndicates, with reliable monthly income and capital growth.Fawkner Property creates syndicates of like-minded people to invest in property for steady income returns, well above bank fixed deposits, without the capital volatility of the stock market.Fawkner Property syndicates are simple and transparent unit trusts, through which the investors own the property. Fawkner Property develops a strategy for each syndicate and selects properties that meet the strategy. Each property is chosen for its potential to provide reliable income and a capital gain for investors at least equal to inflation, over the life of the syndicate. Distributions are paid monthly to investors.Fawkner Property uses sensible non-recourse gearing through the top four major banks to pass on to investors the benefits of historically low interest rates, through higher income.Fawkner Property carries out all key steps of the property trust transaction including:- Asset Identification, due diligence, negotiation and acquisition- Sourcing of equity investment and debt financing for acquisition- Fund administration, corporate governance and fund strategyFawkner Property take a hands-on approach by directly managing and leasing the properties, optimising financial performance of the asset for investors including:- Personal tenant relationships & direct lease negotiations- Ensuring serviceability of facilities & managing maintenance & compliance costs- Identifying value-add opportunities, through detailed analysis & careful budgeting.",null,null,null,null
null,2003,null,AU,null,null,151.13834,null,"6 O'Connell Street, Level 10, Norwich House, Sydney, New South Wales 2000, AU",null,null,null,http://www.alegroup.com.au/,ALE Property Group,null,null,Public Company,-33.84907,null,null,null,null,null,11-50 employees,null,https://www.linkedin.com/company/ale-property-group/,null,null,null,null,null,null,null,"6 O'Connell Street, Sydney, New South Wales, 2000, AU","Sydney, New South Wales",Sydney,null,"ALE started life as an ASX listed entity in November 2003 following the divestment by Foster’s Group of its pub property portfolio. All the properties are leased to ALH (a 75% subsidiary of Woolworths Limited) for terms averaging around 13 years plus options for ALH to extend for up to a further 40 years.As at 30 June 2015, ALE is Australia’s largest listed freehold owner of pubs with 86 properties across Australia’s five mainland capital cities. Some of the iconic properties include the Breakfast Creek Hotel (Brisbane), the Crows Nest Hotel (Sydney) and the Young & Jackson (Melbourne). The pubs in ALE’s portfolio have been successfully operating at their current locations for an average 60+ years.ALE has consistently focused on opportunities to add value for its 5,000+ securityholders through proactive asset and capital management. Over the past 12 years ALE’s market capitalisation has grown from around $90 million to more than $700 million at 30 June 2015. This has delivered a compound annual return of around 22%. ALE has consistently outperformed other AREITs.Honours and Awards:ALE Ranked 1st of 41 AREITs BDO AREIT Survey 2015 ALE Ranked 4th of 39 AREITs BDO AREIT Survey 2014AREIT of the YearPIR 2013Longest Debt Instrument Issued by an AREITInsto Magazine 2006Structured Finance Transaction of the Year Insto Magazine 2004Innovative Deal of the YearInsto Magazine 2003",null,null,null,null
null,2009,null,null,null,null,null,null,"PO Box 3067, North Parramatta, NSW 1750, AU",null,null,null,http://www.childcareconcepts.com.au,Childcare Concepts,null,null,Privately Held,null,null,null,null,null,null,2-10 employees,null,https://www.linkedin.com/company/childcare-concepts/,null,null,null,null,null,null,null,null,"North Parramatta, NSW",null,null,"Childcare Concepts is a family run business designed to provide our clients with complete child care business solutions.Our focus in the childcare market is in the buying and selling of:•Child care centres•Childcare land and buildings for sale•Childcare investment•Childcare centre businesses•DA approved land for saleOur consultants are able to visit you and assist you in any facet of running your own centre, from licensing and accreditation to staff in-services and training.We have our own in-house licensed builders to custom build a child care centre to meet your needs. We have specialists that will help every step along the way, from dealing with council for approval all the way through to making sure the right equipment is purchased and installed.Contact us today to speak to a consultant about your child care business needs!",null,null,null,null
null,1986,null,null,null,null,null,null,"35 Cotham Rd, Level 4, Kew, Victoria 3101, AU",null,null,null,http://www.southhavengroup.com.au,South Haven Group,null,null,Privately Held,null,null,null,null,null,null,11-50 employees,null,https://www.linkedin.com/company/south-haven-group/,null,null,null,null,null,null,null,null,"Kew, Victoria",null,null,"Established in 1986, South Haven Group is an integrated property group operating in all phases of the property cycle. We are owners, investors, developers and managers of high quality commercial and residential properties.",null,null,null,null
null,2016,null,AU,null,null,151.13834,null,"Sydney,   AU",null,null,null,https://baseup.com.au/,BaseUp Technologies,null,null,Privately Held,-33.84907,null,null,null,null,null,2-10 employees,null,https://www.linkedin.com/company/baseup-technology/,null,null,null,null,null,null,null,"null, Sydney, null, null, AU",null,Sydney,null,"BaseUp enables property groups and tenants to get the most out of their physical assets. Our platform generates cost recovery, automates management, and creates employee benefits for our clients.Through BaseUp's Parking Management platform, property groups and tenants can manage their parking assets with flexibility and security. BaseUp's world-first access technology lets organisations drive parking utilisation, increase employee retention and reduce their parking costs.BaseUp also provides custom Smart-Building solutions to help enhance all aspects of a client's physical assets. We leverage our in-house hardware expertise and partnerships to develop site-specific solutions for Australia's premier buildings.",null,null,null,null
null,2019,null,null,null,null,null,null,"Level 2, 309 George Street, Sydney, NSW 2000, AU",null,null,null,http://www.isharework.com,iShare Incubator Pty Ltd,null,null,Privately Held,null,null,null,null,null,null,11-50 employees,null,https://www.linkedin.com/company/ishare-incubator/,null,null,null,null,null,null,null,null,"Sydney, NSW",null,null,"ISHARE company is an Australian shared innovative incubation platform. We are dedicated to support young entrepreneurs, provide breeding grounds for young Australian and Chinese with brilliant business ideas. As a leading Chinese-Australian incubator platform in Australia, iShare collaborates with Australian and  Chinese venture capital firms to build commercial financing bridge. We aim to create an innovative, full-service, high-tech ecosystem that combines business, leisure, life, and community to make your startup the next unicorn.",null,null,null,null
0403 341 645,2020,null,null,null,null,null,null,"Brisbane,   AU",null,null,null,https://metrenew.com.au,METrenew,null,null,Privately Held,null,null,null,null,null,null,2-10 employees,null,https://www.linkedin.com/company/metrenew/,null,null,null,null,null,null,null,null,null,null,null,"METrenew is a boutique urban renewal consultancy specialising in precinct development.Our purpose is to drive value creation by delivering place transformation with enduring social and economic benefits. We do this through strategic advisory services to project sponsors and authorities while also collaborating with like minded consultants and development partners.---METrenew's Director Anthony Ellis is a leader in Urban Renewal specialising in Precinct Development. As a Chartered Development and Planning Surveyor, his work has impacted some of Australia’s highest profile projects, delivering tangible social outcomes for future generations.METrenew seeks to be creative, collaborative with a commercial focus to strategically approach and implement politically complex urban regeneration precincts that meet the needs of multiple stakeholders and competing interests.",null,null,null,null
+61 9235 2666,2009,null,null,null,null,null,null,"Level 20 / 68 Pitt Street, Sydney, New South Wales 2000, AU",null,null,null,http://www.cwesydney.com,Cook Wish Ellison,null,null,Partnership,null,null,null,null,null,null,2-10 employees,null,https://www.linkedin.com/company/cook-wish-ellison/,null,null,null,null,null,null,null,null,"Sydney, New South Wales",null,null,"At Cook Wish Ellison we specialise in Bespoke Commercial Leasing. Our unique Hub & Spoke model means only the best of the best in our extensive network, are customised to each project, allowing us to deliver optimum occupancy deals every time.",null,null,null,null
+61 419694539,2016,null,null,null,null,null,null,"Sydney , Sydney Austalia, NSW 2000, AU",null,null,null,http://www.officeta.com.au,Office Tenant Advisory,null,null,Privately Held,null,null,null,null,null,null,2-10 employees,null,https://www.linkedin.com/company/office-tenant-advisory/,null,null,null,null,null,null,null,null,"Sydney Austalia, NSW",null,null,"Office Tenant Advisory specialises in providing office and industrial tenants with independent real estate advice in relation to their property needs. We are a specialist Tenant Advisory / Tenant Representation service provider servicing our clients throughout Australia.Our services include:•	Premises acquisition•	Premises disposal, including sub lease management•	Lease re-structuring i.e. early lease renewals•	Accommodation planning/needs analysis•	Lease administration, i.e. portfolio management•	Market Rent Review representation•	Strategic property advice•	Fit Out Project Delivery•	Tenant Advisor•	Tenant Representation•	Corporate Real Estate•	Corporate Solutions•	Transaction ManagementCurrent projects include:1- We have recently secured a new warehouse of 1,800 sq m for an ASX listed company. The relocation of the warehousing to this new facility will dramatically reduce our clients premises cost. For the same client we have renewed terms for their office lease reducing the the area leased by close to 50%. This is a Sydney based project. 2 - We secured new office premises for Alsco, who relocated from Pymble to Chatswood, into approx 900 sq. m.  3 - We secured a new showroom / office for Konica Minolta, in West Perth. 4 - We are currently representing Houston Kemp on their Sydney Office requirement,.",null,null,null,null
null,2018,null,null,null,null,null,null,"25 Restwell St, Bankstown, New South Wales 2200, AU",null,null,null,http://www.flinderscentrebankstown.com.au,Flinders Centre Bankstown,null,null,Public Company,null,null,null,null,null,null,11-50 employees,null,https://www.linkedin.com/company/flinders-centre-bankstown/,null,null,null,null,null,null,null,null,"Bankstown, New South Wales",null,null,"Flinders Centre Bankstown - a contemporary, efficient and sustainable 9-storey commercial office tower, located right in the heart of the Bankstown CBD, one of the busiest and most ethnically diverse regions in greater Sydney.Located adjacent to Bankstown Sports, occupants will have full access to all of the club’s facilities – including catering and event spaces, and all within easy walking distance of the retail centre and all transport interchanges. Upgrades to the Bankstown train line, as part of the Sydney Metro project, will see commuter travel from Bankstown Station to Central in 28 minutes.The building has been awarded a 5-Star Green Star – Office Design Certified rating, which represents Australian Excellence in building design. Green Star assesses the sustainable design, construction and operation of buildings, fit outs and communities in Australia, encouraging companies to become more environmentally friendly, to create a healthy place for their employees and build a better future for all. Flinders Centre Bankstown is also targeting a 5-star NABERS rating. With spaces from 155 to 8,000 square metres, across 1,350 square metre floor plates – selected leasing opportunities remain within the 12,500 square metres of Flinders Centre Bankstown. The building features 4-sides of natural light, secure parking, end-of-trip facilities, a fitness centre and childcare on-site. To be a part of the Flinders Centre journey, please visit FlindersCentreBankstown.com.au for more information and for lease contact details.",null,null,null,null
null,1998,null,null,null,null,null,null,null,null,null,null,http://commercialpropertyguide.com.au,Commercial Property Guide,null,null,Privately Held,null,null,null,null,null,null,2-10 employees,null,https://www.linkedin.com/company/commercial-property-guide/,null,null,null,null,null,null,null,null,"Beaconsfield, New South Wales",null,null,"Commercial Property Guide is a modern technology commercial property portal that is easy to use  for both buying and leasing commercial real estate in Australia.Discovering commercial real estate - office, retail, industrial or specialised requirements, for lease or for sale has a fresh new approach that is designed to work well on all web devices. .",null,null,null,null
07384 05922,1996,null,null,null,null,null,null,"115 Boundary Street, West End, Brisbane, QLD 4101, AU",null,null,null,http://www.metrofn.com.au/index.cfm?pagecall=searchcommercial&MenuItemID=21674&subject=Commercial,First National Commercial,null,null,Privately Held,null,null,null,null,null,null,11-50 employees,null,https://www.linkedin.com/company/first-national-commercial-metro/,null,null,null,null,null,null,null,null,"Brisbane, QLD",null,null,"First National Commercial is long established in the inner city of Brisbane and our team is competent in leasing or selling your commercial property and development land.First National Commercial Metro agents offer the skills, experience and local knowledge to efficiently manage the full spectrum of commercial property requirements. We are supported by the First National Network with 40 commercial offices in Australia and a wider network of 400 plus residential offices.",null,null,null,null
null,null,null,null,null,null,null,null,"Brisbane, Queensland  AU",null,null,null,http://www.btpinfo.com.au,Business and Technology Precincts by Graystone,null,null,null,null,null,null,null,null,null,null,null,https://www.linkedin.com/company/business-and-technology-precincts/,null,null,null,null,null,null,null,null,null,null,null,"Business and Technology Precincts by Graystone offer companies affordability, accessibility and corporate prestige in three strategic suburban locations. Brisbane Technology Park in Eight Mile Plains is an established precinct located at the junction of the Gateway, Logan and Pacific Motorways.  It is the location of choice for companies at both ends of the spectrum, from small technology-oriented start ups to large established organisations. BTP Northshore Hamilton is an embryonic precinct in a prestigious location, in close proximity to the Australia Trade Coast, International and Domestic airports and only 6km from the CBD. BTP Westlink Green in Darra is an emerging precinct under development in Brisbane's western growth corridor and is strategically positioned adjacent to the Darra station and bus exchange.",null,null,null,null
null,null,null,null,null,null,null,null,"175 Pitt Street, Sydney, NSW 2000, AU",null,null,null,https://www.rcanalytics.com/,Real Capital Analytics Australia,null,null,Privately Held,null,null,null,null,null,null,2-10 employees,null,https://www.linkedin.com/company/real-capital-analytics-australia/,null,null,null,null,null,null,null,null,"Sydney, NSW",null,null,"Real Capital Analytics (RCA) is the authority on the deals, the players and the trends that drive the commercial real estate investment markets. Covering all markets globally, RCA delivers timely and reliable data with unique insight into market participants, pricing, and capital flows. The most active investors, lenders and advisors depend on RCA’s market intelligence to formulate strategy and to source, underwrite and execute deals. An industry pioneer since 2000, RCA has offices in New York, San Jose, London, Amsterdam, Stockholm, Singapore, and Sydney.",null,null,null,null
1300 011 750,2012,null,null,null,null,null,null,"Nerang St, Southport, Queensland 4215, AU",null,null,null,http://www.cospaces.com.au,CoSpaces,null,null,Public Company,null,null,null,null,null,null,2-10 employees,null,https://www.linkedin.com/company/cospaces/,null,null,null,null,null,null,null,null,"Southport, Queensland",null,null,"CoSpaces is a registered Australian Real Estate Agency who specialise in the design, leasing, and community management of flexible commercial work spaces, innovation communities, and events venues.We partner with landlords, developers and Government to deliver innovation spaces and flexible work spaces. Our services include trust accounting, facility and asset management below 5000m2, concierge, membership on-boarding, marketing and events.Looking to find or lease space? We’re here to help.Whether you have a single asset, wider property portfolio, or existing space you’d like to transform into a flexible workspace offering, CoSpaces can provide consultation services to help achieve world-class outcomes. Our experience and advice focus on community scalability and adoption, effective marketing strategies, and facility management procedures so a ROI can be achieved as effectively and efficiently as possible.CoSpaces can help future proof commercial investments by uncovering new customers, diversifying tenant mix, and return higher yields for property owners.",null,null,null,null
null,1997,null,null,null,null,null,null,"Level 4, 2 Barrack Street, Sydney, NSW 2000, AU",null,null,null,http://commercialportfoliomangement.com.au,Commercial Portfolio Management Pty Ltd,null,null,Privately Held,null,null,null,null,null,null,2-10 employees,null,https://www.linkedin.com/company/commercial-portfolio-management-pty-ltd/,null,null,null,null,null,null,null,null,"Sydney, NSW",null,null,"Commercial Portfolio Management Pty Ltd (CPM) was founded in 1997.Working together with the associated valuation firm, Scott Fullarton Valuations Pty Ltd (SFV), CPM is an integrated property management company headquartered at SFV House 2 Barrack Street, Sydney. CPM's core business is the provision of property and facilities management on behalf of, and in collaboration with, asset owners. With a commitment to employing the best staff, and implementing systems and processes that deliver integrated and efficient property services, CPM draws on the extensive experience and industry knowledge of its people to deliver tailored property management solutions.  In essence, CPM is an 'outsider'​, who has 'insider'​ know-how, providing pro-active, tailored solutions for value enhancement, compliance, cost reduction and risk alleviation purposes.Working with major corporations, syndicates and family groups, CPM’s clients include property trusts, syndicates and high net worth individuals.",null,null,null,null
1800121011,2019,null,null,null,null,null,null,"580 Collins St, Lv. 11, Melbourne, Victoria 3000, AU",null,null,null,http://www.11thspace.com,11th Space,null,null,Privately Held,null,null,null,null,null,null,2-10 employees,null,https://www.linkedin.com/company/the-11th-space/,null,null,null,null,null,null,null,null,"Melbourne, Victoria",null,null,"11th Space is a business hub and incubator located in the heart of Melbourne CBD on Collins St. We exist to empower entrepreneurs through our business growth ecosystem and assist aspiring entrepreneurs to launch their business through the NCubation business incubator program. 11th Space is part of the Navanti Holdings group of diversified businesses in Asia and Australia, with a new hub in Jakarta just launched early this year.",null,null,null,null
