Longitude_3,Location_description_3,Longitude_2,Founded,Name,City_2,City_5,City_3,Latitude_2,Address_3,Address_2,Location_description_1,Address_4,Website,Latitude_3,Longitude_0,Latitude_4,Location_description_5,Longitude_5,Headquarter,Type,Location_description_2,Location_description_4,Latitude_5,Linked In URL,Address_0,Longitude_4,Overview,Location,Longitude_1,Location_description_0,Country,Company Size,Latitude_1,Address_5,Address_1,City_0,City_4,Industry,City_1,Phone,Latitude_0
null,null,null,null,BetaShares ETFs,null,null,null,null,null,null,null,null,http://www.betashares.com.au,null,null,null,null,null,null,Privately Held,null,null,null,https://www.linkedin.com/company/betashares/,null,null,"Welcome to the BetaShares LinkedIn page. Follow us for daily ETF industry and macroeconomic insight, thought leadership content, investor education tips, and portfolio strategies.   About BetaShares BetaShares is one of Australia’s leading and award-winning managers of Exchange Traded Funds (ETFs) – simple, low cost and transparent investment products that are traded on the Australian Stock Exchange (ASX). We offer one of the largest and most diverse range of ETFs in Australia, providing investors with access to funds that cover Australian and international shares, fixed income, cash, currencies, commodities and alternative strategies. Our goal is to expand the range of intelligent investment solutions for investors and help them meet their financial goals. As at 31 January 2020, BetaShares manages over $10.5 billion in assets. BetaShares is owned and managed by its Australian based management team along with a strategic shareholding from Mirae Asset Global Investment Group, one of Asia’s largest asset management firms. As at December 2019, Mirae manages over US$146 billion.","Level 11, 50 Margaret Street, Sydney,  2000, AU",null,null,null,51-200 employees,null,null,null,null,null,null,null,null,null
null,null,null,null,Edison Group,null,null,null,null,null,null,null,null,http://www.edisongroup.com,null,null,null,null,null,null,Privately Held,null,null,null,https://www.linkedin.com/company/edison-group-/,null,null,"Edison is an investment research and advisory company, with offices in North America, Europe, the Middle East and AsiaPac. The heart of Edison is our world renowned equity research platform and deep multi-sector expertise. At Edison Investment Research, our research is widely read by international investors, advisors and stakeholders. Edison Advisors leverages our core research platform to provide differentiated services including investor relations and strategic consulting. All interviews have been prepared and issued by Edison for publication globally. View our full disclaimer - http://www.edisoninvestmentresearch.com/disclaimer/client-email-disclaimer Edison is authorised and regulated by the Financial Conduct Authority (www.fsa.gov.uk/register/firmBasicDetails.do?sid=181584).",null,null,null,null,51-200 employees,null,null,null,null,null,null,null,null,null
null,null,null,null,GO Markets,null,null,null,null,null,null,null,null,http://www.gomarkets.com,null,null,null,null,null,"Melbourne, Victoria",Privately Held,null,null,null,https://www.linkedin.com/company/go-markets/,null,null,"GO Markets was founded in 2006 in Melbourne, Australia and is a financial services provider of online Foreign Exchange (Forex) trading services, offering Margin FX, CFD Trading, Cryptocurrencies as well as Binary Options trading to individuals and institutional clients. Widely regarded as the broker that successfully introduced Meta Trader 4 (""MT4""​) to Australian retail traders, we have a qualified team of specialists with in-depth knowledge and invaluable experience with the online trading platform.","Level 22, 600 Bourke Street, Melbourne, Victoria 3000, AU",null,null,null,51-200 employees,null,null,null,null,null,null,null,null,null
null,null,null,null,x15ventures,null,null,null,null,null,null,null,null,http://www.x15ventures.com.au,null,null,null,null,null,"Sydney, NSW",Privately Held,null,null,null,https://www.linkedin.com/company/x15ventures/,null,null,"x15ventures is a dynamic venture-building outfit, powered by CommBank and designed to bring to life the next generation of digital endeavours whose services directly connect to our core business.Through x15ventures we will launch 25 enduring businesses by 2024.By partnering with seasoned entrepreneurs, offering them support, guidance and critical access to our unmatched customer base and distribution networks, we’re not only empowering Australia’s most inspiring innovators, we’re reshaping banking as we know it.","Sydney, NSW 2000, AU",null,null,null,51-200 employees,null,null,null,null,null,null,null,null,null
null,null,null,null,Lendi,null,null,null,null,null,null,null,null,https://www.lendi.com.au,null,null,null,null,null,"Sydney, New South Wales",Privately Held,null,null,null,https://www.linkedin.com/company/lendi/,null,null,"Lendi is Australia’s only home loan platform that was designed with a built-in best interest duty.  By bringing together smart technology and home loan specialist advice on our platform, we’ve been helping Australians compare, apply and settle the right home loan for their needs since 2016. Borrowers are able to search 2,000+ loan products from more than 40 lenders on the Lendi platform to shortlist the best loan products for their circumstances. This unparalleled level of choice helps deliver the best possible customer outcomes while driving competition and transparency in the market. From application to settlement, home loan specialists are on hand to guide borrowers through the mortgage process and help them achieve their long-term financial goals.With home loan settlements of over $12 billion, the team has helped thousands of Australians secure their property dreams. Headquartered in Sydney, Lendi has offices in Melbourne, Brisbane and Perth, however all our staff are currently working remotely.","Level 9, 37 Pitt street, Sydney, New South Wales 2000, AU",null,null,null,201-500 employees,null,null,null,null,null,null,null,null,null
null,null,null,null,BrickX,null,null,null,null,null,null,null,null,http://www.brickx.com,null,null,null,null,null,"Melbourne, VIC",Privately Held,null,null,null,https://www.linkedin.com/company/brickx---the-brick-exchange/,null,null,"Using new thinking and new technology, we’re helping thousands of Aussies break into the property market.Create your free account and start investing at http://www.brickx.com/","L27, 101 Collins St, Melbourne, VIC 3000, AU",null,null,null,11-50 employees,null,null,null,null,null,null,null,null,null
null,null,null,null,Morris Finance,null,null,null,null,null,null,null,null,http://www.morrisfinance.com.au,null,null,null,null,null,"Geelong, Victoria",Public Company,null,null,null,https://www.linkedin.com/company/morris-finance-ltd/,null,null,"Morris Finance are a Finance, Leasing and Risk Management specialist with a strong track record for results across a broad range of industries. We partner with our clients to create results through the intelligent structuring of debt, maximising your business profitability. Add to this a commitment to continuous improvement, knowledge and skills training, resulting in exceptional service delivery. Morris Finance pride themselves in providing competitive business facilities helping you finance new equipment – which in turn boosts the efficiency of your business in the form of increased cash flows and asset backing. In short, we give you the tools your business needs to get ahead.We assist you to manage your risk and help you to reduce the tension between growth opportunities and the limiting factors holding your business back. A structured finance solution, incorporating an optimal debt/capital base will unlock the potential in your business.","237 Ryrie Street, Geelong, Victoria 3220, AU",null,null,null,51-200 employees,null,null,null,null,null,null,null,null,null
null,null,null,null,PayitLater,null,null,null,null,null,null,null,null,http://www.payitlater.com.au,null,null,null,null,null,"Brisbane, Queensland",Privately Held,null,null,null,https://www.linkedin.com/company/payitlater/,null,null,"For Shoppers:With PayItLater, you can make purchases at your favourite online retailers and pay off the purchase over time automatically.We’ve completely integrated with online stores to make on-the-spot credit approvals with no long forms.For Merchants:Getting your store up and running with PayItLater couldn’t be easier.We supply plugins for major e-commerce platforms so you can be offering live deferred payments to your customers within 24 hours.","157 Given Terrace, Level 1, Suite 2, Brisbane, Queensland 4064, AU",null,null,null,2-10 employees,null,null,null,null,null,null,null,null,null
null,null,null,null,Centric Wealth,null,null,null,null,null,null,null,null,http://www.centricwealth.com.au,null,null,null,null,null,"Sydney, NSW",Privately Held,null,null,null,https://www.linkedin.com/company/centric-wealth/,null,null,"Centric Wealth, part of Findex, is a leading wealth management firm, providing our clients with personalised advice and solutions for their complete financial well-being.We believe that clients invest in our advice for a financial return, emotional benefits and as a way to ensure that their best laid plans are not derailed. Clients may access Centric Wealth through offices located in Sydney, Melbourne, Brisbane, Canberra.We know that all of our clients have different financial needs, goals and complexities. In response to this, our advisers work collaboratively with each and every client to provide an individually tailored solution. We provide clients with access to experts across all areas of wealth management so that they get complete financial security. Our areas of expertise include financial planning, investments, superannuation, risk management and insurance, and lending services.We operate using a completely transparent fee structure. Our fee-for-service model ensures that our clients know exactly what they are paying for and can understand the value of advice.Our approach and investment capability structure give our clients unrivaled access to a unique service and product offering. Our aim is to find the right solution for each client. We are careful not to over promise, instead focusing on balancing return with a risk managed approach tailored to suit the individual.","Level 9, 60 Castlereagh Street, Sydney, NSW 2000, AU",null,null,null,201-500 employees,null,null,null,null,null,null,null,null,null
null,null,null,null,Banjo - Business Loans,null,null,null,null,null,null,null,null,https://www.banjoloans.com,null,null,null,null,null,"Richmond, Victoria",Public Company,null,null,null,https://www.linkedin.com/company/banjo-loans/,null,null,"Banjo is an online lender providing secured and unsecured loans to small business.  Our customers are the 51% of small business owners who have no lending product other than a credit card. We provide them with an alternative source of capital to balance cash flow and enable future growth.  We understand that dynamic, innovative businesses often move faster than traditional valuations.  So when considering an application for a loan we look at more than just assets or collateral. We also consider business activity and multiple sources of industry data to obtain a more holistic view of a businesses’ position. As a result, we can approve more loans.  We know the needs of a small business can change from one day to the next. So once approved, our customers have access to an ongoing loan facility and can withdraw additional funds without reapplying.  We see ourselves as partners with our customers. So we never charge early exit fees if a loan is paid off early.  Our loan process has been designed to be as easy as possible, with online applications and a simple fee structure. Loans can be approved in hours and funds deposited within 72 hours.  We recognise that business is much more than just numbers. At the heart of every business is passion, ideas, self-belief and a vision of the future. Our goal is to help you achieve yours.","561 Church St, Level 2, Richmond, Victoria 3121, AU",null,null,null,11-50 employees,null,null,null,null,null,null,null,null,null
null,null,null,null,mx51,null,null,null,null,null,null,null,null,http://www.mx51.io,null,null,null,null,null,null,Privately Held,null,null,null,https://www.linkedin.com/company/mx51/,null,null,"We empower our partners to connect seamlessly with merchants and their customers. mx51 is the first Australian fintech to develop a bank-grade, modern, end-to-end Payment as a Service platform. With deep knowledge of merchant acquiring and scalable payments technology, we can help our partners thrive globally in a disruptive world.",null,null,null,null,51-200 employees,null,null,null,null,null,null,null,null,null
null,null,null,null,Underhill consulting,null,null,null,null,null,null,null,null,http://www.anchorbusiness.com.au,null,null,null,null,null,"Perth, Western Australia",Sole Proprietorship,null,null,null,https://www.linkedin.com/company/afg/,null,null,Anchor Business services helps Financial Services Licence holders of all sizes with their compliance obligations. Shirley Elliot holds over 12 years of compliance and regulatory experience in Credit and Financial Planning. In her years of experience Shirley has worked with businesses of various scales in compliance and risk management.,null,null,null,null,0-1 employees,null,null,null,null,null,null,null,null,null
null,null,null,null,loans.com.au,null,null,null,null,null,null,null,null,http://loans.com.au,null,null,null,null,null,"Brisbane, QLD",Privately Held,null,null,null,https://www.linkedin.com/company/loans.com.au/,null,null,"loans.com.au is one of Australia's leading online lenders, helping Australians buy their dream home & car.At loans.com.au, the customer is everything. We believe that great products and excellent service is something that’s been lacking in this industry for too long. This is something we are changing.Our products are designed and priced to meet your needs at the lowest cost while our customer focussed team is dedicated to you. Importantly, we run our own call centre; we don’t outsource our service because it's important we are able to offer you the highest quality service available, instead of compromising our standards by chasing the lowest cost option.If you are paying too much or getting poor service elsewhere, put us to the test and find out why you don’t have to tolerate the impersonal service and high fees charged by the banks.Visit loans.com.au for further information or call us on 13 10 90.","123 Eagle St, Brisbane, QLD 4000, AU",null,null,null,51-200 employees,null,null,null,null,null,null,null,131090,null
null,null,null,null,Altus Financial,null,null,null,null,null,null,null,null,http://www.altusfinancial.com.au,null,null,null,null,null,"SYDNEY, NSW",Privately Held,null,null,null,https://www.linkedin.com/company/altus-financial/,null,null,"With over 30 years in the personal financial and SME business advice profession, the Altus brand has emerged as one that is well respected through the industry. The leaders of the firm have diverse roots and experience, some beginning their careers in the Big 4 accountancy firms and others from financial planning and business advisory backgrounds.The idea behind the Altus name was that the Latin word “Altus” literally means “high and deep”. To us, this symbolises the high level of trust, depth and quality of relationship our clients seek and value highly.The purpose of our company is to make a positive difference to our clients’ financial outcomes. To do that we deliver a breadth of specialised financial advice tailored to every stage of our clients’ financial journey - whether that is as an individual or a business.Rod Dickinson, Matthew W.B. Smith, Adam Montana, Karen Doutty, Altus Financial Pty Limited (ABN 62 081 162 843) are Authorised Representatives of Apogee Financial Planning Limited. (ABN 28 056 426 932), an Australian Financial Services Licensee (AFSL no. 230689) with registered offices at 105-153 Miller Street, North Sydney, NSW 2060 and a member of the National Australia group of companies. Products and services offered by Altus Accounting are not authorised by Apogee Financial Planning. Apogee Financial Planning is not responsible for the advice, products and services provided by Altus Accounting. Julie Azzi is a credit representative (CR No. 366834) of BLSSA Pty Ltd ABN 69 117 651 760 (Australian Credit Licence 391237). View our Legal information here - https://www.altusfinancial.com.au/legal-altus-financial","Level 12, 10 Spring Street, SYDNEY, NSW 2000, AU",null,null,null,51-200 employees,null,null,null,null,null,null,null,89083444,null
null,null,null,null,Sustainable Australia Fund,null,null,null,null,null,null,null,null,http://www.sustainableaustraliafund.com.au,null,null,null,null,null,"MELBOURNE, Vic",Privately Held,null,null,null,https://www.linkedin.com/company/sustainable-australia-fund/,null,null,"The Sustainable Australia Fund is Australia’s leading provider of Environmental Upgrade Finance. We provide up to 100% of the capital needed by businesses wanting to upgrade their energy infrastructure and unlock efficiencies and environmental outcomes.We believe that every dollar we invest will improve our customers’ cash flow while making the world a better place.The City of Melbourne established the Sustainable Melbourne Fund in 2002 as a revolving loan fund to invest in delivering triple bottom line outcomes. The establishment of the SMF at the time demonstrated the City of Melbourne’s leadership in pursuing its eco-city vision.In 2019 SMF was recapitalised and scaled, supported by Bank Australia, to drive environmental upgrades at a national scale. As a result, the Sustainable Melbourne Fund was renamed the Sustainable Australia Fund.","Level 5, 225 Bourke St, MELBOURNE, Vic 3000, AU",null,null,null,2-10 employees,null,null,null,null,null,null,null,1300 432 044,null
null,null,null,null,Moneysoft AU,null,null,null,null,null,null,null,null,http://www.moneysoft.com.au,null,null,null,null,null,null,Public Company,null,null,null,https://www.linkedin.com/company/moneysoft-au/,null,null,"Moneysoft is an automated personal financial management solution, allowing financial professionals and their clients, to collaborate in the areas of cash-flow, budgeting and financial goal tracking. A dynamic approach to money management allows the Moneysoft platform to provide one single-view across their client’s financial data. By providing a user-friendly tool with real-time information, Moneysoft allows Clients to effectively budget, manage their cash-flow and control their household finances. It also allows trusted advisers to empower clients, to make smarter financial decisions and to share the responsibility of achieving their financial independence.Improve the accuracy of your adviceIncrease client engagement and be ahead of regulatory changeIdentify more opportunitiesImprove profitabilityDownload our introductory eBook at moneysoft.com.au, to find out more. http://www.moneysoft.com.au/ebook-cashflow-as-a-service/","Sydney,   AU",null,null,null,11-50 employees,null,null,null,null,null,null,null,null,null
null,null,null,null,Bell Direct,null,null,null,null,null,null,null,null,http://www.belldirect.com.au,null,null,null,null,null,"Sydney, New South Wales",Public Company,null,null,null,https://www.linkedin.com/company/bell-direct/,null,null,"At Bell Direct you get everything you need to trade smart - a great website, access to research, trading tools and value for money trades.But you also get a bunch of smarter features you can't get from any other online broker, like:•	Real broker research•	Streaming data•	6 trading ideas every day•	Strategy builder and technical insights charting•	Multi order pad•	Free conditional orders•	Mobile trading on any smartphone•	Free comprehensive tax reportsFor more information, visit our website at https://www.belldirect.com.au/","GPO Box 1630, Sydney, New South Wales 2001, AU",null,null,null,51-200 employees,null,null,null,null,null,null,null,1300 786 199,null
null,null,null,null,Clean Energy Finance Corporation,null,null,null,null,null,null,null,null,http://www.cefc.com.au,null,null,null,null,null,"Sydney, NSW",Government Agency,null,null,null,https://www.linkedin.com/company/clean-energy-finance-corporation/,null,null,"The CEFC has a unique role to increase investment in Australia’s transition to lower emissions. With the backing of the Australian Government, we invest to lead the market, operating with commercial rigour to address some of Australia’s toughest emissions challenges – in agriculture, energy generation and storage, infrastructure, property, transport and waste. We’re also proud to back Australia’s cleantech entrepreneurs through the Clean Energy Innovation Fund, and invest in the development of Australia’s hydrogen potential through the Advancing Hydrogen Fund. With $10 billion to invest on behalf of the Australian Government, we work to deliver a positive return for taxpayers across our portfolio. www.cefc.com.au","Level 17, 1 Bligh Street, Sydney, NSW 2000, AU",null,null,null,51-200 employees,null,null,null,null,null,null,null,null,null
null,null,null,null,HESTA,null,null,null,null,null,null,null,null,http://www.hesta.com.au,null,null,null,null,null,"Melbourne, VIC",Privately Held,null,null,null,https://www.linkedin.com/company/hesta-superannuation/,null,null,"HESTA is the industry super fund for health and community services. Since 1987, HESTA has grown to become the largest super fund dedicated to this sector.HESTA has a history of strong, long-term returns. We keep fees low, and we don’t pay commissions to financial advisers.We're also committed to providing outstanding member benefits, and helping members take control of their future with quality education and advice about super. The Board is made up of representatives from the industry’s employer and employee organisations. This helps us to make sure we continue to provide super education and advice services that are relevant to our members'​ particular needs.General information: We’ll do our best to ensure the postings on our page are workplace appropriate. Since we can’t monitor every posting or conversation, we expect users will not post content that falls into the following categories & reserve the right to remove postings that are:•	abusive, defamatory, or obscene•	fraudulent, deceptive or misleading•	in violation of any intellectual property right of another•	in violation of any law or regulation•	otherwise offensive•	suggestive of or promoting third-party products or services.While we actively monitor activity on this page you may prefer to communicate directly. Please call 1800 813 327 or email hesta@hesta.com.au Disclaimer: It’s important to note that comments on this page are not the opinions of H.E.S.T. Australia Ltd, nor do we confirm their accuracy. All information provided by LinkedIn is handled in accordance with our privacy policy https://www.hesta.com.au/privacy-policy.html© Issued by H.E.S.T. Australia Ltd ABN 66 006 818 695 AFSL No. 235249, the Trustee of Health Employees Superannuation Trust Australia (HESTA) ABN 64 971 749 321.","Melbourne, VIC 3000, AU",null,null,null,201-500 employees,null,null,null,null,null,null,null,null,null
null,null,null,null,illion,null,null,null,null,null,null,null,null,http://www.illion.com.au,null,null,null,null,null,"Melbourne, VIC",Privately Held,null,null,null,https://www.linkedin.com/company/illion/,null,null,"illion (formerly trading as Dun & Bradstreet) is the leading independent provider of trusted data and analytics products and services in Australasia, with the company’s consumer and commercial credit registries representing a core element of Australia and New Zealand’s financial infrastructure.illion leverages its consumer and commercial credit registries, which comprise data on over 20 million individuals and over 2.5 million active companies, to provide end-to-end customer management solutions to clients in the financial services, telecommunications, utilities and government sectors.illion's product and service offering spans the full customer lifecycle, from lead generation and sales prospecting, to credit risk assessment and decisioning (including associated SaaS products), and, ultimately, receivables management.illion is headquartered in Melbourne with offices in all major metropolitan cities across Australia and New Zealand. Our team of nearly 1,000 work with the leading brands in our region to bring data & analytics to life.",null,null,null,null,"501-1,000 employees",null,null,null,null,null,null,null,null,null
