Phone,Founded,Longitude_4,Country,Location_description_5,Location_description_0,Longitude_0,Latitude_2,Location,City_3,Location_description_4,Longitude_5,Website,Name,Address_5,Location_description_2,Type,Latitude_0,Location_description_1,Latitude_4,City_4,Latitude_1,City_2,Company Size,Address_3,Linked In URL,City_5,Latitude_3,Address_4,Longitude_3,Industry,Location_description_3,Address_2,Address_0,Headquarter,City_0,Longitude_1,Overview,Longitude_2,Latitude_5,City_1,Address_1
02 9017 1100,null,null,null,null,null,null,null,null,null,null,null,http://www.dexus.com,Dexus,null,null,Public Company,null,null,null,null,null,null,"501-1,000 employees",null,https://www.linkedin.com/company/dexus-property-group/,null,null,null,null,null,null,null,null,"Sydney, NSW",null,null,"Dexus is one of Australia’s leading real estate groups, managing a high quality Australian property portfolio valued at $32.0 billion. We believe that the strength and quality of our relationships is central to our success and are deeply committed to working with our customers to provide spaces that engage and inspire. We invest only in Australia, and directly own $16.5 billion of office and industrial properties. We manage a further $15.5 billion of office, retail, industrial and healthcare properties for third party clients. The group’s $10.4 billion development pipeline provides the opportunity to grow both portfolios and enhance future returns. With 1.8 million square metres of office workspace across 51 properties, we are Australia’s preferred office partner. Dexus is a Top 50 entity by market capitalisation listed on the Australian Securities Exchange (trading code: DXS) and is supported by 29,000 investors from 21 countries. With 36 years of expertise in property investment, development and asset management, we have a proven track record in capital and risk management, providing service excellence to tenants and delivering superior risk-adjusted returns for investors.",null,null,null,null
null,2015,null,null,null,null,null,null,"Level 4, 1341 Dandenong Road, Chadstone, Victoria 3148, AU",null,null,null,http://vicinity.com.au,Vicinity Centres,null,null,Public Company,null,null,null,null,null,null,"1,001-5,000 employees",null,https://www.linkedin.com/company/vicinity_centres/,null,null,null,null,null,null,null,null,"Chadstone, Victoria",null,null,"From your favourite local to international retail destinations, Vicinity Centres is a world leader in retail asset management. Vicinity enriches the communities we serve; giving Australians the shopping experience they want. With 63 retail centres owned and managed across Australia, more than 7,700* tenants generating annual retail sales of some $16.8 billion*, 2.5 million* square metres of lease space, Vicinity is an industry leader, respected employer and valued community partner. *As at 31 December 2018",null,null,null,null
null,1971,null,null,null,null,null,null,"Level 51, 19 Martin Place, Sydney, NSW 2000, AU",null,null,null,http://www.gpt.com.au,The GPT Group,null,null,Public Company,null,null,null,null,null,null,201-500 employees,null,https://www.linkedin.com/company/gpt-group/,null,null,null,null,null,null,null,null,"Sydney, NSW",null,null,"The GPT Group is one of Australia’s largest diversified property groups and a top 50 ASX listed company by market capitalisation. GPT owns and manages a $24.8 billion portfolio of retail, office and logistics property assets across AustraliaThe Group owns and manages some of Australia’s most iconic real estate assets, including Australia Square in Sydney, Melbourne's Highpoint Shopping Centre and Melbourne Central and Brisbane's ONE ONE ONE Eagle Street. The Group’s capabilities include a full range of property expertise and GPT employs industry specialists with dedicated teams across investment management, funds management, development, sustainability, asset management and capital transactions.To view current vacancies at GPT please go to: http://www.gpt.com.au/about-us/careers",null,null,null,null
null,null,null,null,null,null,null,null,null,null,null,null,https://www.schiavello.com,Schiavello,null,null,Privately Held,null,null,null,null,null,null,"1,001-5,000 employees",null,https://www.linkedin.com/company/schiavello/,null,null,null,null,null,null,null,null,null,null,null,"Schiavello is a top 100 private, Australian-born, international furniture, construction, consulting and development business that has been creating and servicing world-class working and living environments for over 50 years. Schiavello has built on a foundation of traditional values and future-thinking dedicated to a legacy of relationships and places that add value to peoples' lives.Since 1966, Schiavello has worked with thousands of brands across a wide range of industries including workspace, hospitality, health, retail, residential and education. Through a culture of learning and entrepreneurship, Schiavello continuously challenges thinking and work collaboratively to drive innovation and deliver the best possible outcome.Follow us on: Facebook @schiavellogroup Twitter @schiavellogroup Instagram @schiavelloconstruction & @schiavellofurniture",null,null,null,null
null,1979,null,null,null,null,null,null,null,null,null,null,https://www.secureparking.com.au,Secure Parking,null,null,Public Company,null,null,null,null,null,null,"10,001+ employees",null,https://www.linkedin.com/company/secure-parking/,null,null,null,null,null,null,null,null,"North Sydney, NSW",null,null,"SECURE PARKING IS PROUD TO BE A PART OF THE LARGEST, GLOBALLY RENOWNED PARKING ORGANISATION – PARK24.As part of a Tokyo Stock Exchange listed business with a market capitalisation of over A$6 billion, Secure Parking is transforming into a global leader of innovative technological advancement that brings a wealth of new thinking and opportunities to the Australian and New Zealand market.We are not the Secure Parking you know. We are a leading service provider that consistently delivers, being a welcome part of the customer journey.We know that our culture defines us and separates us from the competitors. Our values drive the decisions we make and how we lead from the front.OUR VISIONBy 2022, we want to be the leader in the markets we operate – as judged by the customers we serve.We will achieve this position by ensuring a seamless experience across every step of the customer journey.PARK24 AT A GLANCE•	Park24 is one of the world’s largest car park operators.•	Listed on Tokyo Stock Exchange, valued at over A$6 billion.•	Over 23,000 car parks comprising over 1.4 million bays.•	7,000 employees across Japan, Korea, Taiwan, Australia, New Zealand, United Kingdom, Malaysia and Singapore.•	Key services include car park operation, car rental and car sharing services.OUR VALUESPeople First - We build enduring relationships. We want to build a long term sustainable relationships.Integrity - We do the right thing and we do what we say. We will deliver on any commitment we make.Resilience - We see things through to the end, learn from our mistakes and embrace change. We strive to continually deliver the best outcomes for stakeholders.Daring - We are not afraid to challenge the status quo.Passionate We believe in what we do and will stand up for what matters.ALL ENQUIRIESPhone: 1300 727 483Web: www.secureparking.com.au",null,null,null,null
03 8782 3777,2004,null,null,null,null,null,null,"Level 2, 66 Victor Crescent, Narre Warren, Victoria 3805, AU",null,null,null,http://www.waterman.com.au,Waterman Business Centres,null,null,Privately Held,null,null,null,null,null,null,11-50 employees,null,https://www.linkedin.com/company/watermanbusinesscentres/,null,null,null,null,null,null,null,null,"Narre Warren, Victoria",null,null,"In a fast paced, ever changing world, people can now work from pretty much anywhere. Home can be unproductive and lonely, while typical office space is inflexible, boring and expensive.Welcome to a revolution in business. Welcome to Waterman, a place to work, connect, collaborate and create with like-minded people.Waterman supports all business ventures by offering spaces to suit all workplace needs. Small through to large office spaces, meeting rooms, permanent and hot desks, lush green, light-filled atriums, and lightning fast internet are just a few ways Waterman can change your working world for the better. Networking, social opportunities and a feeling of community will inspire your desire to go create something remarkable.",null,null,null,null
0746362688,null,null,null,null,null,null,null,"251 - 291 Ruthven Street , Toowoomba, Queensland 4350, AU",null,null,null,https://themillsprecinct.com.au/,The Mills Precinct,null,null,Privately Held,null,null,null,null,null,null,11-50 employees,null,https://www.linkedin.com/company/the-mills-precinct/,null,null,null,null,null,null,null,null,"Toowoomba, Queensland",null,null,"GET READY FOR A UNIQUE CREATION OF INNER CITY LIVING, WORKING AND COMMUNITY LIFE WITH VIBRANCYThe Mills Precinct will be a dedicated urban redevelopment like no other.  Offering interactive work, lifestyle and shopping spaces for locals and tourists, it will be the preferred venue for events, accommodation and living experiences.  The Mills Precinct will offer urban design of the highest quality along with integration to its unique position and history.With a connection to the Railway Parklands and West Creek, The Mills Precinct will be easily accessible with ample parking and interactive walkways.",null,null,null,null
+61 8 6280 1130,2020,null,null,null,null,null,null,"531 Hay St, Unit 15B, Subiaco, Western Australia 6008, AU",null,null,null,http://www.transactinvestments.com,Transact Investments,null,null,Privately Held,null,null,null,null,null,null,2-10 employees,null,https://www.linkedin.com/company/transact-investments/,null,null,null,null,null,null,null,null,"Subiaco, Western Australia",null,null,"Transact Investments is the efficient link between qualified buyers and experienced commercial real estate agents with the core objective of successfully sourcing, securing, negotiating and settling the transaction of commercial real estate properties nationally.Transact Investments is for all types of buyers ranging from individuals right through to institutional buyers and allows for the buyer to confidentially provide specific and detailed investment mandate criteria that aligns with their investment strategies.Transact Investments has many automated processes that provides updates and prompts both the buyer and the agent about the status of their investment mandate.Transact Investments seeks to increase the number of sales transactions and is designed to be an extension of buyer’s resources to seek commercial real estate that they otherwise may not have access too or do not have the time to source.Transact Investments is a FREE platform that incurs no cost to the buyer even after a successful sale is concluded. All commercial agents are retained by their sellers for any commission fees due and payable.",null,null,null,null
0490 854 836,2018,null,AU,null,null,145.01105,null,"58 Main St, Croydon, Victoria 3136, AU",null,null,null,http://www.croydoncoworking.com.au,Croydon Coworking Space,null,null,Sole Proprietorship,-37.803425,null,null,null,null,null,0-1 employees,null,https://www.linkedin.com/company/croydoncoworking/,null,null,null,null,null,null,null,"58 Main St, Croydon, Victoria, 3136, AU","Croydon, Victoria",Croydon,null,"The Croydon Coworking Space is now open and offering you great opportunities like flexible workstation options, private meeting spaces, and access to business development and networking events, from as little as $60 per week and all in the fantastic location of Croydon Main St.Let us help you take your business to the next level and check us out in person by booking an inspection so you can see for yourself!",null,null,null,null
null,null,null,null,null,null,null,null,"58-62 Water Street, South Toowoomba, QLD 4350, AU",null,null,null,http://www.kokollective.com.au,Ko Kollective,null,null,Privately Held,null,null,null,null,null,null,0-1 employees,null,https://www.linkedin.com/company/ko-kollective/,null,null,null,null,null,null,null,null,"South Toowoomba, QLD",null,null,"Ko Kollective - Toowoomba's Business Hub and Co-Working Space is perfect for everything business related. We've got private offices and desks for rent. Boardroom, Meeting Room and a Training Room for hire.",null,null,null,null
null,2020,null,null,null,null,null,null,"185 Grote St, Adelaide Central Business District, South Australia 5000, AU",null,null,null,https://theconsortium.com.au,The Consortium,null,null,Privately Held,null,null,null,null,null,null,2-10 employees,null,https://www.linkedin.com/company/the-consortium-coworking/,null,null,null,null,null,null,null,null,"Adelaide Central Business District, South Australia",null,null,"Welcome to The Consortium. Originating in 1919 as a beloved pub named the Sportsman’s Hotel, this iconic structure eventually became home to Alby Turner & Son Kitchens before its conversion to a coworking space began in 2019. 185 Grote Street is a place for those warmed by tradition but operate in the future, where old school opulence meets modern amenities and ideas. A coworking space like no other in Adelaide, The Consortium offers flexible leasing and a place to elevate your work. The Consortium has the best in audio visual technology, conference facilities, concierge, mail services, virtual office features and is part of the 10GIG Adelaide fibre optic network. We ensure your business is at peak productivity in an ultra-connected environment. The Consortium isn’t shy about being sharp on aesthetics. Our grand boardroom sets the scene for great decisions – a place to make deals and build teams. Our sleek office stylings can be personalised to your business’s needs, and when you need a break from the screen, savour the view from our 80sqm balcony or our private courtyard. The Consortium gives you more hours in the day to grow and create within a community dedicated to fostering growth and inspiration in the City of Adelaide.",null,null,null,null
0447777744,null,null,null,null,null,null,null,"217/14 Lexington Dr, Bella Vista, New South Wales 2153, AU",null,null,null,http://www.colabspaces.com.au,Colab Spaces,null,null,Privately Held,null,null,null,null,null,null,11-50 employees,null,https://www.linkedin.com/company/colab-spaces/,null,null,null,null,null,null,null,null,"Bella Vista, New South Wales",null,null,"Complex Office Needs.Simplified.We remove the stress, commitment, and costs associated with office solutions.Wi-Fi, ergonomic desks & chairs, kitchen, 24/7 security, printing, lockers, mail & more",null,null,null,null
+61 447 499 999,2006,null,null,null,null,null,null,null,null,null,null,http://www.retailogic.com.au,retaiLOGIC,null,null,Privately Held,null,null,null,null,null,null,2-10 employees,null,https://www.linkedin.com/company/retailogic/,null,null,null,null,null,null,null,null,"Brisbane, Queensland",null,null,"retaiLOGIC is an independent property advisor specialising in shopping centre leasing including new leases, renewals & project leasing.                              We also specialise in all premises procurement both freehold & leasehold negotiations.  Tenancy representation – store expansion program, lease renewals & closures (exit strategy)For the past 13 years we have assisted in tenant restructures of various national retail chains.",null,null,null,null
null,null,null,AU,null,null,153.40938,null,"Molendinar, QLD 4214, AU",null,null,null,http://www.myfloor.net.au/,My Floor - Polished Concrete Brisbane,null,null,Government Agency,-27.994457,null,null,null,null,null,11-50 employees,null,https://www.linkedin.com/company/myfloorbrisbane/,null,null,null,null,null,null,null,"null, Molendinar, QLD, 4214, AU","Molendinar, QLD",Molendinar,null,My Floor is a family owned and operated company who carries out decorative concrete finishes to residential and commercial projects around brisbane and the gold coast,null,null,null,null
null,2012,null,AU,null,null,151.13834,null,"313 Chapel Road South , Bankstown, NSW 2166, AU",null,null,null,http://www.313plaza.com.au,313 Plaza,null,null,Privately Held,-33.84907,null,null,null,null,null,2-10 employees,null,https://www.linkedin.com/company/313-plaza/,null,null,null,null,null,null,null,"313 Chapel Road South , Bankstown, NSW, 2166, AU","Bankstown, NSW",Bankstown,null,"Welcome to 313 Plaza, a lifestyle and cultural shopping centre in the heart of Bankstown. Our current featured businesses are restaurants, hair salons, remedial massage and more. 313 Chapel Road South BankstownEmail us at info@313plaza.com.au",null,null,null,null
0405348905,2007,null,AU,null,Headquarters,153.01831,null,"Level 20, 300 Queen Street, Brisbane, Queensland 4000, AU",null,null,null,http://www.allport.net.au,Allport,null,null,Sole Proprietorship,-27.47126,null,null,null,null,null,2-10 employees,null,https://www.linkedin.com/company/allport/,null,null,null,null,null,null,null,"Level 20, 300 Queen Street, Brisbane, Queensland, 4000, AU","Brisbane, Queensland",Brisbane,null,"Office LeasingAt Your ServiceOur goal of a growing and progressive commercial property group in the Brisbane market automatically assumes that our success is congruent with your success. This is to say, decreasing vacancy and creating full occupancy, while all along providing quality advice on how to lease at the highest possible price and solving any barriers to doing this.Our policy is to exhaust all possible avenues to lease your property and fulfill your required goals. Our processes utilise up to date market information on tenants and we endeavour to exhaust all marketing initiatives to lease your property. We also know how to approach a property and solve it’s problems.We are always undertaking new initiatives to forge ahead in any current market. Our programmes while being primarily focussed upon expansion assumes our success is translated to your success. We have an inherent common goal; our business success equals your required objectives.We are not complacent in our leasing, being proactive rather than responsive is our company intention.",null,null,null,null
null,null,null,AU,null,null,134.3547,null,"Nowra,   AU",null,null,null,null,Joanne Matthews,null,null,Privately Held,-25.574999,null,null,null,null,null,2-10 employees,null,https://www.linkedin.com/company/joanne-matthews/,null,null,null,null,null,null,null,"null, Nowra, null, null, AU",null,Nowra,null,null,null,null,null,null
null,2011,null,AU,null,null,153.01831,null,"488 Queen Street, Level 9, Brisbane, QLD 4000, AU",null,null,null,http://cgadevelopments.com.au/,CGA Developments,null,null,Privately Held,-27.47126,null,null,null,null,null,null,null,https://www.linkedin.com/company/cga-developments/,null,null,null,null,null,null,null,"488 Queen Street, Brisbane, QLD, 4000, AU","Brisbane, QLD",Brisbane,null,"CGA Developments is a nationwide property developer. We offer strategic development services within residential, commercial, industrial and mixed use sectors. Our teams manage all stages of the development process from acquisition to completion delivering the best outcome for all stakeholders. We achieve this through our trusted core processes:-Extensive and thorough parameter research-Comprehensive feasibility analysis-Detailed due dilligence-Complete project management services-Marketing and sales management Our ability to create custom-built packages to suit individual needs and requirements sets us apart from other property developers. Managing developments of all sizes, from the humble splitter block through to 1000 lot subdivisions, our proven experience facilitates solutions for all circumstances and scenarios.Contact us if you’re interested in any of the above services or would like to be involved in a syndicate, joint venture or partnership.Call: 1800 240 262 orEmail: admin@cga.info",null,null,null,null
null,2014,null,AU,null,null,151.13834,null,"Miranda, Sydney, NSW 2228, AU",null,null,null,http://pfiam.com,Property + Facilities Investment Asset Management,null,null,Self-Employed,-33.84907,null,null,null,null,null,0-1 employees,null,https://www.linkedin.com/company/property-facilities-investment-asset-management/,null,null,null,null,null,null,null,"Miranda, Sydney, NSW, 2228, AU","Sydney, NSW",Sydney,null,"Appraisals | Asset registers | AdviceProperty, Plant and Equipment consulting around asset inventory & management, life cycle costing, PPA/capital allowances, tax/depreciation, financial reporting, due diligence, finance, M&A, buying/selling, insurance, litigation, forensic, lease, sinking fund budget forecasting, property assessment, condition audit, dilapidation, depreciation, shared facility/strata apportioning, maintenance planning, cost segregation.",null,null,null,null
null,2014,null,null,null,null,null,null,null,null,null,null,http://faithcleaners.com.au/,Faith Cleaners,null,null,Public Company,null,null,null,null,null,null,11-50 employees,null,https://www.linkedin.com/company/faithcleaners/,null,null,null,null,null,null,null,null,"Cable Beach, Western Australia",null,null,"The Total Home Cleaning system was founded on the principle that cleaning your home should be done the way you would do it, if you had the time.",null,null,null,null
null,2010,null,AU,null,"Brisbane, QLD, 4000, Australia",153.01831,null,"Australia Ct, Newport, Queensland 4020, AU",null,null,null,https://oopscleaning.com.au/,Oops Cleaning Services,null,null,Public Company,-27.47126,null,null,null,null,null,51-200 employees,null,https://www.linkedin.com/company/oops-cleaning-services/,null,null,null,null,null,null,null,"Australia Ct, Newport, Queensland, 4020, AU","Newport, Queensland",Newport,null,"Oops is the no.1 cleaning company in Brisbane. We are known for delivering our best and professional cleaning services. We deliver all cleaning service like carpet, Mattress, Duct, curtain Etc overall we have solution for all cleaning problems. We have qa team of professional Workers who are known for delivering its professional service.",null,null,null,null
null,null,null,null,null,null,null,null,"245 St Kilda Road, St Kilda, VIC 3182, AU",null,null,null,https://www.coworkme.com.au/the-better-alternative-to-a-commercial-office-lease/,Comercial or Coworking?,null,null,null,null,null,null,null,null,null,null,null,https://www.linkedin.com/company/coworkme-vs-commercial/,null,null,null,null,null,null,null,null,null,null,null,"CoWorking is the low-risk and cost-effective alternative when a long-term commercial lease isn't the ideal option.CoWork Me can provide you with a short-term and private office space with minimal setup costs, so you can move right in and continue to operate with limited downtime.Memberships include the following:- Month-to-month agreements- Access to meeting rooms  and modern and stylish facilities- Instant access to a furnished and move-in-ready offices for 1 to 100 people- 1 monthly membership fee that covers, utilities, internet, amenities and printing- Mail & receptionist services- A St Kilda Road business address- 24/7 access to your own private office- Secure onsite parking*- Super fast internet",null,null,null,null
null,2008,null,AU,null,null,145.01105,null,"Melbourne, Victoria 3142, AU",null,null,null,http://jalamasse@bigpond.com,"JAC investment Pty, Ltd",null,null,Sole Proprietorship,-37.803425,null,null,null,null,null,2-10 employees,null,https://www.linkedin.com/company/jacinvestmentptyltd/,null,null,null,null,null,null,null,"null, Melbourne, Victoria, 3142, AU","Melbourne, Victoria",Melbourne,null,Property investments in France and Australia.Find the right property to invest in.Development and business ownership.Specialise in commercial in Australia.Residential in France.,null,null,null,null
null,2015,null,AU,null,null,153.40938,null,"PO BOX 4859, Robina, Queensland 4223, AU",null,null,null,http://nextbusinesssales.com.au,Next Business Sales,null,null,Sole Proprietorship,-27.994457,null,null,null,null,null,2-10 employees,null,https://www.linkedin.com/company/next-business-sales/,null,null,null,null,null,null,null,"PO BOX 4859, Robina, Queensland, 4223, AU","Robina, Queensland",Robina,null,"Business for Sale - Selling a BusinessWhere genuine business sellers connect with qualified buyers.See updated business for sale listings.",null,null,null,null
null,2017,null,AU,null,null,144.67072,null,"Corner Taylors Road and Saric Court, Plumpton, Victoria 3335, AU",null,null,null,http://www.plumptonviews.com.au,Plumpton Views,null,null,Privately Held,-37.73536,null,null,null,null,null,2-10 employees,null,https://www.linkedin.com/company/plumpton-views/,null,null,null,null,null,null,null,"Corner Taylors Road and Saric Court, Plumpton, Victoria, 3335, AU","Plumpton, Victoria",Plumpton,null,"Plumpton Views.Corner Taylors Road and Saric Court Plumpton Victoria 3335Welcome to Plumpton Views Developments featuring a picturesque landscape of hills and mature trees that grace the community, creating a lush haven, only minutes from the many conveniences of shopping centres, schools, colleges, entertainment and sporting fields of Caroline Springs. With a selection of single and double storey house and land packages, Plumpton Views offers a variety of homes to suit every family with affordable prices and quality life style.Contact us today to find out more!www.plumptonviews.com.au",null,null,null,null
null,null,null,AU,null,null,145.01105,null,"Kooyong Rd, Caulfield North, Victoria 3161, AU",null,null,null,null,Sportnett,null,null,Government Agency,-37.803425,null,null,null,null,null,"5,001-10,000 employees",null,https://www.linkedin.com/company/sportnett/,null,null,null,null,null,null,null,"Kooyong Rd, Caulfield North, Victoria, 3161, AU","Caulfield North, Victoria",Caulfield North,null,null,null,null,null,null
