Phone,Founded,Longitude_4,Country,Location_description_5,Location_description_0,Longitude_0,Latitude_2,Location,City_3,Location_description_4,Longitude_5,Website,Name,Address_5,Location_description_2,Type,Latitude_0,Location_description_1,Latitude_4,City_4,Latitude_1,City_2,Company Size,Address_3,Linked In URL,City_5,Latitude_3,Address_4,Longitude_3,Industry,Location_description_3,Address_2,Address_0,Headquarter,City_0,Longitude_1,Overview,Longitude_2,Latitude_5,City_1,Address_1
null,null,null,AU,null,null,153.40938,null,"107 Ferry Rd, Southport, Queensland 4215, AU",null,null,null,https://www.brickworkscentre.com.au/,Brickworks Centre,null,null,Partnership,-27.994457,null,null,null,null,null,11-50 employees,null,https://www.linkedin.com/company/brickworks-centre/,null,null,null,null,null,null,null,"107 Ferry Rd, Southport, Queensland, 4215, AU","Southport, Queensland",Southport,null,"Boutique shopping precinct on the Gold Coast. Explore the carefully curated selection of food, fashion, homewares & art.",null,null,null,null
null,2002,null,null,null,null,null,null,"Brisbane,   AU",null,null,null,https://bneclean.com.au,BNE Clean,null,null,Sole Proprietorship,null,null,null,null,null,null,2-10 employees,null,https://www.linkedin.com/company/bne-clean/,null,null,null,null,null,null,null,null,null,null,null,we provide cleaning services and maintenance.,null,null,null,null
null,null,null,AU,null,Miami Business Centre,153.40938,null,"2190 Gold Coast Highway, Miami, QLD 4220, AU",null,null,null,http://www.miamibusinesscentre.com.au,Miami Business Centre,null,null,Public Company,-27.994457,null,null,null,null,null,2-10 employees,null,https://www.linkedin.com/company/miami-business-centre/,null,null,null,null,null,null,null,"2190 Gold Coast Highway, Miami, QLD, 4220, AU","Miami, QLD",Miami,null,"Miami Business Centre offers 25 fully integrated serviced office suites. Shared serviced offices provide a cost-effective solution for start-ups, entrepreneurs, home-based business owners and large companies to establish branch locations. A serviced office suite saves you time and money by utilising shared resources, shared facilities, equipment and support personnel. Our tenants represent a mix of well-regarded business services and professions including Psychologist's, Naturopath's, Financial Planners and mortgage brokers.Miami Business Centre also provides Virtual Office Services to allow you to benefit from the resources available from our front of house reception team including the use of our Gold Coast business address on your marketing material.  This service is perfect for start-ups, sole traders, consultants and business owners who work from their home offices. Furthermore, virtual offices are a popular choice for companies who wish to trial a new business location before taking the risk of buying or renting.",null,null,null,null
null,2016,null,AU,null,null,153.01831,null,"97 Longlands St, Woolloongabba, Brisbane, QLD 4102, AU",null,null,null,http://visualisationbrisbane.com.au,The Draft Australia,null,null,Partnership,-27.47126,null,null,null,null,null,2-10 employees,null,https://www.linkedin.com/company/the-draft-australia/,null,null,null,null,null,null,null,"97 Longlands St, Woolloongabba, Brisbane, QLD, 4102, AU","Brisbane, QLD",Brisbane,null,"We offer services for Architectural drafting and Real Estate listings solutions as Photography, Property site measure, Floor plan drafting, Virtual Staging and Lawn Signs. Very affordable prices, as we are a young group of skilled architects and virtual artists, very keen on positioning in the market and standing out for our proficiency and high end service. Send us your enquiry to info@thedraftaustralia.com for more info call 0432701544",null,null,null,null
null,2015,null,AU,null,Head Office,151.13834,null,"Level 16, 1 Martin Plcae, c/- ""Flexispace""​, Sydney, NSW 2000, AU",null,null,null,http://interoffice.net.au/,InterOffice Property Services,null,null,Privately Held,-33.84907,null,null,null,null,null,2-10 employees,null,https://www.linkedin.com/company/interoffice-property-services/,null,null,null,null,null,null,null,"Level 16, 1 Martin Plcae, Sydney, NSW, 2000, AU","Sydney, NSW",Sydney,null,"InterOffice Property Services develops next-generation co-working, business collaboration and commercial property solutions.InterOffice currently operates two business collaboration sites, developed in partnership with Charter Hall Group - under the name of ""Flexispace by Charter Hall and InterOffice""​. These sites focus on providing a range of flexible meeting, hot desk and office solutions to building tenants, while also enabling external clients with similar needs access to the spaces. This creates a vibrant business community, with scope for collaboration, innovation and event activities - yet also providing for enclosed workspaces, to support the need for focus work time and team-based or project work.Our first proof-of-concept location at 68 Pitt Street was established in 2015, and has already generated significant positive feedback from existing building tenants, as well as external clients - spawning several collaborations, and providing overflow and convenience for valued existing tenants of the building.Our second site at 1 Martin Place is a showcase of the full potential of the concept.  Spanning 718m2, the ""Flexispace""​ site at 1 Martin Place includes a multi-purpose large event space, numerous boardrooms and meeting rooms, private offices, team spaces, hot desk and fixed working options, and collaboration and break-out spaces. This site was completed in December 2016 and opened in February 2017.InterOffice has also developed a number of technology based offerings and other assets which dramatically improve amenity and ease of use in commercial business environments, reduce operational costs and increase scalability.",null,null,null,null
null,null,null,AU,null,null,115.8162,null,"22 Gibberd Road, Level 1, Balcatta, Western Australia 6021, AU",null,null,null,https://www.vividpropertymanagement.com.au/,Vivid Property Management,null,null,Privately Held,-31.939821,null,null,null,null,null,2-10 employees,null,https://www.linkedin.com/company/vivid-property-management/,null,null,null,null,null,null,null,"22 Gibberd Road, Balcatta, Western Australia, 6021, AU","Balcatta, Western Australia",Balcatta,null,"Vivid Property ManagementUnique service - unique results.Experience the Vivid Difference. Our dedicated and fully integrated end-to-end property sales and property management services focus on delivering excellence at every touch point.At Vivid we represent only the most thoughtfully designed and crafted properties to the highest standard of specifications. All the properties we represent have been carefully researched and are located in desirable locations. Our properties are highly sought-after by tenants and as such represent great investments.All our properties are fully complete and ready to own or move into, this means no waiting and no hassles.",null,null,null,null
1300 030 450,2017,null,AU,null,null,149.14151,null,"Mitchell ACT , Canberra ACT, Canberra  2911, AU",null,null,null,http://www.flexibleconstructions.com.au/,Flexible Constructions,null,null,Public Company,-35.21536,null,null,null,null,null,201-500 employees,null,https://www.linkedin.com/company/flexible-constructions/,null,null,null,null,null,null,null,"Mitchell ACT , Canberra ACT, Canberra , 2911, AU","Canberra ACT, Canberra",Canberra ACT,null,"Tell us about your home design, any build project idea, or just say hello. Whether you’ve got a big building idea or if you’re just looking for some construction inspiration in Canberra ACT. We’re here to build luxury homes for you. Let’s build something awesome together! We will construct or renovate any form of building including granny flats construction, home renovation, home extensions, and helping you build the house of your dreams. We are here to build our future.",null,null,null,null
null,2019,null,null,null,null,null,null,"1 Manning St, South Gladstone, Queensland 4680, AU",null,null,null,http://gladstonebc.com.au/,Gladstone Business Centre,null,null,Partnership,null,null,null,null,null,null,2-10 employees,null,https://www.linkedin.com/company/gladstonebc/,null,null,null,null,null,null,null,null,"South Gladstone, Queensland",null,null,"Gladstone Business Centre is a multi faceted space providing networking and business oppurtunities to a range of businesses from startups, micro business, small business all the way to national operations needing a proffesional presence in the area with a local network of professionals.",null,null,null,null
9409 6283,2016,null,AU,null,null,115.8162,null,"3/35 Buckingham Drive, Wangara, WA 6065, AU",null,null,null,http://www.perthpropertysigns.com.au,Perth Property Signs,null,null,Partnership,-31.939821,null,null,null,null,null,2-10 employees,null,https://www.linkedin.com/company/perth-property-signs/,null,null,null,null,null,null,null,"3/35 Buckingham Drive, Wangara, WA, 6065, AU","Wangara, WA",Wangara,null,"Perth Property Signs is a family owned and operated signage company based in Perth, Western Australia. We specialise in Commercial Real Estate signage while also providing services to the Residential Real Estate market and general signage for other businesses. Our products and services include real estate signage,  builders signs, stickers and wall graphics, A-Frame signs, shop frontages, banners, billboards, hoardings and much more.",null,null,null,null
(08) 6266 8331,2018,null,null,null,null,null,null,"18 The Esplanade, Level 9, Perth CBD, Western Australia 6000, AU",null,null,null,http://www.apdarchitecture.com.au,APD Developments Australia,null,null,Privately Held,null,null,null,null,null,null,11-50 employees,null,https://www.linkedin.com/company/apd-developments-australia/,null,null,null,null,null,null,null,null,"Perth CBD, Western Australia",null,null,"APD Developments Australia is the property development arm of APD Design & Development Group. Together with APD Architecture, an A+ registered architecture practice, and APD Commercial, we work with the best creative talent and combine to bring a collaborative team of top industry experts together to realise large scale development projects.Whilst we do some high end residential work, our core focus is on commercial, hospitality and aged care projects. Our business model is to actively seek out gaps and/or opportunities in the market and bring together relevant stakeholders to realise development projects. This can include acquiring land, obtaining investment funding and bringing in top tier operators depending on project requirements.A major unique selling proposition is that we often do schematic designs on a speculative basis with fees only being charged upon project commencement. This helps to reduce upfront costs, fast tracks development opportunities and sets us apart from any other architect firm or property development group.",null,null,null,null
null,1948,null,AU,null,null,147.3237,null,"44 Napoleon Street, Battery Point, Hobart, Tasmania 7004, AU",null,null,null,null,Muir's Boatyard,null,null,Privately Held,-42.876358,null,null,null,null,null,2-10 employees,null,https://www.linkedin.com/company/muirs-boatyard/,null,null,null,null,null,null,null,"44 Napoleon Street, Hobart, Tasmania, 7004, AU","Hobart, Tasmania",Hobart,null,"Muir's Boatyard is located on the historic Battery Point waterfront, in Hobart Tasmania. Established in 1948 by Jock Muir, the boatyard has been operating continuously since then, initially as a slipway and boat building yard, and more recently as a commercial and industrial rental location.",null,null,null,null
null,2015,null,AU,null,Head Office,115.8162,null,"28 Raspins Loop, Burns Beach, WA 6028, AU",null,null,null,http://www.jcapropertymaintenance.com.au,JCA Property Maintenance Pty Ltd,null,null,Sole Proprietorship,-31.939821,null,null,null,null,null,2-10 employees,null,https://www.linkedin.com/company/jca-property-maintenance-pty-ltd/,null,null,null,null,null,null,null,"28 Raspins Loop, Burns Beach, WA, 6028, AU","Burns Beach, WA",Burns Beach,null,"JCA Property Maintenance is the fully insured systemized service taking care of commercial and industrial properties, Government and council departments, and homeowners..In addition, you get highly-trained technicians who are in business for themselves but not by themselves. This way the money they earn goes back to your local community. You get to deal with a local independent business owner instead of a large, faceless and impersonal corporation, and you get personal service with a smile.Some of the environmentally friendly, high pressure graffiti removal, concrete cleaning and other services we provide, but are not limited to, are: Removing slippery ugly mould, dirt and grime from eaves and gutters, driveways, pathways, factory floors, pool areas, buildings and nearly any other structure or flooring Concrete and paving cleaning or resealing Tile steam pressure cleaning Timber decking cleaning services Tennis court cleaning and line marking Car park line marking and cleaning Graffiti removal from railway stations, public toilets, bus sheds, skate parks and other places for local and national council and government departments Line marking, directional line services for shopping centres, car parks, warehouses, safety line marketing for factory walkways, sports centres and more High pressure cleaning services for industrial and factory floors patios and roofs and complete eave and house wash downs Resealing residential and commercial stamped concrete or paver floors and walkways Full service graffiti removal, high pressure cleaning and sealing services for all property owners Excellent services, as our team are qualified and carry out their work in compliance with workplace Health and Safety regulations",null,null,null,null
null,2007,null,AU,null,null,153.40938,null,"Gold Coast,   AU",null,null,null,http://www.m2space.com.au,M2SPACE Pty Ltd,null,null,Sole Proprietorship,-27.994457,null,null,null,null,null,2-10 employees,null,https://www.linkedin.com/company/m2space-pty-ltd/,null,null,null,null,null,null,null,"null, Gold Coast, null, null, AU",null,Gold Coast,null,"m²space facilitates innovative property development solutions and management on behalf of clients and partners by combining research, conceptualization, risk assessment and feasibility analysis to extract maximum investment opportunity value and deliver optimum results for project stakeholders.",null,null,null,null
null,null,null,null,null,null,null,null,"16-18 O'Connell Street, Level 3, Sydney, NSW 2000, AU",null,null,null,https://lpc.com.au/services/lease-management,Lpc Cresa Lease Management,null,null,null,null,null,null,null,null,null,null,null,https://www.linkedin.com/company/lpc-cresa-lease-management/,null,null,null,null,null,null,null,null,null,null,null,"Lpc Cresa Lease & Portfolio Management offers budgets and forecasts, rental payments, sublease management, portfolio repair, critical date monitoring and alerts.We believe leases should be overseen and NOT overlooked. That is why we have developed a lease management solution for our clients. By concentrating single-mindedly on tenant issues, we gain the perspective and the experience to level the playing field in landlord-tenant relations.",null,null,null,null
null,2017,null,AU,null,null,115.8162,null,"101 Grovedale Rd, Floreat, Perth, WA 6014, AU",null,null,null,http://www.nirrepproperty.com.au,Nirrep Property,null,null,Sole Proprietorship,-31.939821,null,null,null,null,null,2-10 employees,null,https://www.linkedin.com/company/nirrep-property/,null,null,null,null,null,null,null,"101 Grovedale Rd, Floreat, Perth, WA, 6014, AU","Perth, WA",Perth,null,"Nirrep Property is a property development consultancy providing knowledge, advice and management expertise for property development in WA.  Nirrep provides specialist support for property owners, developers, investors, and financiers in analysis, value management, development & sales management. 	With knowledge and understanding of residential high & low-rise apartments, integrated housing, master-planned communities, along with mixed-use residential / retail and commercial office parks the business provides a broad but extensive expertise. Services can operate across range of development phases such as project acquisition, transaction structuring, joint-venture management, re-zonings, development approvals, design development, development management, construction management & building, sales and marketing, and business operations & staff management.",null,null,null,null
null,2013,null,AU,null,Headquarters,153.01831,null,"26 Mowbray Terrace, East Brisbane, Queensland 4051, AU",null,null,null,http://www.facebook.com/deskandcobrisbane,desk & co.,null,null,Sole Proprietorship,-27.47126,null,null,null,null,null,0-1 employees,null,https://www.linkedin.com/company/the-profit-effect/,null,null,null,null,null,null,null,"26 Mowbray Terrace, East Brisbane, Queensland, 4051, AU","East Brisbane, Queensland",East Brisbane,null,"Here at desk & co, we see it as our civic duty to save freelancers and solos from the pitfalls of working from home!So why not join us at our stunning East Brisbane location - the iconic Mowbraytown building - where you will find a small, supportive community of like-minded, social co-workers.We work hard, but we don't work alone!Free Wi-Fi of coursePrinter accessNo limit parking nearbyLight-filled, flexible spaceMerlo coffee right on siteShowerGreat public transport linksAs much or as little interaction with your co-workers as you wish.Desk rental is totally flexible, with weekly rates at just $105.  That's worth your sanity, wouldn't you say!",null,null,null,null
null,1971,null,AU,null,null,151.13834,null,"101 Miller St, North Sydney, New South Wales 2060, AU",null,null,null,null,MJM.NL,null,null,Privately Held,-33.84907,null,null,null,null,null,11-50 employees,null,https://www.linkedin.com/company/mjm-nl/,null,null,null,null,null,null,null,"101 Miller St, North Sydney, New South Wales, 2060, AU","North Sydney, New South Wales",North Sydney,null,"MJM.NL for over 40 years has built, consulted & ran developments across the globe with the purpose of supplying what is demanded to the utmost of standards.We feel a great sense of responsibility in giving back to the community in all of our endeavours and follow the 'United Nations Global Compact'​ principles.MJM.NL understands what makes certain areas unique to their neighbourhoods by tailoring the needs of others into the projects we undertake and support local and national charities that have a positive, and lasting impact.",null,null,null,null
null,2000,null,null,null,null,null,null,"PO Box 6066, Gold Coast, Queensland 4207, AU",null,null,null,http://asbestosaudits.com.au/,Asbestos Audits Queensland,null,null,Sole Proprietorship,null,null,null,null,null,null,2-10 employees,null,https://www.linkedin.com/company/asbestos-audits-asbestos-surveys/,null,null,null,null,null,null,null,null,"Gold Coast, Queensland",null,null,"Asbestos Surveys, Asbestos Inspections, Asbestos Audits, Asbestos Reports, Asbestos Registers, Asbestos Risk Assessments and Asbestos Management Plans.  Call the Asbestos ExpertsAt Asbestos Audits Queensland we have over twenty years experience at inspecting and reporting on the presence of asbestos in buildings. You can be confident of your asbestos survey or audit results as we use only NATA accredited laboratories for our sample analysis.We travel Australia wide from our premises on the Gold Coast. For all asbestos audit services, call us on (07) 55492250 or mobile 0407 756 440 or email us for a quote.Commercial asbestos audit servicesDid you know that from January 1 2012, all commercial buildings built before 2004 ( in Qld the build date has reverted back to 1990 as of May 2014) must have had an asbestos inspection carried out by a competent person from which an Asbestos Management Plan, Risk Assessment, Register and Report is completed if asbestos is found or assumed to be present.Why? The National Code of Practice for How to Manage and Control Asbestos in The Workplace requires mandatory compliance of these codes.The issue of asbestos can sometimes be a sensitive one. Our friendly staff understand this and can explain to your staff if needed, exactly what we are doing and how all but new buildings require this service.We can inspect your building and produce an Asbestos Containing Materials Report, Register and Management Plan so that you comply with the regulations. We also offer asbestos inspections and report services for pre-demolition, pre-renovation, or sale purposes.",null,null,null,null
null,2014,null,AU,null,Aura Creative Pty Ltd,151.13834,null,"7 Hudson Street, Redfern, NSW 2016, AU",null,null,null,http://auracreative.com.au,Aura Creative Coworking Office,null,null,Privately Held,-33.84907,null,null,null,null,null,2-10 employees,null,https://www.linkedin.com/company/aura-creative-pty-ltd/,null,null,null,null,null,null,null,"7 Hudson Street, Redfern, NSW, 2016, AU","Redfern, NSW",Redfern,null,"A co-working office space to house businesses from a variety of industries interested in expanding their markets through collaboration with other like minded professionals.  A professionally cool office with all the additional extras to make it a place you enjoy coming to each day. More than an office we are aiming to create an positive little community where businesses can assist in each others growth and help inspire each other. Get amongst it.",null,null,null,null
null,null,null,null,null,null,null,null,"Brisbane, QLD 4000, AU",null,null,null,http://www.mellingcommercial.com,Melling Commercial,null,null,Sole Proprietorship,null,null,null,null,null,null,0-1 employees,null,https://www.linkedin.com/company/melling-commercial/,null,null,null,null,null,null,null,null,"Brisbane, QLD",null,null,"Melling Commercial provides Local Funds, Family Offices and Personal Investors access to properties not available on the open market. We act as a full-service buyers’ agency, providing everything from sourcing, site inspection, contract negotiation, financial analysis, property due diligence through to settlement. Utilise our extensive network with over 15 years of commercial experience in all property sectors throughout Australia. At Melling Commercial integrity is paramount and once engaged your privacy is assured. Through us you can gain access to properties the average person does not see.",null,null,null,null
null,1930,null,AU,null,null,146.91026,null,"576 Kiewa Street, Albury, NSW 2640, AU",null,null,null,http://www.ljcdixon.com.au,LJC Dixon,null,null,Privately Held,-36.09821,null,null,null,null,null,11-50 employees,null,https://www.linkedin.com/company/ljc-dixon/,null,null,null,null,null,null,null,"576 Kiewa Street, Albury, NSW, 2640, AU","Albury, NSW",Albury,null,"The name of L.J Colquhoun Dixon is synonymous with providing outstanding client service and local knowledge in Commercial and Industrial Real Estate in the Albury Wodonga region.Our sole focus on commercial and industrial real estate ensures your property interests will be managed and supported by an extensive team of dedicated property professionals, allowing us to provide the best results for you. As the leading commercial and industrial real estate agency in the Albury Wodonga region, our range of commercial and industrial services includes;- Commercial & Industrial Sales, Leasing and Management- Commercial & Industrial Projects- Auctioneering- Property Portfolio ManagementL. J Colquhoun Dixon has a long history in the region and has been involved in many of the significant commercial and industrial projects developed in Albury/Wodonga and the surrounding areas.  The two cities continue to grow rapidly and we look forward to an ongoing involvement in the commercial and industrial development of this region.Albury/Wodonga is strategically located on the NSW/Victorian border between Sydney and Melbourne, and is recognised as one of Australia’s largest and progressive regional centres, servicing a regional population of 170,000 people.  With a strong reputation as an ideal centre for major manufacturing and distribution, Albury Wodonga is an outstanding location for commercial and industrial businesses.We are proud to be part of this exciting region and we are ideally situated to offer outstanding services and resources to the commercial and industrial real estate market.Mission StatementL.J Colquhoun Dixon is dedicated to providing its real estate clients with the highest possible standard of service by:- Providing high quality real estate and property services.- Achieving growth through the provision of quality and reliable services, with a high level of expertise and integrity.- Valuing and developing strong long term relationships with our clients and working partners.- Providing honest and fair dealings above all else.",null,null,null,null
null,null,null,AU,null,null,153.01831,null,"Brisbane, Queensland 4000, AU",null,null,null,http://www.hpgproperty.com.au,HPG,null,null,Privately Held,-27.47126,null,null,null,null,null,2-10 employees,null,https://www.linkedin.com/company/hpgproperty/,null,null,null,null,null,null,null,"null, Brisbane, Queensland, 4000, AU","Brisbane, Queensland",Brisbane,null,null,null,null,null,null
