Phone,Founded,Longitude_4,Country,Location_description_5,Location_description_0,Longitude_0,Latitude_2,Location,City_3,Location_description_4,Longitude_5,Website,Name,Address_5,Location_description_2,Type,Latitude_0,Location_description_1,Latitude_4,City_4,Latitude_1,City_2,Company Size,Address_3,Linked In URL,City_5,Latitude_3,Address_4,Longitude_3,Industry,Location_description_3,Address_2,Address_0,Headquarter,City_0,Longitude_1,Overview,Longitude_2,Latitude_5,City_1,Address_1
2068997288,2019,null,GB,null,null,151.13834,51.51649,null,null,null,null,http://kathedralneutral.com,Kathedral,null,null,Privately Held,-33.84907,null,null,null,47.591396,London,11-50 employees,null,https://www.linkedin.com/company/kathedralneutral/,null,null,null,null,null,null,"null, London, Greater London, EC2M 7EB, GB","null, Sydney, NSW, 2000, AU","Seattle, WA",Sydney,-122.33279,"‘What's really going on here?'Kathedral is a global housing development and construction consultancy that strengthens organizational capacities and builds resilient project teams from departmental and business partnerships. We facilitate strategic collaborative partnering & deliver actionable unfiltered risk management perspective at every point of the deal and project life cycle.Our platform integrates into leading enterprises and public authorities that are making next level change at the team level to develop and/or build better, faster. Or need an urgent turnaround.The Kathedral Partnering Platform provides scaleable partnering services as a neutral Project Facilitator & Project Execution Audit specialist  - an independent third party with sole focus on next level project team collaboration, risk management, and problem solving.  We do what development and construction firms cannot , due to inherent internal limitations within every firm. We structure, engage, debias, measure, and document project team progress as a neutral, momentum focused teaming coach and technical advisor.",-0.128427,null,Seattle,"null, Seattle, WA, 98104, US"
0407 104 475,2020,null,null,null,null,null,null,"Perth,   AU",null,null,null,http://www.linkatlangley.com.au,LinkAtLangley,null,null,Public Company,null,null,null,null,null,null,51-200 employees,null,https://www.linkedin.com/company/linkatlangley/,null,null,null,null,null,null,null,null,null,null,null,"With an abundance of office workers on the doorstep, and situated in the highest density residential area in East Perth, Link@Langley is perfectly positioned as a new retail and entertainment hub. Add in the 3,900 short stay apartments and hotel rooms within convenient walking distance, and you have a captive market of foot traffic across all hours of the day (and night).",null,null,null,null
(+61) 0428489114,2009,null,null,null,null,null,null,"4 Ventnor Avenue, West Perth, Western Australia 6005, AU",null,null,null,https://sigmabusinesssales.com.au,Sigma Business Sales,null,null,Privately Held,null,null,null,null,null,null,2-10 employees,null,https://www.linkedin.com/company/sigma-business-sales/,null,null,null,null,null,null,null,null,"West Perth, Western Australia",null,null,"We formed Sigma Business Sales in 2009 and we’ve been going strong ever since.We sell businesses. This is a job we love and are passionate about. We get great satisfaction from getting to know buyers and sellers, helping them build better businesses, and achieving maximum value with the sale of businesses.Our focus is on selling businesses in the lower middle market with revenues of over $5 million, however we also sell many businesses with lower and higher revenues.Based in West Perth, we have an office in Germany and strong international connections. We sell businesses to local, interstate and international buyers.Meet our key team members.Mike Harrold – Managing DirectorMike started Sigma Business Sales ten years ago because he is passionate about the whole concept of business and wanted the challenge of running his own business.He brings years of corporate experience from around the world to Sigma. Mike has worked with large companies such as BASF, Sara Lee, Shell and Union Carbide. Roles have included that of managing director, sales manager and finance director. Mike has also owned and sold his own business, consulted to the likes of Barminco, Paladin and ADG Global. His experience covers varying industries including mining, engineering, manufacturing, fast moving consumer goods, chemicals, agriculture, healthcare, and wholesale and retail. Mike is extremely well qualified. He is a certified merger and acquisition advisor, certified exit planning advisor, certified business broker, CPA (Australia) and chartered management accountant.He plays pennant tennis and swims in the sea nearly every day. One day he plans to retire and lie on the beach. But not just yet!Please call Mike on 0428 489114 or email mike@sigmabusinesssales.com.au",null,null,null,null
null,null,null,null,null,null,null,null,null,null,null,null,https://lpc.com.au/services/coworking-consultancy,Lpc Cresa Coworking Consultancy,null,null,null,null,null,null,null,null,null,null,null,https://www.linkedin.com/company/lpc-cresa-serviced-office-solutions/,null,null,null,null,null,null,null,null,null,null,null,"Searching for and securing the best coworking situation for your business is time consuming and confusing. That's why Lpc Cresa has put together a team of professionals who are knowledgeable and experienced in this area of commercial real estate.At Lpc Cresa, we are always thinking about the client's best interests. So we can confidently place your organisation in the correct coworking or serviced office space and negotiate the best deal for your business.",null,null,null,null
null,1999,null,AU,null,null,151.13834,null,"Level 8, 83 Mount Street, North Sydney, NSW 2060, AU",null,null,null,null,Salinger & Co,null,null,Privately Held,-33.84907,null,null,null,null,null,2-10 employees,null,https://www.linkedin.com/company/salinger-&-co/,null,null,null,null,null,null,null,"Level 8, North Sydney, NSW, 2060, AU","North Sydney, NSW",North Sydney,null,"Salinger & Co is a leading independent corporate advisor, providing an integrated property, project management and logistics consulting service to major industrialists. Significant track record of assisting major national industrial clients manage their portfolios; reduce costs and deliver purpose built solutions.",null,null,null,null
null,2000,null,AU,null,CODA Commercial Interiors Pty Ltd,151.13834,null,"35, Smith Stree, Parramatta, NSW 2150, AU",null,null,null,https://coda.net.au/,CODA Commercial Interiors Pty Ltd,null,null,Sole Proprietorship,-33.84907,null,null,null,null,null,2-10 employees,null,https://www.linkedin.com/company/coda-commercial-interiors-pty-ltd/,null,null,null,null,null,null,null,"35, Parramatta, NSW, 2150, AU","Parramatta, NSW",Parramatta,null,"CODA commercial interiors specialise in designing and constructing welcoming and practical offices for growing companies. Our office designs combine functionality with flair, to produce maximum worker productivity.CODA commercial interiors offer customers a comprehensive fitout service, where both design and final construction activities are handled by ourselves, we find that our projects are always completed on time and within budget and to great customer satisfaction.CODA commercial interiors believe that a successful project outcome is dependant on building a productive project team in which the client is a key member. Communicating, building trust and confidence will ensure the end result exceeds expectations and empowers your business.CODA commercial interiors have a base of enormously happy clients and I would be only too pleased to put you in direct contact with them, or take you to visit their fitouts.",null,null,null,null
null,1994,null,AU,null,150 Edward,153.01831,null,"150 Edward Street, L4, Brisbane, Qld 4000, AU",null,null,null,https://www.ashdownpropertygroup.com/,Ashdown Property Group,null,null,Privately Held,-27.47126,null,null,null,null,null,2-10 employees,null,https://www.linkedin.com/company/ashdown-property-group/,null,null,null,null,null,null,null,"150 Edward Street, Brisbane, Qld, 4000, AU","Brisbane, Qld",Brisbane,null,We are a commercial property company that has been actively acquiring real estate across Brisbane since 1994. Our portfolio includes CBD and fringe office assets as well as extensive industrial and logistics holdings. We are always seeking to strategically grow our portfolio across all real estate asset classes.,null,null,null,null
(07) 3162 0245,2016,null,null,null,null,null,null,"3/49 Taylor St, Balmoral, Queensland 4171, AU",null,null,null,http://www.allureretail.com.au/,Allure Retail,null,null,Privately Held,null,null,null,null,null,null,2-10 employees,null,https://www.linkedin.com/company/allure-retail/,null,null,null,null,null,null,null,null,"Balmoral, Queensland",null,null,"Allure Retail are a leading retail leasing business that have been operating across Queensland since 2016. We assist shopping centre owners to fill tenancies in their centres in a timely and efficient manner to reduce the stresses of vacant properties. This niche market experience gives us a deep understanding of retail market trends occurring in the industry and how to service accordingly.We are well positioned to assist owners with the establishment or remixing of their tenancy offer within the shopping centre environment. Allure Retail recognise that one size does not fit all - our small team means attentive and personalised service with clear goals. We are committed to providing cost-effective and timely personal services to save tenants time, money and stress in their lease negotiations. Providing tenant sourcing and lease negotiation solutions is the core of our business, supported by consultation services, development of leasing strategy, coordination of tenancy fitouts and the tenancy opening process.  We are dedicated to achieving the most beneficial results for our clients across all sectors and scenarios. We pride ourselves on our knowledge of the local consumer and our ability to identify and secure the best retailers. We are a dynamic and personalised company looking to make an impact on the retail leasing industry. Our wholly inclusive offer of professional services from tenancy sourcing to tenancy opening means we can assist our clients at every step of the process. •	Tenant sourcing•	Leasing consultation services•	Retail lease negotiation•	Leasing administration•	Developing project leasing strategies•	Implementing project leasing strategies•	Tenancy fit out coordination•	Coordination of tenancy opening processAllure Retail have assisted several businesses fill leasing opportunities across Queensland including North Queensland, Central Queensland, Darling Downs South West and South East Queensland and the Gold Coast.",null,null,null,null
07 5572 2122,2009,null,null,null,null,null,null,"2/15 Lake St, Varsity Lakes, QLD 4227, AU",null,null,null,https://linkbusiness.com.au/business-brokers/Gold-Coast,LINK Business Brokers Gold Coast,null,null,Privately Held,null,null,null,null,null,null,11-50 employees,null,https://www.linkedin.com/company/link-gold-coast/,null,null,null,null,null,null,null,null,"Varsity Lakes, QLD",null,null,"LINK is the largest and most awarded business brokerage in the world and the statistics tell the story:• $2billion of business for sale • 250,000+ active buyers on databases• 14 major industry specialties • Success fee only pay structureLINK’s customers are sellers and buyers of businesses and we’ve become the most trusted brokerage by focusing on service, value and integrity. On 1st July 2009 LINK introduced their new office, located in the Gold Coast. LINK has had a presence in Australia since 2005, but with the addition to our brand of an established team of brokers with over 50 years experience between them, we are well geared to bring you the highest professional level of service.The office transacts businesses from all over Australia as well as transactions between Australia and New Zealand.Whether you're looking at buying or selling a business LINK is here to assist you.",null,null,null,null
0413270058,2009,null,AU,null,Multi Storage Osborne Park,115.8162,null,"65 Gordon Rd., Osborne Park, WA  AU",null,null,null,http://multistorage.com.au/,Multi Storage,null,null,Public Company,-31.939821,null,null,null,null,null,2-10 employees,null,https://www.linkedin.com/company/multi-storage/,null,null,null,null,null,null,null,"65 Gordon Rd., Osborne Park, WA, null, AU","Osborne Park, WA",Osborne Park,null,"Multi Storage is Western Australia’s leading developer of strata titled Storage Units. Our Storage Units, or Mini Warehouses, are conveniently located in three modern Storage facilities.Our storage units are specifically created for business storage and are designed to be discrete, secure and easy to navigate.The dimensions of the units and the width of the driveways accomodate for vehicle access to all ground floor units.Our storage units are strata-titled so they are available to buy, for lease or for investment.They are more affordable than a warehouse or office space, and have lower maintenance costs, making them an excellent investment option for businesses or individuals.Security is the main priority at Multi Storage with features like individuals alarms in each unit, monitored security and CCTV footage you can access on your phone or computer.",null,null,null,null
null,2010,null,AU,null,null,151.13834,null,"Suite 106-107, 2 Guildfoye Ave, Double Bay, NSW 2028, AU",null,null,null,http://www.crownre.com.au,Crown Commercial Real Estate,null,null,Partnership,-33.84907,null,null,null,null,null,2-10 employees,null,https://www.linkedin.com/company/crown-commercial-real-estate/,null,null,null,null,null,null,null,"Suite 106-107, 2 Guildfoye Ave, Double Bay, NSW, 2028, AU","Double Bay, NSW",Double Bay,null,"Crown Commercial Real Estate is a commercial real estate company based out of Suite 106-107, 2 Guildfoye Ave, Double Bay, NSW, Australia.",null,null,null,null
08 6370 6444,2018,null,AU,null,NAI Harcourts Metro,115.8162,null,"981 Wellington St, West Perth, Western Australia 6005, AU",null,null,null,https://metro.naiharcourts.com.au,NAI Harcourts Metro,null,null,Partnership,-31.939821,null,null,null,null,null,11-50 employees,null,https://www.linkedin.com/company/nai-harcourts-metro/,null,null,null,null,null,null,null,"981 Wellington St, West Perth, Western Australia, 6005, AU","West Perth, Western Australia",West Perth,null,"NAI Harcourts, est. 2009, emerged from an unmistakable confluence of opportunity and timing.As the consequences of the Global Financial Crisis (GFC) hit the real estate services world in 2009, there emerged a market opportunity to launch a business in Australasia to meet the needs of property owners, developers and occupiers as well as the needs of traditionally independent real estate firms who previously had competed as individual firms. The market was ready for a new and fresh participant created from the culture of accountability that comes from independent ownership yet recognises the importance of being coordinated and consistent in order to deliver quality service and solutions.NAI Harcourts is the result.It is a new joint venture which combines the resources of NAI Global, Harcourts International and Brock Real Estate and also the brand under which commercial real estate and business broking services previously provided in New Zealand and Australia under the Harcourts Commercial brand are now delivered.NAI Global is the 4th largest commercial real estate services company in the world. Harcourts International is a fast growing Australasian-based franchise network with a strong foundation in the residential property market and Brock Real Estate is Adelaide’s leading independent real estate services company.Our MissionNAI Harcourts aspires to be a company that creates sustainable leadership in the provision of property services throughout Australia and New Zealand. The achievement of this goal will see us create value and reward each of our stakeholders; employees, clients, investors and the community.We will be measured by our service quality and by our achievements, for our people and by our people, by our clients and their achievements and by our participation in our communities",null,null,null,null
1300886778,null,null,AU,null,Siège social,145.01105,null,"101 Moray St, South Melbourne, Victoria 3205, AU",null,null,null,https://centralhouse.com.au/,Central House,null,null,Privately Held,-37.803425,null,null,null,null,null,11-50 employees,null,https://www.linkedin.com/company/central-house-workspace/,null,null,null,null,null,null,null,"101 Moray St, South Melbourne, Victoria, 3205, AU","South Melbourne, Victoria",South Melbourne,null,"Located at 101 Moray in South Melbourne, Central House offers premium collaborative office space with a strong focus on the health and well-being of our members.Opening February 2021.",null,null,null,null
0393707400,2017,null,null,null,null,null,null,"34 Margaret St, R2, Moonee Ponds, Victoria 3039, AU",null,null,null,https://www.wprealestate.com.au/,WP Real Estate,null,null,Public Company,null,null,null,null,null,null,2-10 employees,null,https://www.linkedin.com/company/wprealestate/,null,null,null,null,null,null,null,null,"Moonee Ponds, Victoria",null,null,WP Real Estate is a boutique and specialised Melbourne real estate group located in Essendon offering our clients unsurpassed expertise when it comes to property related opportunities. We specialise in:* Project developments in Melbourne* Residential (off the plan) apartment & townhouse sales* Project marketing and property intelligence of Melbourne real estate* Wealth creation through property investment* Commercial and industrial property sales,null,null,null,null
07 3401 9777,1975,null,null,null,null,null,null,"Suite 1, Level 4, 49 Sherwood Road, Toowong, QLD 4066, AU",null,null,null,https://sohovian.com,Sohovian,null,null,Privately Held,null,null,null,null,null,null,2-10 employees,null,https://www.linkedin.com/company/sohovian/,null,null,null,null,null,null,null,null,"Toowong, QLD",null,null,"Small businesses made bigger.Sohovian helps under-resourced and overworked small business owners to grow their businesses.  We are specialists in taking care of your customers, with our virtual customer care services. We also offer small co-working offices and meeting rooms in Toowong and Cleveland.Why would you choose a private co-working office?* Short term agreements* Fully furnished offices* Utilities & services already connectedJust plug in your laptop & you're away!What's a Virtual Receptionist?It's actually a team of people who will answer your phone, transfer calls to you, take messages, book appointments ... whatever your resident Receptionist can do for you, we can do too - except make your coffee. (But you're always welcome to pay us a visit if you'd like a coffee).  A Virtual Receptionist service can be your full-time reception solution or an overflow alternative for lunch breaks, busy periods or staff leave.How could I use a Virtual Office Address?If your business is mobile or works from home, then you could use a Virtual Office Address on your website, stationery, advertising etc. The benefits include keeping your home address private, maintaining a stable address if you're regularly on the move and providing your customers with the confidence that you can be found.  How can I get a meeting room?We have an online booking page on our website.  You can see the room availability and book it there and then. Forget the noisy coffee shop - our boardrooms are private, professional, and reasonably priced.",null,null,null,null
null,2019,null,null,null,null,null,null,"Melbourne, VIC 3000, AU",null,null,null,http://www.archipelago.consulting,Archipelago Consulting Group,null,null,Privately Held,null,null,null,null,null,null,2-10 employees,null,https://www.linkedin.com/company/archipelagocg/,null,null,null,null,null,null,null,null,"Melbourne, VIC",null,null,"Archipelago is an innovative, human-centred property consultancy. We partner with people, property groups and proptech to bridge the gap between strategy and execution for any project or problem solving initiative. Tenant attraction | Retention | Technology integrationOur core services include: strategic planning, leasing,  business development initiatives, technology procurement, startups, placemaking, tenant engagement, customer experience and precinct or asset optimisation.Archipelago is a nimble team of bright property industry experts who are proud to collaborate with our strategic partners to curate the best possible outcomes for our clients.Based in Melbourne, Australia, we serve clients across the Asia Pacific region.",null,null,null,null
+61432522179,2020,null,null,null,null,null,null,"277 Lane Cove Rd, Macquarie Park, New South Wales 2113, AU",null,null,null,http://www.theengineeringfactory.net,The Engineering Factory,null,null,Privately Held,null,null,null,null,null,null,2-10 employees,null,https://www.linkedin.com/company/the-engineering-factory/,null,null,null,null,null,null,null,null,"Macquarie Park, New South Wales",null,null,"We supply and deploy the technology and the infrastructure that powers and drives data centres, server rooms and edge computing. We are proudly the first business in Australia to distribute immersion cooling technology on behalf of our partners Submer. This technology reduces the carbon emissions of data centres by 45% and provides for 50% capex and 60% opex savings.",null,null,null,null
0412-925 291,2017,null,null,null,null,null,null,"Melbourne, Australia, Victoria 3000, AU",null,null,null,http://www.accordretail.com.au,Accord Retail Leasing Pty Ltd,null,null,Privately Held,null,null,null,null,null,null,0-1 employees,null,https://www.linkedin.com/company/accord-retail-leasing-pty-ltd/,null,null,null,null,null,null,null,null,"Melbourne, Australia, Victoria",null,null,"We provide specialised Leasing Services including Retail Planning, Feasibilities and Budgeting to Owners and Developers of Shopping Centres & Retail Portfolios regardless of size or location.We can help clients to create the ideal Retail Mix and Income by delivering the Right Tenant in the Right Location at the Right Rental.You deal direct with the Owner and Director Of Leasing who has over 25 years experience in the industry working across a range of Retail Property from single street locations to Major Regional Shopping Centres.",null,null,null,null
02 9419 6909,2011,null,AU,null,null,151.13834,null,"Sydney,   AU",null,null,null,http://www.campbellscholtens.com.au,Campbell Scholtens Property Consultants,null,null,Privately Held,-33.84907,null,null,null,null,null,2-10 employees,null,https://www.linkedin.com/company/campbell-scholtens/,null,null,null,null,null,null,null,"null, Sydney, null, null, AU",null,Sydney,null,"At Campbell Scholtens, we know what it takes to create positive impact in commercial buildings. Backed by our wealth of data, human insights and experience, we empower clients with smart, tailored solutions. Since 1999 we have been helping them improve tenant customer satisfaction, identify cost-saving opportunities, and reduce the risks associated with property ownership.Backed by decades of combined experience, our senior management team is at the forefront of property and asset management. With an average response rate of 78% for our commercial property surveys, we consistently achieve high levels of tenant customer engagement.",null,null,null,null
null,1979,null,null,null,null,null,null,"Sydney, New South Wales 2000, AU",null,null,null,https://tworld.com.au,Transworld Business Advisors Australia,null,null,Privately Held,null,null,null,null,null,null,201-500 employees,null,https://www.linkedin.com/company/transworld-business-advisors-aus/,null,null,null,null,null,null,null,null,"Sydney, New South Wales",null,null,"In today’s economy, there are more people looking to buy and sell businesses than ever before. When a company owner needs to sell their business, they can’t just stick a for sale sign in the window. They need the assistance of a business broker to locate and vet potential buyers. On the other side, buyers rely on the broker to help facilitate the process of evaluating potential businesses and franchises for sale. A Transworld Business Advisor is the solution for both scenarios.Transworld Business Advisors focus on three core concepts: business brokerage, franchise consulting and franchise development.",null,null,null,null
null,2018,null,null,null,null,null,null,"Melbourne, Victoria 3000, AU",null,null,null,http://www.nexusretail.com.au,Nexus Retail Group,null,null,Privately Held,null,null,null,null,null,null,2-10 employees,null,https://www.linkedin.com/company/nexus-retail-group/,null,null,null,null,null,null,null,null,"Melbourne, Victoria",null,null,"Nexus Retail Group is a Melbourne based retail, commercial and mixed-use property consultancy and agency specialising in: •	Project leasing, asset management and agency services•	Master-planning, project and development consulting•	Leasing-led asset re-positioning and re-purposing•	Post-development asset stabilisation",null,null,null,null
