Longitude_3,Location_description_3,Longitude_2,Founded,Name,City_2,City_5,City_3,Latitude_2,Address_3,Address_2,Location_description_1,Address_4,Website,Latitude_3,Longitude_0,Latitude_4,Location_description_5,Longitude_5,Headquarter,Type,Location_description_2,Location_description_4,Latitude_5,Linked In URL,Address_0,Longitude_4,Overview,Location,Longitude_1,Location_description_0,Country,Company Size,Latitude_1,Address_5,Address_1,City_0,City_4,Industry,City_1,Phone,Latitude_0
null,null,null,null,CMC Markets,null,null,null,null,null,null,null,null,http://www.cmcmarkets.com/,null,null,null,null,null,null,Public Company,null,null,null,https://www.linkedin.com/company/cmc-markets/,null,null,"Established in 1989, CMC Markets is a leading global provider of financial spread betting and contracts for difference (CFDs). Headquartered in the City of London and listed on the LSE, we have offices in Sydney, Singapore, Toronto and across Europe.We have over 80,000 active clients globally, executing 64.5m spread bet and CFD trades annually (2018-19) on our award-winning trading platform and native mobile apps*. Our unique proprietary trading platform allows clients to trade FX, indices, cryptocurrencies, commodities, shares and treasuries via CFDs and spread bets (UK & Ireland only).  Professional clients can also trade on short-term price movements in financial markets through Countdowns. We provide competitive pricing and dedicated 24-hour customer service, whenever the markets are open.Our institutional arm provides bespoke, top-tier liquidity solutions for banks, brokers, funds and trading desks, through our grey and white label, API, Prime FX and Prime Derivatives solutions. Find out more at cmcmarkets.com/en-gb/institutional.Visit our Group site for more details: cmcmarkets.com/group.*Best Platform Features & Best Mobile/Tablet App among spread betters, CFD & FX traders, Investment Trends 2019 UK Leverage Trading Report.Spread bets and CFDs are complex instruments and come with a high risk of losing money rapidly due to leverage. 76% of retail investor accounts lose money when spread betting and/or trading CFDs with this provider. You should consider whether you understand how spread bets and CFDs work and whether you can afford to take the high risk of losing your money. Professional clients: Countdowns carry risk to any capital invested. These products are not suitable for all investors. CMC does not endorse, control or take responsibility for any third party content on or linked to this account. Nothing in this material is (or should be considered to be) financial, investment or other advice on which reliance should be placed.",null,null,null,null,"501-1,000 employees",null,null,null,null,null,null,null,null,null
null,null,null,null,Australian Prudential Regulation Authority,null,null,null,null,null,null,null,null,http://www.apra.gov.au,null,null,null,null,null,"Sydney, NSW",Government Agency,null,null,null,https://www.linkedin.com/company/apra/,null,null,"The Australian Prudential Regulation Authority (APRA) is the prudential regulator of the Australian financial services industry. It oversees banks, credit unions, building societies, general and life insurance and reinsurance companies, private health insurance, friendly societies, and most members of the superannuation industry. Our mandate is to protect the Australian Community by establishing and enforcing prudential standards and practices designed to ensure that, under all reasonable circumstances, financial promises made by institutions we supervise are met within a stable, efficient and competitive financial system.APRA is made up of diverse range of highly skilled professionals who are responsible for the prudential supervision of the banks, credit unions, building societies, general insurance and reinsurance companies, life insurance, private health insurance, friendly societies and regulated superannuation funds. We also have teams providing policy, analysis, research and risk management advice, as well as corporate and administration functions.To find out more about APRA visit our website: www.apra.gov.au/about-apra and to see current career opportunities visit our Carers page at: https://www.apra.gov.au/careers.  To receive updates on APRA including media releases, reports, speeches and other industry related information, follow us on Twitter at: www.twitter.com/APRAinfo  To receive information about APRA’s Graduate Recruitment Program, follow us on Facebook at: www.facebook.com/APRAGraduatePage","Level 12, 1 Martin Place, Sydney, NSW 2000, AU",null,null,null,"501-1,000 employees",null,null,null,null,null,null,null,1300555727,null
null,null,null,null,Finantix,null,null,null,null,null,null,null,null,http://www.finantix.com,null,null,null,null,null,null,Privately Held,null,null,null,https://www.linkedin.com/company/finantix/,null,null,"For over two decades, analysts have recognised Finantix as the market leader of trusted technology to the worldwide financial industry. Applying deep sector knowledge, we empower wealth management firms, insurers and banks to attract and engage prospects and clients through the cultivation of personalised whole-life relationships. For customers in 45 countries, we offer highly componentised, future-proof, integrated, multi-channel, end-to-end and point solutions with out-of-the-box accelerators.  By injecting artificial intelligence into comprehensive client and product hubs, we enable regulatory compliance, sales productivity, onboarding efficiency, advice effectiveness and customer intelligence: delivered as services that help turn routine transactions into valued and collaborative interactions. Our flagship solution is proven across multiple devices, languages, currencies and jurisdictions. We operate from offices across Europe, North America and Asia.",null,null,null,null,201-500 employees,null,null,null,null,null,null,null,null,null
null,null,null,null,FXCM,null,null,null,null,null,null,null,null,http://www.fxcm.com/,null,null,null,null,null,"London, London",Privately Held,null,null,null,https://www.linkedin.com/company/fxcm/,null,null,"FXCM is a leading provider of online foreign exchange (FX) trading, CFD trading, spread betting and related services. Founded in 1999, the company's mission is to provide global traders with access to the world's largest and most liquid market by offering innovative trading tools, hiring excellent trading educators, meeting strict financial standards and striving for the best online trading experience in the market. Clients have the advantage of mobile trading, one-click order execution and trading from real-time charts. In addition, FXCM offers educational courses on FX trading and provides trading tools proprietary data and premium resources. FXCM Pro provides retail brokers, small hedge funds and emerging market banks access to wholesale execution and liquidity, while providing high and medium frequency funds access to prime brokerage services via FXCM Prime. FXCM is a Leucadia Company.CFDs are complex instruments and come with a high risk of losing money rapidly due to leverage. 76.31% of retail investor accounts lose money when trading CFDs with this provider. You should consider whether you understand how CFDs work and whether you can afford to take the high risk of losing your money.  Risk Warning:  https://www.fxcm.com/uk/legal/trading-execution-risks/",null,null,null,null,"501-1,000 employees",null,null,null,null,null,null,null,null,null
null,null,null,null,Mortgage Choice,null,null,null,null,null,null,null,null,https://www.mortgagechoice.com.au,null,null,null,null,null,"North Sydney, NSW",Public Company,null,null,null,https://www.linkedin.com/company/mortgage-choice/,null,null,"Mortgage Choice is a fully fledged financial services provider.Mortgage Choice was established in 1992 by co-founders Rod Higgins and Peter Higgins, with a vision of building a national network of ethical, credible and professional mortgage brokers who local communities could trust. This vision has since extended to providing Australians with financial choices and expert advice for all of their finance needs.At Mortgage Choice, we’re about helping people make better choices with their finances, because we believe that making better choices leads to a better life. We get a kick out of helping people afford the things that are important to them, whether that’s buying a home, buying a new car, starting a business, travelling around the world or enjoying life in retirement.We help people take control of their money so they can spend time doing things that make them happy, with the people who are important to them.We do this via a national network of franchisees, including professional mortgage brokers and financial advisers. They are committed to empowering customers by sharing their expertise and offering solutions that are personalised to customers’ individual circumstances.Mortgage Choice has no balance sheet or funding risk, and consistently delivers strong profits and attractive yields. We listed on the ASX in 2004 (MOC) and are a member of the Mortgage & Finance Association of Australia (MFAA). Mortgage Choice holds an Australian Credit Licence: no. 382869. Mortgage Choice Financial Planning Pty Limited, a fully owned subsidiary of Mortgage Choice, holds an Australian Financial Services Licence: no. 422854. Both licences are issued by ASIC.For more information visit https://www.mortgagechoice.com.au or call customer service on 13 77 62","Level 10, 100 Pacific Highway, North Sydney, NSW 2060, AU",null,null,null,"1,001-5,000 employees",null,null,null,null,null,null,null,null,null
null,null,null,null,Ord Minnett,null,null,null,null,null,null,null,null,https://www.ords.com.au,null,null,null,null,null,"Sydney, NSW",Privately Held,null,null,null,https://www.linkedin.com/company/ord-minnett/,null,null,"Ord Minnett is a leading national private wealth management group that provides advice and tailored investment solutions. Ords has more than $35 Billion in Funds Under Advice, managed by a team of experienced investment professionals focused on providing our clients with insights and guidance to build their assets. Ord Minnett serves our clients with a network of 350 finance professionals in 10 offices throughout Australia and an office in Hong Kong.  Ords clients benefit from a comprehensive suite of investor services including full-service stockbroking, financial planning, superannuation, estate and retirement planning, funds management, fixed interest, portfolio services and corporate finance. In June 2019, a consortium of Australian private investors and Ord Minnett employees led by Ord Minnett’s Executive Chairman Karl Morris agreed to acquire 100% of Ord Minnett from its shareholders, IOOF and J.P. Morgan. Following the successful completion of the acquisition in September 2019, Ord Minnett became one of the largest privately owned wealth management firms in Australia.",null,null,null,null,201-500 employees,null,null,null,null,null,null,null,null,null
null,null,null,null,Värde Partners,null,null,null,null,null,null,null,null,http://www.varde.com,null,null,null,null,null,"Minneapolis, Minnesota",Privately Held,null,null,null,https://www.linkedin.com/company/varde-partners/,null,null,"Värde Partners is a leading global alternative investment adviser with roots in credit and distressed. At a fundamental level, Värde focuses on unlocking value – Värde means value in Swedish. The firm seeks opportunities in less efficient markets and pursues assets at a discount to their intrinsic or potential value, all with the focus of creating value for its investors and empowering the common good they seek. Investments span corporate and sovereign credit, restructurings, real estate, mortgages, private equity, and direct lending. The firm has invested more than $75 billion since its founding in 1993, and employs more than 300 professionals across 11 offices worldwide. Värde currently manages over $14 billion in assets on behalf of its investors around the world.",null,null,null,null,201-500 employees,null,null,null,null,null,null,null,null,null
null,null,null,null,IG,null,null,null,null,null,null,null,null,http://www.iggroup.com,null,null,null,null,null,null,Public Company,null,null,null,https://www.linkedin.com/company/igcom/,null,null,"We’re a global leader in online trading, with our range of award-winning platforms and apps providing fast and flexible access to over 17,000 financial markets – including indices, shares, forex, and commodities.Established in 1974 as the world’s first financial spread betting firm, we’re now the world’s No.1 provider of CFDs and spread betting*, and a global leader in forex. We also offer an execution-only share dealing service in the UK, Australia, Ireland, Germany, Austria and the Netherlands. Through our low fees and smart price-sourcing technology, we help traders keep their costs down. Spread bets and CFDs are complex instruments and come with a high risk of losing money rapidly due to leverage. 76% of retail investor accounts lose money when trading spread bets and CFDs with this provider. You should consider whether you understand how spread bets and CFDs work, and whether you can afford to take the high risk of losing your money.Professional clients can lose more than they deposit. * No.1 based on revenue excluding FX (published half-yearly financial statements, June 2019); for forex based on number of primary relationships with FX traders (Investment Trends UK Leveraged Trading Report released August 2018). Negative balance protection does not apply to professional traders.",null,null,null,null,"1,001-5,000 employees",null,null,null,null,null,null,null,null,null
null,null,null,null,Muzinich & Co,null,null,null,null,null,null,null,null,http://www.muzinich.com,null,null,null,null,null,"New York, NY",Privately Held,null,null,null,https://www.linkedin.com/company/muzinich-&-co/,null,null,"Muzinich & Co. is a privately owned, institutional-focused investment firm specializing in public and private corporate credit. Since 1990, we have an established track record highlighting our ability to deliver what we believe to be superior risk-adjusted returns in a variety of market conditions with no style drift. Investment decisions are rooted in bottom up, fundamental credit research. A global perspective prevails through dedicated US, European and Emerging Markets teams. Over the years the firm has broadened its credit based investment programs and has leveraged its credit expertise. Our global presence and deep resources allow us to offer a broad range of corporate credit investment strategies across both developed and emerging markets, and across both public and private debt.We are headquartered in New York and London and have a total of 12 offices globally.Read important disclosures at www.muzinich.com/social-media-disclaimers",null,null,null,null,201-500 employees,null,null,null,null,null,null,null,null,null
null,null,null,null,Burford Capital,null,null,null,null,null,null,null,null,http://www.burfordcapital.com,null,null,null,null,null,"New York, NY",Public Company,null,null,null,https://www.linkedin.com/company/burford-capital/,null,null,"Burford Capital is the leading global finance and asset management firm focused on law. Its businesses include litigation finance and risk management, asset recovery and a wide range of legal finance and advisory activities. Burford is publicly traded on the New York Stock Exchange (NYSE: BUR) and the London Stock Exchange (LSE AIM: BUR), and it works with law firms and clients around the world from its principal offices in New York, London, Chicago, Washington, Singapore and Sydney.",null,null,null,null,51-200 employees,null,null,null,null,null,null,null,null,null
null,null,null,null,Vanguard Australia,null,null,null,null,null,null,null,null,http://www.vanguard.com.au,null,null,null,null,null,"Melbourne, Victoria",Privately Held,null,null,null,https://www.linkedin.com/company/vanguard-australia/,null,null,"Over 40 years ago, a great idea was born—that an investment firm should operate solely in the interests of all investors to give them the best chance of success.In 1975, John ""Jack""​ Bogle launched a bold experiment: an investment company that was designed to make money for its investors, not from them. He structured Vanguard in the US to be owned by its funds, with no external shareholders all profits would be reinvested in the business and returned to fund investors in the form of lower costs. Through an investment philosophy based on fairness and transparency that great idea grew and grew. And as we’ve grown, we’ve continually reduced our costs and passed the savings back to investors. In 1996 the idea made its way to Australia. And we’ve been changing the way Australians invest ever since by providing low-cost, high-value investments to help you keep more of your returns.-In Australia we partner with institutional clients, financial advisers and individual investors to offer low-cost investment solutions. Our comprehensive range of managed funds, exchange traded funds (ETFs) and tailored investment solutions are built to support long-term investment success for our clients.",null,null,null,null,"501-1,000 employees",null,null,null,null,null,null,null,null,null
null,null,null,null,DOCOMO Digital,null,null,null,null,null,null,null,null,http://www.docomodigital.com,null,null,null,null,null,"London, England",Privately Held,null,null,null,https://www.linkedin.com/company/docomo-digital/,null,null,"DOCOMO Digital is the international payments business of NTT DOCOMO. We partner with carriers, merchants, OTT services, app stores and payment providers in both developed and emerging markets around the world. We solve the challenges of customer acquisition and retention, regulation, and complexity for our partners with alternative payment methods such as direct carrier billing and digital wallets. With teams based in fifteen countries, we enable our partners to grow their digital services revenues while enhancing the customer experience for their users. Our robust managed services platform and coverage across carriers and the most locally relevant payment methods enable faster time-to-market, especially for streaming, gaming, eCommerce, and productivity application providers. DOCOMO Digital is a wholly-owned subsidiary of the world’s eighth-largest telecom company - NTT DOCOMO, listed on the Tokyo Stock Exchange.",null,null,null,null,201-500 employees,null,null,null,null,null,null,null,null,null
null,null,null,null,Sunsuper,null,null,null,null,null,null,null,null,http://www.sunsuper.com.au,null,null,null,null,null,"Milton, Queensland",Nonprofit,null,null,null,https://www.linkedin.com/company/sunsuper/,null,null,"Feel the strength of Sunsuper Sunsuper members belong to a fund that’s dedicated only to them.•	stress-tested investment strategies proven through all sorts of climates to deliver strong, long-term returns that have beaten the industry average over 3, 5, 7 and 10 years•	Lower fee fund - $1.50 per week admin fee plus 0.10% p.a.•	Sunsuper members benefit from our Dream Rewards program with discounts on food, fuel, health insurance, holidays, fitness and more•	Chant West 2020 Fund of the YearJoin online in 5 minutes sunsuper.com.au/strength Product issued by Sunsuper Pty Ltd (ABN 88 010 720 840, AFSL No. 228975). Consider Product Disclosure Statement before making a decision. Call 13 11 84 or visit sunsuper.com.au for a copy.","30 Little Cribb Street, Milton, Queensland 4064, AU",null,null,null,"501-1,000 employees",null,null,null,null,null,null,null,null,null
null,null,null,null,Cambridge Global Payments,null,null,null,null,null,null,null,null,http://www.cambridgefx.com,null,null,null,null,null,"Toronto, Ontario",Public Company,null,null,null,https://www.linkedin.com/company/cambridge-global-payments/,null,null,"For over 25 years’, 14,000+ global businesses have trusted Cambridge Global Payments to power their cross-border payments, execute plans to manage their currency risk and ultimately help grow their businesses around the world. At Cambridge, we aim to deliver unmatched service and expertise with respect to moving money globally. Utilizing our proprietary payment automation technology and currency risk mitigation solutions, we take pride in connecting businesses large and small with the global financial markets and businesses all over the world.You can feel confident working with Cambridge, as we are backed by our parent company, FLEETCOR Technologies, Inc. (NYSE:FLT) a leading global business payments company based in Atlanta, Georgia, USA. FLEETCOR is a Fortune 1000 firm, an S&P 500 member and has $2.4B in annual revenue with a market capitalization of $22B USD.To learn more please visit www.cambridgefx.com.",null,null,null,null,201-500 employees,null,null,null,null,null,null,null,(416) 646-6401,null
null,null,null,null,Link Group (LNK),null,null,null,null,null,null,null,null,http://linkgroup.com,null,null,null,null,null,"Sydney, NSW",Public Company,null,null,null,https://www.linkedin.com/company/link-group-lnk/,null,null,"Link Group connects millions of people with their assets including equities, pension and superannuation, investments, property and other financial assets.We do this by partnering with thousands of financial market participants to deliver services, solutions and technology platforms that enhance the user experience and make scaled administration simple.We help manage regulatory complexity, improve data management and provide tools to help people connect to their assets, leveraging analysis, insight and technology.","680 George St, Sydney, NSW 2000, AU",null,null,null,"5,001-10,000 employees",null,null,null,null,null,null,null,null,null
null,null,null,null,BT,null,null,null,null,null,null,null,null,http://www.bt.com.au,null,null,null,null,null,"Barangaroo, New South Wales",Public Company,null,null,null,https://www.linkedin.com/company/bt-financial/,null,null,"BT is the wealth management brand of the Westpac Group, helping Australians from all backgrounds manage, grow and protect their money.From our beginnings in 1969, we have fostered a strong culture of intelligent expertise and insights. We have a strong financial services heritage in Australia, giving you the assurance that you are dealing with experienced and knowledgeable experts, supported by the strength and stability of the Westpac Group.We provide our customers with best in class wealth services. These include:• Investment• Superannuation• Platforms• Insurance solutions","200 Barangaroo Ave, Barangaroo, New South Wales 2000, AU",null,null,null,"1,001-5,000 employees",null,null,null,null,null,null,null,null,null
null,null,null,null,Market Eye,null,null,null,null,null,null,null,null,http://www.marketeye.com.au,null,null,null,null,null,"Melbourne, VIC",Privately Held,null,null,null,https://www.linkedin.com/company/market-eye/,null,null,"Market Eye is Australia’s leading specialist investor and media relations advisory firm.Our team of professionals based in Melbourne and Sydney are focused on providing equity capital markets advice and targeted media strategies. Market Eye is the only specialist investor and media relations advisory firm in Australia whose senior team has decades of direct experience in equity capital markets and financial news media.Market Eye is a leader in providing investor and media relations solutions and has developed excellent client offerings including, specialist investor relations advisory services, strategic media advice and market intelligence tools. Our suite of comprehensive premium services are provided across a range of listed companies, from micro cap to large cap.Our advice and services are independent and objective. Market Eye is not involved in activities that may compromise the quality of our advice such as undertaking securities underwriting or trading.","Level 8, 360 Collins Street, Melbourne, VIC 3000, AU",null,null,null,11-50 employees,null,null,null,null,null,null,null,null,null
