Longitude_3,Location_description_3,Longitude_2,Founded,Name,City_2,City_5,City_3,Latitude_2,Address_3,Address_2,Location_description_1,Address_4,Website,Latitude_3,Longitude_0,Latitude_4,Location_description_5,Longitude_5,Headquarter,Type,Location_description_2,Location_description_4,Latitude_5,Linked In URL,Address_0,Longitude_4,Overview,Location,Longitude_1,Location_description_0,Country,Company Size,Latitude_1,Address_5,Address_1,City_0,City_4,Industry,City_1,Phone,Latitude_0
null,null,null,null,Bank of us,null,null,null,null,null,null,null,null,http://www.bankofus.com.au,null,null,null,null,null,"Launceston, Tasmania",Privately Held,null,null,null,https://www.linkedin.com/company/bank-of-us/,null,null,"A bank that benefits all of us, not just some of us.Our profits are reinvested to benefit our customers and our local community. That means we can offer better products, services and more competitive rates, as well as support for important community programs and initiatives. It may not be what you were expecting from a bank, but then we're not like any other bank. Bank of us. How unexpected.Bank of us is the only Tasmanian customer owned bank. We have more than 30,000 customers, eight Retail Stores statewide, over 140 employees and more than $1 billion in assets. We provide a great range of personal and business banking services and solutions. Visit our website to find out more www.bankofus.com.au.Join the conversationFacebook - www.facebook.com/BankofusTwitter - www.twitter.com/BankofusYouTube - www.youtube.com/BEPersonalBanking","87 Brisbane Street, Launceston, Tasmania 7250, AU",null,null,null,51-200 employees,null,null,null,null,null,null,null,null,null
null,null,null,null,Australian Stock Report,null,null,null,null,null,null,null,null,http://www.australianstockreport.com.au/,null,null,null,null,null,"Sydney, NSW",Privately Held,null,null,null,https://www.linkedin.com/company/australian-stock-report/,null,null,"Australian Stock Report is the leading provider of investment research and education for people who want the flexibility to manage their own investments.  Our clients include traders, investors and trustees of self-managed super funds.  We are committed to delivering only well-researched, considered and targeted investment insights. With a strong focus on quality over quantity, we’re here to deliver the best insights, rather than the most. We are single-minded in our dedication to our clients’ financial success.Australian Stock Report Ltd (ACN 106 863 978) is licensed as an Australian Financial Services Licensee pursuant to section 913B of the Corporations Act 2001. AFS Licence 30168.","333 George Street, 13, Sydney, NSW 2000, AU",null,null,null,11-50 employees,null,null,null,null,null,null,null,null,null
null,null,null,null,Prime Super,null,null,null,null,null,null,null,null,https://www.primesuper.com.au/,null,null,null,null,null,"Melbourne, Victoria",Privately Held,null,null,null,https://www.linkedin.com/company/prime-super/,null,null,"The straightforward approach to investing.Prime Super has provided super and retirement solutions to Australians for over 20 years. From our beginnings in rural Australia, Prime Super has expanded to represent a diverse range of workers across multiple industries.Our surprisingly straightforward solutions take the complexity out of super and investments for members, helping them grow, manage and protect their wealth.We are open to all Australians and have investment and insurance options to suit everyone.Today the Fund manages over $5 billion in funds for more than 120,000 members.","Level 24, 500 Collins Street, Melbourne, Victoria 3000, AU",null,null,null,51-200 employees,null,null,null,null,null,null,null,null,null
null,null,null,null,Bloom Impact Investing,null,null,null,null,null,null,null,null,https://www.bloom-impact.com,null,null,null,null,null,"Brisbane, Queensland",Privately Held,null,null,null,https://www.linkedin.com/company/bloom-impact-investing/,null,null,"Investing web application for environmentally conscious investors.Invest in renewable energy and climate solutions for a competitive market return.Launching in 2021, sign up for early access.","Brisbane, Queensland 4100, AU",null,null,null,2-10 employees,null,null,null,null,null,null,null,null,null
null,null,null,null,TrailBlazer Finance,null,null,null,null,null,null,null,null,https://trailblazerfinance.com.au/,null,null,null,null,null,"Bondi Junction , Sydney, New South Wales",Privately Held,null,null,null,https://www.linkedin.com/company/trailblazerfinance/,null,null,"We are an independently funded specialist lender which has been leading the way in the financial services industry for almost a decade.  We’ve pioneered a new approach to lending money. We utilise the commission from your trail book or recurring revenue as security against your loan, so you don’t have to risk your house or personal assets. With our expertise in trail book valuations, we empower you to forge your own financial path by offering a wide range of customisable loans and services that suit your specific business needs. If you’re looking for an intelligent, agile, and empathetic alternative to the banks, then we’re the right service for you!","59-75 Grafton Street, Suite 401, Level 4, Bondi Junction , Sydney, New South Wales 2022, AU",null,null,null,51-200 employees,null,null,null,null,null,null,null,1300 139 003,null
null,null,null,null,Morningstar Australasia,null,null,null,null,null,null,null,null,http://corporate.morningstar.com/au/asp/home.aspx?xmlfile=5620.xml,null,null,null,null,null,null,null,null,null,null,https://www.linkedin.com/company/morningstar-australia/,null,null,"At Morningstar Australasia we're motivated by our mission to create great products that help investors reach their financial goals. Our independence is unshakeable.  Staying true to our long-term investing and advocating for investors'​ rights, even when the crowds are doing the opposite, is how we remain a trusted voice of reason that rises above the market noise.We believe that when the investor wins, we all win - including advisers, asset managers, and employers.  We help investors practice the discipline of investing in two simple ways:*We support the people who make investment decisions on their own with high-quality information and tools that help them make the most suitable choices.*We help people who work with advisers and institutions by making investment decisions for them through our investment management services.We aim to fight the forces that block the investors path to financial success.  *We simplify complexity*We encourage investing for the long term*We turn camouflage into transparencyWe want to help more people build long-term value through investing, leading them to independence and, eventually, giving them the financial freedom to live their lives as they choose.  Looking to the origin of our name, the sun is but a morning star, and even something as old as the sun is still young relative to the universe.  As a symbol of truth and optimism in the financial world, we offer people hope that they can make changes for the better.","Level 3, International Tower 1, 100 Barangaroo Avenue, Sydney, New South Wales 2000, AU",null,null,null,null,null,null,null,null,null,null,null,null,null
null,null,null,null,Maxxia Pty Ltd,null,null,null,null,null,null,null,null,https://www.maxxia.com.au,null,null,null,null,null,"Melbourne, Victoria",Public Company,null,null,null,https://www.linkedin.com/company/maxxia-pty-ltd/,null,null,"Maxxia is one of Australia’s leading workplace benefits program providers, with over 20 years’ experience.  At Maxxia, we’re all about adding value to your business. We continuously strive to give our customers the best service, strong solutions and big wins through our salary packaging and novated leasing benefits.Maxxia are part of the ASX listed McMillan Shakespeare Group (MMSG) – we pioneered the salary packaging industry in Australia back in 1988.Our group of brands offers national fleet and asset management under the brand Interleasing, and specialises in providing workplace benefits to Queensland and Northern Territory under the brand RemServ.We believe in always seeing things differently and seeking out new opportunities. To learn more about Maxxia and the workplace benefits we can offer to you, visit us at Maxxia.com.au","360 Elizabeth Street, Melbourne, Victoria 3000, AU",null,null,null,"1,001-5,000 employees",null,null,null,null,null,null,null,null,null
null,null,null,null,Premium Funding,null,null,null,null,null,null,null,null,http://www.premiumfunding.net.au,null,null,null,null,null,"Brisbane, QLD",Privately Held,null,null,null,https://www.linkedin.com/company/premium-funding/,null,null,"Premium Funding is one of Australia’s largest independent and privately-owned premium finance companies, providing over 50,000 Australian businesses with insurance premium funding each year.Since our inception in 1992, our focus has always been on providing an exceptional funding experience to our brokers and clients.  Our competitive products, ability to deliver innovative solutions to make the funding process as seamless as possible and friendly customer service provided by our local team, sets us apart from other funders out there.Our finance solutions are not limited to insurance premium funding. We also provide professional fee funding, invoice finance and business loans.Learn more on our website at: www.premiumfunding.net.au","Edward Street, Brisbane, QLD 4000, AU",null,null,null,11-50 employees,null,null,null,null,null,null,null,1800 005 110,null
null,null,null,null,Cashwerkz,null,null,null,null,null,null,null,null,http://www.cashwerkz.com.au,null,null,null,null,null,"Sydney, NSW",Public Company,null,null,null,https://www.linkedin.com/company/cashwerkz/,null,null,"Cashwerkz is Australia's leading marketplace for cash investment, with over 54 banking and credit union partners.Cashwerkz leverages the latest technology to deliver an innovative and streamlined approach to investing in At Call, Term Deposits and Bonds, meeting the growing demand for a trusted, reliable and secure online platform, where direct investors, financial advisers and their clients, the Australian middle market (councils, NFPs and community organisations) and custodians can manage their defensive assets and transact cash investments seamlessly.The Australian-developed Cashwerkz platform provides self-managed super funds, financial planners, fund managers, the wholesale market, custodians, and superannuation funds with the ability to source market competitive interest rates in real-time and then to transact and manage cash allocations on an end-to-end secure platform.The platform does not receive, handle or direct investor’s money: it facilitates the transfer of cash parcels between accounts held and controlled by the investor, their appointed adviser or custodian, via automated instructions to relevant parties. There is no fee payable by the investor. Cashwerkz receives a fee from the issuing ADI.","Level 5, 66 Clarence Street, Sydney, NSW 2000, AU",null,null,null,11-50 employees,null,null,null,null,null,null,null,1300 784 132,null
null,null,null,null,Industry Super Australia,null,null,null,null,null,null,null,null,http://industrysuperaustralia.com,null,null,null,null,null,"Melbourne, Victoria",Privately Held,null,null,null,https://www.linkedin.com/company/industry-super-australia/,null,null,"Industry Super Australia (ISA) manages collective programs on behalf of Industry SuperFunds with the objective of maximising the retirement savings of five million industry super members. This includes research, policy development, government relations, advocacy and the well-known Industry SuperFunds Joint Marketing Campaign.All Industry SuperFunds are run in the best interest of members with a common goal of providing the best possible retirement outcome for members.","2 Lonsdale St, Melbourne, Victoria 3000, AU",null,null,null,11-50 employees,null,null,null,null,null,null,null,null,null
null,null,null,null,WePower,null,null,null,null,null,null,null,null,http://wepower.network,null,null,null,null,null,"Vilnius, Vilnius",Privately Held,null,null,null,https://www.linkedin.com/company/wepower-network/,null,null,"WePower is the next generation green energy procurement and trading platform. It connects Individual business energy buyers directly with energy producers enabling them to purchase energy upfront at below market rates.WePower platform eliminates the complexity from entering into a power purchase agreement (PPA), gives a right to choose whatever renewable energy volume to contract, increases renewable energy project’s exposure, and provides liquidity to trade power purchase agreements. None of this has been possible before.The company aims to help individual businesses to transition to green energy and thus make our planet greener. Headquartered in Vilnius, Lithuania, WePower has offices in Melbourne, Madrid and Tallinn.",null,null,null,null,51-200 employees,null,null,null,null,null,null,null,null,null
null,null,null,null,Powerwrap Limited,null,null,null,null,null,null,null,null,http://www.powerwrap.com.au,null,null,null,null,null,"Melbourne, Victoria",Public Company,null,null,null,https://www.linkedin.com/company/powerwrap-limited/,null,null,"Powerwrap are pioneers in unconstrained, next generation wealth management. Our goal is to unleash the full potential of adviser and client relationships. Our innovative, institutional-grade wealth management platform is used by advisers and brokers to administer, manage and report on their client portfolios. Along with a comprehensive set of administration and reporting tools for portfolio management and an experienced in-house execution team to manage trades and transactions, Powerwrap offers a unique back office service for teams of brokers or advisers looking to start their own  business giving them the freedom to focus on what they do best - building long-term, value-adding relationships with their clients.","356 Collins Street, Melbourne, Victoria 3000, AU",null,null,null,51-200 employees,null,null,null,null,null,null,null,null,null
null,null,null,null,Exponential Trading,null,null,null,null,null,null,null,null,http://www.exponentialtrading.com.au,null,null,null,null,null,"Sydney, New South Wales",Privately Held,null,null,null,https://www.linkedin.com/company/exponential-trading/,null,null,"Exponential Trading is a proprietary trading firm based in Sydney, focused on dominating the Asia Pacific markets. Founded in 2013 by Ebon Bokody when he saw an opportunity to improve his trading and challenge himself to build his own trading company.","264 George St, Level 44, Sydney, New South Wales 2000, AU",null,null,null,2-10 employees,null,null,null,null,null,null,null,null,null
null,null,null,null,OnDeck Australia,null,null,null,null,null,null,null,null,https://www.ondeck.com.au/,null,null,null,null,null,"Sydney, NSW",Privately Held,null,null,null,https://www.linkedin.com/company/ondeck-australia/,null,null,"OnDeck aims to solve a major issue facing Australian small businesses: the ability to access finance quickly and easily, so business owners can spend their time growing their business instead of seeking finance. Our streamlined application process allows the business owner to apply online in minutes, and enables us to evaluate, approve and fund small business loans in as fast as 1 business day. The OnDeck Score®, our proprietary small business credit scoring system, evaluates hundreds of data points to deliver a credit decision rapidly and accurately. Through sophisticated data analysis we look at the health of a business, not just the owner’s personal credit scores.Over the past 10 years, OnDeck has delivered over US$10 billion to small businesses in the USA and Canada. Serving more than 700 industries, OnDeck has been trusted by over 80,000 small businesses across the US, Canada and Australia by providing them with a loan to help them build a growing and thriving enterprise. OnDeck was named one of the Inc. 500 fastest growing companies in the USA and is listed on the NYSE. OnDeck Australia partners with MYOB, trusted by more than 1.2 million businesses.","L11, 130 Pitt St, Sydney, NSW 2000, AU",null,null,null,51-200 employees,null,null,null,null,null,null,null,null,null
null,null,null,null,FIRMA Foreign Exchange,null,null,null,null,null,null,null,null,http://www.firmafx.com,null,null,null,null,null,"Edmonton , Alberta",Privately Held,null,null,null,https://www.linkedin.com/company/firma-foreign-exchange/,null,null,"We believe business across borders can be less complex.With over 18 years experience, Firma is trusted by small and large businesses globally to safely and securely manage over $10 billion in annual payments. From day one, we’ve built lasting relationships with our clients and treat their business as one of our own. We’re specialists in monitoring the variables of foreign markets, helping businesses assess the risks of currency fluctuations and understand the potential factors affecting their money. We have offices located around the world, with currency specialists dedicated to help grow your business and simplify the complexities of foreign exchange. Because we’re regulated and supervised by government organizations in all local and international jurisdictions that we operate in, working with us means you’ll get professional, trusted and reliable foreign exchange solutions. Firma equals smarter business–we work hard to make sure your money does too. Learn how we can help your business optimize its global potential at: www.firmafx.com",null,null,null,null,201-500 employees,null,null,null,null,null,null,null,null,null
null,null,null,null,Barrenjoey,null,null,null,null,null,null,null,null,http://barrenjoey.com,null,null,null,null,null,"Sydney, NSW",Privately Held,null,null,null,https://www.linkedin.com/company/barrenjoey/,null,null,"Barrenjoey is an Australian based full service financial services firm. Barrenjoey provides corporate and strategic advisory, equity and debt capital market underwritings, cash equities, research, prime brokerage and traditional fixed income services.Full Service OfferingCorporate Finance: Traditional corporate advisory transactional services, ECM, DCM and leveraged finance solutions. Equities: Cash sales, trading and execution, prime finance derivatives and corporate solutions to a global client base.Fixed Income: Cash and derivative AUD/NZD products underpinned by quantitative and analytical research and trade ideas.Research: Coverage of ANZ securities leveraging data science capabilities including quantitative equity, interest rate and macro-economic research. Strategic Advice: Support for CEO’s and boards on strategy, capital allocation and strategy execution.","Level 41, Liberty Place, 161 Castlereagh Street, , Sydney, NSW 2000, AU",null,null,null,51-200 employees,null,null,null,null,null,null,null,null,null
null,null,null,null,Development Finance Partners,null,null,null,null,null,null,null,null,http://www.dfpartners.com.au,null,null,null,null,null,"Sydney, NSW",Public Company,null,null,null,https://www.linkedin.com/company/development-finance-partners/,null,null,"Development Finance Partners are the leading industry experts in funding and partnering developments. We have a unique combination of specialist knowledge and practical experience with the Directors collectively facilitating over $2 billion in funding packages for their clients.We take a hands on approach, providing real industry advice and management support to resolve the challenges and commercial realities faced every day in the property finance sector.Development Finance Partners have also been recognised as one of Australia's most innovative and fastest growing SME's as recipients of:SmartCompany Smart 50 Award - 2015SmartCompany Smart 50 Award - 2016SmartCompany Smart 50 Award - 2017AFR Fast 100 Award - 2017Finalist Urban Developer Awards -2018 Finalist Urban Developer Awards -2019","Level 3, 31 Alfred Street, Sydney, NSW 2000, AU",null,null,null,11-50 employees,null,null,null,null,null,null,null, 02 8916 6246,null
null,null,null,null,Allegro Funds,null,null,null,null,null,null,null,null,http://www.allegrofunds.com.au,null,null,null,null,null,"Sydney, NSW",Privately Held,null,null,null,https://www.linkedin.com/company/allegro-funds-pty-ltd/,null,null,"Allegro is a leading Australasian investment firm specialising in turnaround, distressed and special situation opportunities, with more than $1b FUM and is currently investing from Allegro Fund III with investors that include leading Australian superannuation funds, New Zealand institutions and global corporations and institutions.At Allegro, We Believe in Better. Allegro provides Transformational Capital, applying capital, expertise and a distinctly hands-on approach to partnering with management and vendors to invest in businesses to help them realise their potential and deliver enduring value to shareholders. We target investment in businesses and opportunities in industries that are experiencing temporary headwinds, businesses with an over-levered capital structure or there is an opportunity to transform operational performance. In addition, our opportunities include businesses with the following criteria:•	Businesses based in Australia or New Zealand•	Revenue greater than $50 million•	Enterprise value up to $300 million•	Equity investment of between $10 million and $50 million•	Across a range of sectorsAllegro is the most recognised and awarded turnaround team in Australasia being awarded Australasian Turnaround of the Year Awards in 2008, 2010, 2011, 2012, 2016 and 2017.","Level 1, Plaza Building, 95 Pitt Street, Sydney, NSW 2000, AU",null,null,null,11-50 employees,null,null,null,null,null,null,null,null,null
null,null,null,null,ClearView Wealth Limited,null,null,null,null,null,null,null,null,http://www.clearview.com.au,null,null,null,null,null,"Sydney, NSW",Public Company,null,null,null,https://www.linkedin.com/company/clearview-retirement-solutions/,null,null,"ClearView is a fully diversified Australian life insurance and wealth management business. We’re committed to helping financial advisers, strategic partners and customers by providing access to a range of market leading life insurance and wealth management solutions.","Level 15, 20 Bond Street, Sydney, NSW 2000, AU",null,null,null,201-500 employees,null,null,null,null,null,null,null,null,null
null,null,null,null,FleetPartners,null,null,null,null,null,null,null,null,https://www.fleetpartners.com.au,null,null,null,null,null,"Richmond, Victoria",Public Company,null,null,null,https://www.linkedin.com/company/fleetpartners/,null,null,"FleetPartners is one of Australasia's leading fleet management and vehicle leasing specialists with over 70,000 vehicles on the road ranging from passenger cars through to trucks and anything in-between. From a multi-national corporation looking for a corporate fleet to a small business looking for ten vehicles, right down to the individual driver looking for personal vehicle financing solutions - we are here to help.Over the past 20 years, FleetPartners has repeatedly demonstrated our combined knowledge and expertise in providing solutions that deliver desired business and personal outcomes. Our success stems from our unique ability to align our products and services to the needs of our customers and provide tailored solutions to match your requirements. Driven by a dedication to provide exceptional customer experiences, we will work with you to develop a best-practice vehicle leasing solution that ticks all of your boxes.Our commitment to excellence is demonstrated by our recent multi-million dollar investment in one of the best leasing technology platforms in the world - Drive. With its advanced features and functionality, FleetPartners is able to continually improve our customers'​ experience.Our knowledge and combined experience in vehicle leasing and fleet management ensures that FleetPartners is second to none in our industry.  Further, our constant innovation and creativity mean that we are always at the forefront of our market, providing our customers with up to date leasing and fleet management solutions.","40 River Boulevard, Richmond, Victoria 3121, AU",null,null,null,201-500 employees,null,null,null,null,null,null,null,1300 666 001,null
null,null,null,null,Educational Funding Company,null,null,null,null,null,null,null,null,http://www.efconline.com,null,null,null,null,null,"Chevy Chase, Maryland",Privately Held,null,null,null,https://www.linkedin.com/company/educational-funding-company/,null,null,"Educational Funding Company was the first provider and still continues to be the leading tuition management and business consulting firm for professional martial arts, music, gymnastics, dance, yoga, performing arts, academics and sports schools.We aim to raise the standards of our clients' schools by extending to them insightful management services, empowered by future technological tools and information, which increases core business focus and contributes to the growth of their businesses to their maximum potential.",null,null,null,null,51-200 employees,null,null,null,null,null,null,null,null,null
