Name,Location,Overview,Phone,Industry,Company Size,Website,Headquarter,Type,Founded,Linked In URL,Address_0,Latitude_0,Longitude_0,City_0,Location_description_0,Address_1,Latitude_1,Longitude_1,City_1,Location_description_1,Address_2,Latitude_2,Longitude_2,City_2,Location_description_2,Address_3,Latitude_3,Longitude_3,City_3,Location_description_3,Address_4,Latitude_4,Longitude_4,City_4,Location_description_4,Address_5,Latitude_5,Longitude_5,City_5,Location_description_5,Country
Boswell Designs,"79 Hutchins Crescent, Kings Langley, NSW 2147, AU","Boswell Designs is a Sydney based design and marketing service, specialising in print, branding and online projects for small to medium businesses. Operating independently for the past 7 years, Boswell Designs has provided creative results for a range of clients, such as Kwik Kopy Australia, Harmony Psychology, Statewide Mechanical Services, No Fuss Homeloans, The Pregnancy & Parenting Centre and Shine PR.",null,null,2-10 employees,http://www.boswelldesigns.com.au,"Kings Langley, NSW",Partnership,null,https://www.linkedin.com/company/boswell-designs/,"79 Hutchins Crescent, Kings Langley, NSW, 2147, AU",-33.84907,151.13834,Kings Langley,Sydney Office,null,null,null,null,null,null,null,null,null,null,null,null,null,null,null,null,null,null,null,null,null,null,null,null,null,AU
Studio Woods,"Perth, WA 6000, AU","""Graphic Design is just too hard and expensive.""It doesn’t have to be. We exist to help small businesses and startups with graphic design solutions without having to break the bank.We provide creative graphic design solutions for both small businesses and startups. This includes print and digital media and websites.Our affordable packages make it really easy and simple for any business to stay on brand and look great.",0401 555 892,null,2-10 employees,https://studiowoods.com.au,"Perth, WA",Sole Proprietorship,null,https://www.linkedin.com/company/studiowoods/,null,42.02331,-73.910664,null,null,null,null,null,null,null,null,null,null,null,null,null,null,null,null,null,null,null,null,null,null,null,null,null,null,null,null
Patrick Cassidy Website Design,"160 Marine Parade, Southport, Queensland 4215, AU","Results Focussed Websites for Small Business

Are you a small business owner interested in more than just an ordinary brochure style website? Patrick Cassidy Website Design has a team of professional sales, design and technology experts with the specialist skills to ensure you receive a small business website that delivers, and is mobile device friendly.

We help small local and startup businesses just like yours, everyday, to achieve an online presence that inspires their potential customers to take action.

When you choose Patrick Cassidy Website Design, you will get access to an online marketing strategist, a pre-press graphic designer, a web designer, a developer, a direct response copywriter, an SEO specialist, and a photography and video production master, who together can present your business to your customers in the best possible light.

Our clients have peace of mind in knowing that they can come to one place to build their brand, improve their credibilty, and increase their revenue, whilst they can work at building their actual business and adding value for their clients.",null,null,2-10 employees,http://www.patrickcassidy.com.au,"Southport, Queensland",Sole Proprietorship,null,https://www.linkedin.com/company/patrick-cassidy-website-design/,"160 Marine Parade, Southport, Queensland, 4215, AU",-27.994457,153.40938,Southport,Gold Coast,null,null,null,null,null,null,null,null,null,null,null,null,null,null,null,null,null,null,null,null,null,null,null,null,null,AU
"Giraffe VCM, Canberra","Top Floor. 189 Flemington Road, Mitchell, Canberra, ACT 2911, AU","Giraffe are a fun and flexible Canberra graphic design company offering report, publication, infographic, branding, website, accessibility, typesetting, illustration, brochure, campaign and programme support solutions to our public and private sector clients.Our graphic design services include:publication designannual reportscorporate brandingbusiness brandingcampaign brandingevent brandingbrochureslogosnewsletterstypesettingsocial media graphicssignagevehicle signageWCAG 2.0 accessibility standardsaccessible PDFsbusiness cardsletterheadsstationeryfolderspostersanimationinfographicsinformation kitswebsite design",02 62429669,null,2-10 employees,https://giraffe.com.au,"Canberra, ACT",Privately Held,null,https://www.linkedin.com/company/spectrum-graphics-canberra/,"Top Floor. 189 Flemington Road, Mitchell, Canberra, ACT, 2911, AU",-35.21536,149.14151,Canberra,Where the magic happens,null,null,null,null,null,null,null,null,null,null,null,null,null,null,null,null,null,null,null,null,null,null,null,null,null,AU
THE GRAPHIC DESIGN GROUP,null,null,null,null,null,http://tgdg.com.au,null,null,null,https://www.linkedin.com/company/the-graphic-design-group/,null,null,null,null,null,null,null,null,null,null,null,null,null,null,null,null,null,null,null,null,null,null,null,null,null,null,null,null,null,null,null
Design Eye Creative,"569 Minna Road, Stowport, Tasmania 7321, AU","With over 30 years experience creating visual business solutions, Design Eye provides excellent creative services aimed from the small to medium business right up to corporations. Our services include the development of effective creative solutions that add value to your business, product or service.",null,null,2-10 employees,http://designeyecreative.com.au,"Stowport, Tasmania",Sole Proprietorship,null,https://www.linkedin.com/company/design-eye/,"569 Minna Road, Stowport, Tasmania, 7321, AU",-41.914326,145.18086,Stowport,null,null,null,null,null,null,null,null,null,null,null,null,null,null,null,null,null,null,null,null,null,null,null,null,null,null,AU
Creative Solution PTY. LTD.,"3606 Victoria Point, 100 Harbour Esplanade, Docklands VIC-3008, Victoria, Docklands VIC-3008, AU","Creative Solution is a professional image editing Services provider located in Melbourne. Quality is a key focus, our company has a dedicated team ensures a quality assurance process is maintained to ensure consistency and turnaround time. We always followed clients’ instruction to ensure the finest quality & glamorous image editing services set to meet the worldwide professional standards.We’re one of the best quality image editing service providers in Australia. We have a highly skilled team who are specialists in their own professional areas. So we are fully capable of providing all kinds of image processing services across the world.",null,null,11-50 employees,https://creativesolution.com.au/,"Victoria, Docklands",Privately Held,null,https://www.linkedin.com/company/creative-solution-pty-ltd/,"3606 Victoria Point, 100 Harbour Esplanade, Docklands VIC-3008, Victoria, Docklands, VIC-3008, AU",-25.574999,134.3547,Victoria,null,null,null,null,null,null,null,null,null,null,null,null,null,null,null,null,null,null,null,null,null,null,null,null,null,null,AU
Hyphen,"6 Torpey Pl, Broadmeadow, New South Wales 2292, AU","Founded in Sydney in 2013, we are a specialist digital creative studio working with awesome people and businesses to create, build and optimise engaging digital experiences for their clients and customers.We are a small, dedicated core team that strive to work fast, be nimble and solve challenges in our stride. Where required, we partner with select specialists in their respective fields to boost our capabilities to meet project requirements.",null,null,2-10 employees,http://wearehyphen.co,"Broadmeadow, New South Wales",Public Company,null,https://www.linkedin.com/company/hellohyphen/,"6 Torpey Pl, Broadmeadow, New South Wales, 2292, AU",-32.92528,151.7527,Broadmeadow,null,null,null,null,null,null,null,null,null,null,null,null,null,null,null,null,null,null,null,null,null,null,null,null,null,null,AU
Your Creative Space,"5 Alluvian Way, Carrum Downs, VIC 3201, AU","Your Creative Space is a Melbourne based graphic design agency, specialising in logo design, corporate images, collateral design and web design. 
From your logo to all of your collateral, we design to communicate a clear message, keeping in mind your personality, values and target audience.

Corporate Image Design - We carefully plan the way your company presents itself throughout every medium. Considering every detail, from corporate design, to communication and behavior, we shape the perception your target audience has of you.

Logo Design - From start-up to established business, we can create or refresh the perfect logo for any product, service or organisation.

Collateral Design - We passionately design any form of media to promote your brand and support your sales and marketing. Business cards, letterheads, brochures, packaging, displays, envelopes, newsletters, point of sale, exhibitions, vehicles, all designed with your brand’s core values and personalities in check.

Website Design - Partnering with industry experts we can design and build your website to meet all your needs. We work closely with brilliant minds in digital marketing and business IT to create the web applications to suit your needs.

If you are unsure if we can help, just call and ask. We are passionate about all forms of design.

Mission Statement

We love what we do

Our mission is to keep it that way, and for that to reflect through in everything we do. We are passionate about exceeding your expectations, and at the same time staying within your individual budget. Our work will be an expression of who you are and what you do. Every time we create, we put the hours in to research and develop a project perfectly suited to you. We scrutinise every detail to shape your story and present your face to your world. Your brand is all that matters to us, you will never see something we aren't proud to put our name to.",null,null,2-10 employees,http://www.yourcreativespace.net.au,"Carrum Downs, VIC",Sole Proprietorship,null,https://www.linkedin.com/company/your-creative-space/,"5 Alluvian Way, Carrum Downs, VIC, 3201, AU",-37.803425,145.01105,Carrum Downs,Your Creative Space,null,null,null,null,null,null,null,null,null,null,null,null,null,null,null,null,null,null,null,null,null,null,null,null,null,AU
Sans Serif,"Annandale, Sydney, NSW  AU","SansSerif is a design agency who likes to challenge the way you think. We could easily go into some long story about what we can do or pretend to do but simply put... we design stuff that trigger conversations and makes you look good.
We know what it takes to make noise, capture attention and move units.",null,null,2-10 employees,http://www.sansserif.com.au,"Sydney, NSW",Privately Held,null,https://www.linkedin.com/company/sans-serif/,"Annandale, Sydney, NSW, null, AU",-33.84907,151.13834,Sydney,HQ,null,null,null,null,null,null,null,null,null,null,null,null,null,null,null,null,null,null,null,null,null,null,null,null,null,AU
alnmakes,"Wollongong, NSW 2500, AU","Graphic Design & Branding Strategy for ethical and eco-friendly businesses and organisations.Hi there, I’m Alex! I’m a freelance graphic designer based on the South Coast, Australia. I founded alnmakes in 2011 after finishing my degree in Graphic Design. I haven’t stopped working as a freelancer since, and by golly do I love it. I have worked on hundreds of projects since then, and fostering close relationships with my clients is super important.I will work best for you when I’m considered a valuable part of your team who understands your needs, concerns and goals. I enjoy designing for a range of industries, from health food to software development. Come at me with your start up projects, innovators are my favourite people to work with!Let’s work together!",null,null,0-1 employees,http://alnmakes.com.au,"Wollongong, NSW",Self-Employed,null,https://www.linkedin.com/company/alnmakes/,null,null,null,null,null,null,null,null,null,null,null,null,null,null,null,null,null,null,null,null,null,null,null,null,null,null,null,null,null,null,null
A Christou Design Pty Ltd,"5049, AU","A Christou Design offers services in the areas of; Graphic Design, Corporate Identity, Website Design and Multimedia, Illustration, Advertising and Print design.",null,null,2-10 employees,http://www.christoudesign.com,null,Privately Held,null,https://www.linkedin.com/company/a-christou-design-pty-ltd/,"null, null, null, 5049, AU",-34.897945,138.59166,null,null,null,null,null,null,null,null,null,null,null,null,null,null,null,null,null,null,null,null,null,null,null,null,null,null,null,AU
Stickygreenfrog Graphic Design,"Level 1, 286, West Street, Umina Beach, NSW 2257, AU","Professional Graphic Design ServicesStickygreenfrog is a design studio specialising in graphic design, brand development, corporate identity, logo design, Wordpress website design and development.We offer high quality and professional design services that deliver your message and drive your business forward. We create sharp and stylish logo design, website design and graphic communciation to fit any budget and brief. At Stickygreenfrog, we pride ourselves in providing a personal graphic design service that ensures you get the look your business needs.Our difference is simpleWe invest our time and our knowledge and provide a highly personalised service to working with you and your business, to produce quality outcomes and deliver long term success.We’ve established professional partnerships with marketeers, developers, creative thinkers, photographers, teachers, bloggers, joggers and frog lovers. All with an understanding of how brands work and how to deliver great results each and every time.",6.10E+11,null,2-10 employees,http://www.stickygreenfrog.com.au,"Umina Beach, NSW",Partnership,null,https://www.linkedin.com/company/stickygreenfrog-graphic-design/,"Level 1, Umina Beach, NSW, 2257, AU",-33.84907,151.13834,Umina Beach,Common on West,null,null,null,null,null,null,null,null,null,null,null,null,null,null,null,null,null,null,null,null,null,null,null,null,null,AU
Paperclip Studio Aus,"5a Hartnett Clos, Mulgrave, Victoria 3170, AU","We help startups, not-for-profits, small business & food+bev tell their awesome stories.#bringyourbrandtogether",null,null,2-10 employees,https://www.paperclipstudio.com.au/,"Mulgrave, Victoria",Privately Held,null,https://www.linkedin.com/company/paperclip-studio-aus/,null,52.09351,5.035638,null,null,null,null,null,null,null,null,null,null,null,null,null,null,null,null,null,null,null,null,null,null,null,null,null,null,null,null
Koodoz Design,"203 Langridge Street, Abbotsford, VIC 3067, AU","Koodoz Design is a creative design studio based in Abbotsford, Melbourne. We help businesses unleash their full potential through visual communication and clever design.

As a creative studio, we're well versed in the arts of design. We offer a wide range of professional services, to help give your business the visual edge it deserves, including: 

• Website Design and Development with a strong focus on UI / UX Design
• Search Engine Optimisation (SEO)
• Social Media and Internet Marketing
• iPhone and iPad (iOS) Software Development
• Logo Design and Brand Consulting 
• and Graphic Design for Printed Media

For more information, visit our website: http://www.koodoz.com.au",null,null,2-10 employees,http://www.koodoz.com.au,"Abbotsford, VIC",Privately Held,null,https://www.linkedin.com/company/koodoz-design/,"203 Langridge Street, Abbotsford, VIC, 3067, AU",-37.803425,145.01105,Abbotsford,House of Commons,null,null,null,null,null,null,null,null,null,null,null,null,null,null,null,null,null,null,null,null,null,null,null,null,null,AU
Creato™,"156 Epping Rd, Lane Cove, New South Wales 2066, AU","Creato™ is an Australian based graphic design agencyHelping Australian businesses with logo design, website design & marketingWe are a team of talented graphic designers & web developersWe specialise in clean, modern designCreato™ has been featured in The Huffington Post, Entrepreneur, BuzzFeed & Just Creative",432981344,null,2-10 employees,https://creato.com.au/,"Lane Cove, New South Wales",Privately Held,null,https://www.linkedin.com/company/creato-logo-design/,null,null,null,null,null,null,null,null,null,null,null,null,null,null,null,null,null,null,null,null,null,null,null,null,null,null,null,null,null,null,null
krycha.com,"2076, AU","krycha.com was formed with the current economical situation in mind

there is a growing need for lower prices while upholding a high standard of design and this is precisely the objective of krycha.com - cutting the costs in every possible area, while providing the best quality service

We are a bright and exciting Sydney graphic arts studio, with some of the best graphic designers and web designers in Sydney, specialising in graphic arts, logo design, website design, e-flyers, packaging and promotional advertising.

Our team of graphic arts specialists work on a whole range of graphic arts products, including e-flyers, web design, and logo design.
The digital team consists of some of Sydney’s leading web designers who design and develop a wide range of web products.

We do also believe that design is a concept of art, which is why we have introduced the traditional media range. Our talented graphic designers explore the worlds of painting, drawing and illustration.

Design is our passion.
Promoting businesses is our skill.
Helping our clients become successful is our goal.

We understand the world of advertising and marketing - you can rely on our professional approach. Our team of graphic designers, web designers, programmers, graphic arts specialists, and marketing consultants will make the whole experience smooth and easy. All you have to do is watch your business bloom.

at krycha.com we know the marketing world",null,null,2-10 employees,http://www.krycha.com,null,Privately Held,null,https://www.linkedin.com/company/krycha.com/,"null, null, null, 2076, AU",-33.84907,151.13834,null,null,null,null,null,null,null,null,null,null,null,null,null,null,null,null,null,null,null,null,null,null,null,null,null,null,null,AU
Impact Graphics Pty Ltd,"Suite 1, 65 Eton Street, Sutherland, NSW 2232, AU","Impact Graphics is a full service Graphic Design, Advertising, Web Design and Digital Media studio.  We specialise in:> Branding Design and Corporate Identity Management> Packaging Design and FMCG Product Design> Web Development, SEO, SEM, eCommerce and Multimedia Development> Internet Marketing and PR Campaigns> Advertising and Marketing Strategies and all Media Placement> Point-of-Sale Material, Signage and Exhibition Design> Annual Reports, Prospectuses and Corporate Literature Design> Brochures, Newsletters, Posters and Direct Mail> Photography and Photo Enhancement> Copywriting and Copy-editing> Pre-Press, Digital Printing and Print Management",1300 794 654,null,2-10 employees,https://www.impactgraphics.com.au,"Sutherland, NSW",Privately Held,null,https://www.linkedin.com/company/impact-graphics-pty-limited/,"Suite 1, 65 Eton Street, Sutherland, NSW, 2232, AU",-33.84907,151.13834,Sutherland,null,null,null,null,null,null,null,null,null,null,null,null,null,null,null,null,null,null,null,null,null,null,null,null,null,null,AU
Elvira-Art Designs,"2566, AU","We are a small graphic design business that is here to help meet the needs of individuals and other small businesses. 

We aim to keep our competitive prices low and service standard high. Elvira-Art Designs was created in August 2007 by Elvira Cherry.

Elvira worked as a graphic designer with skills in pre-press for 4 years before moving to Australia.

She holds an overseas Diploma in Graphic Design and is working on her Diploma of Graphic Design at Design Centre, Enmore.

She has completed a Certificate IV in Graphic Design at TAFE in 2008.

Elvira also holds a Certificate IV in Business (Small Business Management) and a Certificate IV in Training and Assessment. Elvira is also an artist who enjoys drawings, painting and batik (silk paintings).

As a small business owner she understands the needs of small businesses and knows about limited finances. She can help design your business ideas and keep well within your budget.",null,null,0-1 employees,http://www.elvira-art.com.au,null,Self-Employed,null,https://www.linkedin.com/company/elvira-art-designs/,"null, null, null, 2566, AU",-33.84907,151.13834,null,null,null,null,null,null,null,null,null,null,null,null,null,null,null,null,null,null,null,null,null,null,null,null,null,null,null,AU
Elevator Creative Agency,"574 Kiewa St, Albury, New South Wales 2640, AU","Full service creative agency offering print, web, social and mobile strategy, design and execution. We offer a fresh look at conventional business and brand communication problems - often illuminating for our clients the links between the online and offline worlds and how they can best be utilised together to communicate a business brand to market in the most effective, measureable, way.",null,null,2-10 employees,http://www.elevatorcreative.com.au,"Albury, New South Wales",Privately Held,null,https://www.linkedin.com/company/elevator-creative-agency/,null,null,null,null,null,null,null,null,null,null,null,null,null,null,null,null,null,null,null,null,null,null,null,null,null,null,null,null,null,null,null
Canberra Design House,"2619, AU","Canberra Design House was formed out of a refusal to work for commercial, overpriced, design agencies with strict guidelines. Changing this has meant that our price-point, service, and original design makes us very popular with small business owners. So, if you've recently started a business, or would like to improve the professional brand of your existing business, give us a call... it couldn't hurt...",null,null,2-10 employees,http://www.canberradesignhouse.com,null,Partnership,null,https://www.linkedin.com/company/canberra-design-house/,"null, null, null, 2619, AU",-35.385662,149.19958,null,null,null,null,null,null,null,null,null,null,null,null,null,null,null,null,null,null,null,null,null,null,null,null,null,null,null,AU
TANIA LLOYD: DESIGN & MARKETING SPECIALIST,"perth, western australia 6170, AU","As a freelance graphic designer based in Perth, Australia, I‘m here to help you develop and promote your business and brand.With over 16 years in the industry, I will make your vision become reality, whether you're starting from scratch or breathing new life into an existing brand.It doesn’t matter if you’re at start up or already an established company, I’ve worked with everyone form sole traders to large company’s who present to boards, and can tailor any service to suit your needs. If you’re looking for someone to craft your brand, strategise your marketing and advertising campaign or simply get you noticed, then you’ve found who you’re looking for.Let’s do this.... Can’t wait to work together!",438118611,null,0-1 employees,http://www.tanialloyd.com.au,"perth, western australia",Privately Held,null,https://www.linkedin.com/company/tania-lloyd-graphic-design-marketing/,null,55.976342,-3.167811,null,null,null,null,null,null,null,null,null,null,null,null,null,null,null,null,null,null,null,null,null,null,null,null,null,null,null,null
Anothermind.,"202 Rathdowne St, Melbourne, Victoria 3054, AU","We design meaningful brands that tell your story in adaptive, compelling ways. We work with driven entrepreneurs and businesses to create visual communications that thrive in an increasingly design-savvy world. Welcome to Anothermind.",null,null,2-10 employees,http://anothermind.co,"Melbourne, Victoria",Self-Employed,null,https://www.linkedin.com/company/anothermind/,"202 Rathdowne St, Melbourne, Victoria, 3054, AU",-37.803425,145.01105,Melbourne,null,null,null,null,null,null,null,null,null,null,null,null,null,null,null,null,null,null,null,null,null,null,null,null,null,null,AU
Sarah Jade Green Design,"Moreland Rd, Coburg, Victoria 3058, AU","Sarah Jade Green is a digital and graphic designer specialising in digitial design and digital production. Focusing on developing, designing and building strong eDM campaigns in HTML/CSS. A savvy visual communicator, Sarah possesses sensational creative and technical abilities and can see your project through from concept to completion. Intuitive, balanced and professional, with a background in print, Sarah delivers digital and print communication solutions tailor-made to your requirements.Services include: Annual Reports, Brand Identity, Brochures, Business Cards, Display Ads, eDMs, Flyers, Logos, Photoshoot Art Direction, POS, Posters, Presentations, Promotional Materials, Signage, Social Media, Stationery, Websites and more.Special interest in: Letterpress and Screen Printing.Technical abilities: Adobe CC – InDesign, Illustrator, Photoshop, Bridge, Dreamweaver, XD and Acrobat Pro. HTML/CSS, Jira, Invision, Jekyll, Magento, WordPress, Shopify, Enrich, Responsys, Litmus and MailChimp. Microsoft Office – Excel, Word and PowerPoint.",null,null,0-1 employees,http://www.sarahjadegreen.com/,"Coburg, Victoria",Self-Employed,null,https://www.linkedin.com/company/sarah-jade-green-design/,"Moreland Rd, Coburg, Victoria, 3058, AU",-37.803425,145.01105,Coburg,null,null,null,null,null,null,null,null,null,null,null,null,null,null,null,null,null,null,null,null,null,null,null,null,null,null,AU
