Name,Location,Overview,Phone,Industry,Company Size,Website,Headquarter,Type,Founded,Linked In URL,Address_0,Latitude_0,Longitude_0,City_0,Location_description_0,Address_1,Latitude_1,Longitude_1,City_1,Location_description_1,Address_2,Latitude_2,Longitude_2,City_2,Location_description_2,Address_3,Latitude_3,Longitude_3,City_3,Location_description_3,Address_4,Latitude_4,Longitude_4,City_4,Location_description_4,Address_5,Latitude_5,Longitude_5,City_5,Location_description_5,Country
Simmer Studio,"22 Grey Gum Crescent, Chisholm, NSW 2322, AU","Simmer is a Hunter Valley based graphic design studio established by Ryan Simmons. He has a high level of skill across print, digital and video with a focus on creating hand crafted work tailored exactly to your needs.

Ryan has over 10 years experience as a designer. Its not just work for him, he lives and breathes design which shows in his creative work and the results delivered to clients. He is passionate about finding specialised, tailored design solutions to meet the needs of the vastly different clients that he works with.

Over the past 10 years Ryans experience has included working with local and international clients and businesses across corporate, industrial and creative industries. He is very familiar with working towards high pressure deadlines and knows what it takes to get a job done on time within a variety of design mediums and budgets.

Ryan loves his work in the creative field and looks forward to creating the right solution for you!",null,null,0-1 employees,http://www.simmerstudio.com.au,"Chisholm, NSW",Public Company,null,https://www.linkedin.com/company/simmer-studio/,"22 Grey Gum Crescent, Chisholm, NSW, 2322, AU",-32.829407,151.7133,Chisholm,"Newcastle, hunter Region",null,null,null,null,null,null,null,null,null,null,null,null,null,null,null,null,null,null,null,null,null,null,null,null,null,AU
Allan Moran Design,"Adelaide,   AU","Freelance Graphic Designer with over 15 years commercial experience, specialising in corporate publications, signage systems, brand identity development and online marketing.

Working with an enthusiastic group of associates from Photographers, Illustrators, Copywriters, Printers and Marketing gurus. Jobs big or small  work one on one with allanmoran. or we can customise a team of creative professionals to bring your brand to life.

A passion for great design and a belief that the most successful communication is a product of a collaborative and creative dialogue. To understand the ever-changing motivations of your audience, and communicate your brand in a strategic, intelligent and engaging way.

Good design, is always a measure of concise communication and a genuine empathy for the target audience.
Great design however, takes the audience to the next level it excites, inspires, as well as informs.

Bringing brands to life with an intelligent blend of creativity and strategic business understanding.",null,null,2-10 employees,http://www.allanmoran.com,null,Self-Employed,null,https://www.linkedin.com/company/allan-moran.-design-and-communication./,"null, Adelaide, null, null, AU",-34.897945,138.59166,Adelaide,null,null,null,null,null,null,null,null,null,null,null,null,null,null,null,null,null,null,null,null,null,null,null,null,null,null,AU
Newspaper House Printing,"64 Sydney St, Kilmore, Victoria 3764, AU",With a dedicated team of creative designers and expert knowledge within the print industry Newspaper House Printing (NHP) offer a broad range of design and print solutions to help guide customers to the best possible solution dedicated towards their individual brand and markets.At NHP we have a variety of machinery onsite so we can create and finish jobs with a minimal turnaround period.NHP focuses on creating long term customer relations and delivering a final product that ensures our clients remain prominent visually and have successful outcomes.,null,null,2-10 employees,http://ymedia.toprint.com.au,"Kilmore, Victoria",Privately Held,null,https://www.linkedin.com/company/nhprint/,"64 Sydney St, Kilmore, Victoria, 3764, AU",-37.31555,144.89203,Kilmore,The North Central Review Pty Ptd,null,null,null,null,null,null,null,null,null,null,null,null,null,null,null,null,null,null,null,null,null,null,null,null,null,AU
Townsville Signs,null,Townsville Signs is a graphic design company based out of Australia.,null,null,null,http://townsvillesigns.net,null,null,null,https://www.linkedin.com/company/townsville-signs/,null,-19.321635,146.758711,null,null,null,null,null,null,null,null,null,null,null,null,null,null,null,null,null,null,null,null,null,null,null,null,null,null,null,null
Butter Stream Design,"3 Columbia Court, Suite 3, Level 3, Baulkham Hills, NSW 2153, AU","Butter Stream Design is all about creating beautiful and engaging content on the web and in print. We're committed to big ideas and strong execution.
Based in Castle Hill, NSW Australia, our services primarily cover production for the advertising industry. We can take part in as little or as much of your project as you need. We can see it through from concept to print or we can slot in at any stage along the way.",null,null,2-10 employees,http://www.butterstream.com.au,"Baulkham Hills, NSW",Public Company,null,https://www.linkedin.com/company/butter-stream-design/,"3 Columbia Court, Baulkham Hills, NSW, 2153, AU",-33.84907,151.13834,Baulkham Hills,Butter HQ,null,null,null,null,null,null,null,null,null,null,null,null,null,null,null,null,null,null,null,null,null,null,null,null,null,AU
Dextrus Designs,"Unit 3, 38 Essington Street, Mitchell, ACT 2911, AU","Our team of talented creatives bring a wide range of experiences and unique skill sets to the table. We understand that design is not just about looking good and it's important to find the right fit for your business. We believe that with strong relationships comes clear communication, fostering an environment of understanding where great design can grow. This is how we are able to work with our clients to recognise not just the product they want, but the design they need.",02 6255 0307,null,2-10 employees,https://dextrus.com.au/,"Mitchell, ACT",Privately Held,null,https://www.linkedin.com/company/dextrusdesigns/,"Unit 3, 38 Essington Street, Mitchell, ACT, 2911, AU",-35.21536,149.14151,Mitchell,null,null,null,null,null,null,null,null,null,null,null,null,null,null,null,null,null,null,null,null,null,null,null,null,null,null,AU
Undullify,"Swanston Street, Melbourne, Victoria 3000, AU","Unlimited graphic designs services. We get all your small design tasks done, headache free.",null,null,11-50 employees,http://undullify.com,"Melbourne, Victoria",Privately Held,null,https://www.linkedin.com/company/undullify/,null,null,null,null,null,null,null,null,null,null,null,null,null,null,null,null,null,null,null,null,null,null,null,null,null,null,null,null,null,null,null
Little Engine,"22 Aberfeldy St, Kenmore, Brisbane, Queensland 4069, AU","Little Engine is a boutique consultancy specialising in creative and transformational ideas for small business.

Here at Little Engine we are passionate about good design. We believe that good design is not only about the destination (high end creative work) but its about the journey (the design process). Stopping at all stations from concept through to creation we work with you to create clean, clear and concise communication that engages with your target customer.",null,null,2-10 employees,http://www.LittleEngine.com.au,"Brisbane, Queensland",Privately Held,null,https://www.linkedin.com/company/little-engine/,"22 Aberfeldy St, Kenmore, Brisbane, Queensland, 4069, AU",-27.47126,153.01831,Brisbane,null,null,null,null,null,null,null,null,null,null,null,null,null,null,null,null,null,null,null,null,null,null,null,null,null,null,AU
cleverdeer,"11 Argyle Street, Fitzroy, VIC 3065, AU",cleverdeer is a multidisciplinary design practice specialising in providing tailored design solutions across a broad range of media. cleverdeer aims to collaborate with other artists/designers/photographers/illustrators to produce work that is pleasantly refreshing in its execution and clever in its delivery. cleverdeer was founded in July 2011 by John Deer.,null,null,0-1 employees,http://www.cleverdeer.com,"Fitzroy, VIC",Self-Employed,null,https://www.linkedin.com/company/cleverdeer/,"11 Argyle Street, Fitzroy, VIC, 3065, AU",-37.803425,145.01105,Fitzroy,Studio,null,null,null,null,null,null,null,null,null,null,null,null,null,null,null,null,null,null,null,null,null,null,null,null,null,AU
M & L Australia Pty Ltd,null,"M & L design and produce enamel and metal products for companies like Qantas, major unions/charities, State and Federal Government departments etc across Australia.

Badges, medals, key rings, corporate cuff links and neckwear. Also a range of PVC items like coasters and key rings for promotional purposes. Ideal for corporate recognition/reward programmes and corporate identity purposes.",null,null,2-10 employees,http://www.mandl.com.au,"Willetton, WA",Privately Held,null,https://www.linkedin.com/company/m-&-l-australia-pty-ltd/,null,null,null,null,null,null,null,null,null,null,null,null,null,null,null,null,null,null,null,null,null,null,null,null,null,null,null,null,null,null,null
TNP Creative,"Melbourne, Victoria 3057, AU",Brand StrategyLogo DesignPrint DesignPackaging DesignWebsite DesignSocial Media Management,405074445,null,0-1 employees,http://www.instagram.com/tnp.creative/,"Melbourne, Victoria",Self-Employed,null,https://www.linkedin.com/company/tnp-creative/,"null, Melbourne, Victoria, 3057, AU",-37.803425,145.01105,Melbourne,Office,null,null,null,null,null,null,null,null,null,null,null,null,null,null,null,null,null,null,null,null,null,null,null,null,null,AU
dh design,null,"Looking for a professional Design service? DHDesign has been providing website, graphic design, web hosting, printing and domain name services since the year 2000. DHDesign is currently based on the Gold Coast, we have clients Australia wide.DHDesign specialises in Wordpress. All of our website packages come with many features.Website Hosting Our web hosting service is very reliable and our server is based in Australia. We have hosting solutions for small and large companies and all our hosting packages come with the industry standard web hosting management tool C/Panel. Offering an easy to use, standardised interface for web hosting.DHDesign has been in the graphic design industry for over 17 years, we have experience with all types of design including print, web, signage.DHDesign can provide very competitive off-set and digital printing. With over 17 years experience in the printing industry we have sourced some of the best trade printers in Australia. We provide a quality affordable service with fast turnaround times.",null,null,2-10 employees,http://www.dhdesign.net.au,"Gold Coast, Queensland",Sole Proprietorship,null,https://www.linkedin.com/company/net13/,"Oxenford, Gold Coast, Queensland, null, AU",-27.994457,153.40938,Gold Coast,null,"Phu My Hung, District 7, Ho Chi Minh City, null, null, VN",10.782618,106.69591,Ho Chi Minh City,null,null,null,null,null,null,null,null,null,null,null,null,null,null,null,null,null,null,null,null,null,VN
Myls One Creative House,"5/61 Lygon Street, Brunswick East, VIC 3057, AU","Myls One Creative House provides a professional graphic design particularly for print media and also photography services especially commercial products.

All ideas for your business are our passion from our professional graphic designers with highly skilled and experienced over 10 years; we ensure a high quality visual communication between you and your valued customers. Great design will not only appeal to your target customers but also leaves an impression of your corporate brand in their minds.",null,null,2-10 employees,http://www.mylsone.com.au,"Brunswick East, VIC",Sole Proprietorship,null,https://www.linkedin.com/company/myls-one-creative-house/,"5/61 Lygon Street, Brunswick East, VIC, 3057, AU",-37.803425,145.01105,Brunswick East,null,"Phu My Hung, District 7, Ho Chi Minh City, null, null, VN",10.782618,106.69591,Ho Chi Minh City,null,null,null,null,null,null,null,null,null,null,null,null,null,null,null,null,null,null,null,null,null,AU
Alleyoop!,"Level 1, 118 Boundary Street, West End, Queensland 4101, AU","Quick, nimble, on-the-ball, Alleyoop is a passionate supporter of brands of all shapes and sizes. We look to the world for inspiration, aiming to make ours a more beautiful place to do business. Above all, we design visual communication that attracts, resonates with and motivates your target audience into action. We love working with people who dream big, and understand the important role that clever design has to play in reaching your goals.",null,null,0-1 employees,http://www.alleyoopgroup.com,"West End, Queensland",Privately Held,null,https://www.linkedin.com/company/helen-stump-graphic-design/,"Level 1, 118 Boundary Street, West End, Queensland, 4101, AU",-27.47126,153.01831,West End,null,"Phu My Hung, District 7, Ho Chi Minh City, null, null, VN",10.782618,106.69591,Ho Chi Minh City,null,null,null,null,null,null,null,null,null,null,null,null,null,null,null,null,null,null,null,null,null,AU
Vanzella Graphic Design,null,null,null,null,null,http://vanzella.com.au,"Northcote, Victoria",null,null,https://www.linkedin.com/company/vanzella-graphic-design/,null,47.21585,-1.56342,null,null,null,null,null,null,null,null,null,null,null,null,null,null,null,null,null,null,null,null,null,null,null,null,null,null,null,null
THE WORKS PRINTING GROUP PTY LTD,null,"THE WORKS PRINTING GROUP PTY LTD is a graphic design company based out of 61 Lampton Ave, Derwent Park, Tasmania, Australia.",null,null,null,null,"Derwent Park, Tasmania",null,null,https://www.linkedin.com/company/the-works-printing-group-pty-ltd/,null,null,null,null,null,null,null,null,null,null,null,null,null,null,null,null,null,null,null,null,null,null,null,null,null,null,null,null,null,null,null
Natalie Pasnin Designs,"Botanic Ridge, VIC 3178, AU","Your vision brought to life.Our sole focus is to create and collaborate with like-minded, driven businesses and individuals, to create custom designs that make a statement and inspire audiences with elegance and simplicity.We would love to work together to bring your vision to life.",null,null,0-1 employees,http://www.nataliepasnin.com.au,"Botanic Ridge, VIC",Self-Employed,null,https://www.linkedin.com/company/natalie-pasnin-designs/,null,null,null,null,null,null,null,null,null,null,null,null,null,null,null,null,null,null,null,null,null,null,null,null,null,null,null,null,null,null,null
Heapssmall,"Melbourne,   AU",We're a creative design studio from Melbourne and we're heaps excited that you're here. We get our rocks off working on all sorts of creative stuff and take pride in our work. We love what we do and always remember to have heaps of fun!,null,null,2-10 employees,http://www.heapssmall.com,null,Partnership,null,https://www.linkedin.com/company/heapssmall/,null,null,null,null,null,null,null,null,null,null,null,null,null,null,null,null,null,null,null,null,null,null,null,null,null,null,null,null,null,null,null
Casa del Pxel,"33 Archibald ST, Canberra, ACT 2602, AU","Casa del Pxel, fundada en 2011, es un estudio audiovisual con una actividad diversificada en distintas reas relacionadas con internet, vdeo, fotografa y diseo grfico. Desempea su actividad en toda Espaa a travs de internet, y tiene su sede principal en Madrid.",null,null,0-1 employees,http://casadelpixel.com,"Canberra, ACT",Self-Employed,null,https://www.linkedin.com/company/casa-del-p-xel/,"33 Archibald ST, Canberra, ACT, 2602, AU",-35.28078,149.1314,Canberra,null,null,null,null,null,null,null,null,null,null,null,null,null,null,null,null,null,null,null,null,null,null,null,null,null,null,AU
StudioUs,"Nareen Parade, North Narrabeen, New South Wales 2101, AU","?? Studio Us is formed on the basis of collaboration and connection   working together to understand each projects underlying story and ultimately bringing forth that what makes a clients brand successful: its connection. ?? Connection between all of its elements - the purpose it holds, the unique offering it provides, through to what it imparts to its audience. People connect to brands they relate to. It goes well beyond what the logo looks like, it goes in to what it stands for.?? Here at Studio Us we design for good, for a stronger community and for the visionaries who share the same passion.",431048861,null,2-10 employees,https://studio-us.com.au/,"North Narrabeen, New South Wales",Sole Proprietorship,null,https://www.linkedin.com/company/studio-us-au/,null,22.282403,114.185426,null,null,null,null,null,null,null,null,null,null,null,null,null,null,null,null,null,null,null,null,null,null,null,null,null,null,null,null
Sofia Varano Illustrations,"Perth, Western Australia 6000, AU","Sofia Varano is an Australian graphic designer, specialising in illustration.She employs a variety of mediums spanning from watercolours to digital manipulation to create works which depict outlandish content with an often vibrant aesthetic.Clients include Amazon Pay, The Washington Post, Orange telecommunications, Headspace, Liquor.com, Learnosity, Caleopaper, SoftIron, Chillhop, Creative Mornings, Lettershop books NYC, Common good, Intergranet, RAC, Transperth, and Biblio.com",null,null,0-1 employees,http://www.sofiavarano.com,"Perth, Western Australia",Self-Employed,null,https://www.linkedin.com/company/sofia-varano-illustrations/,null,null,null,null,null,null,null,null,null,null,null,null,null,null,null,null,null,null,null,null,null,null,null,null,null,null,null,null,null,null,null
Hardcopy Cartel,"585 Little Collins St, Melbourne, Victoria 3000, AU","We love the illustrative and fun style of design. That's what we're about here are Hardcopy Cartel. We want to breath life back into design one drawing at a time. You might be thinking, ""but I work for or I am a corporate company, no one would go for this.""? But maybe you could have the best of both worlds? Why not have the beautifully laid out typography companied by interesting illustrations to add an element of fun to what might other wise be something not that interesting? It can be done! Let's make something fun together! We specialise in branding. What's branding? It's your logo, typography, colours, patterns all coming together and giving your company or yourself, a cohesive ""visual voice""?. Let's make that voice be heard!Examples of what we can create: Logo, business cards, brochures, flyers, forms, patterns, social media templates, web site elements, postcards, specialised patterns for things like dresses/hats/bags..",null,null,0-1 employees,http://www.hardcopycartel.com.au,"Melbourne, Victoria",Privately Held,null,https://www.linkedin.com/company/hardcopy-cartel/,"585 Little Collins St, Melbourne, Victoria, 3000, AU",-37.803425,145.01105,Melbourne,null,null,null,null,null,null,null,null,null,null,null,null,null,null,null,null,null,null,null,null,null,null,null,null,null,null,AU
Design That Matters,"Perth, WA 6020, AU",Specialized in Graphic Design for Oil and Gas industry,null,null,0-1 employees,https://www.designthatmatters.com.au/,"Perth, WA",Self-Employed,null,https://www.linkedin.com/company/designthatmattersaustralia/,null,50.10928,14.47478,null,null,null,null,null,null,null,null,null,null,null,null,null,null,null,null,null,null,null,null,null,null,null,null,null,null,null,null
CREATIVE CIRCLE DESIGNS,null,"As a smaller design studio, we work harder, tighter and more efficiently to provide our clients with the best service. 
We have all the talent you need, without the staff overheads of bigger agencies.
We believe in good design and advertising and we know how to produce it.
We will always respect, listen to and work closely with you to achieve your goals. 
You know your business. We know advertising......together we can make a powerful impact!",null,null,2-10 employees,http://www.creativecircle.com.au,"ALEXANDRIA, NSW",Self-Employed,null,https://www.linkedin.com/company/creative-circle-designs/,null,null,null,null,null,null,null,null,null,null,null,null,null,null,null,null,null,null,null,null,null,null,null,null,null,null,null,null,null,null,null
Brandbuild Pty Ltd,"177 Darling Road, Malvern East, VIC 3145, AU","brandbuild is a Strategic Consulting and full-service Advertising Agency, with four major divisions: Strategy, Design, Digital & Logistics.

All brandbuild personnel are classically educated. All have a thorough grounding in the larger consulting practices or international advertising agencies. All were dissatisfied with what they saw. We pride ourselves on approaching our work differently.

With modest offices in both Melbourne and Sydney, brandbuild can coordinate large-scale projects, but clients dont pay for large-scale overheads.

brandbuild is comprised of a team of Consultants, Research Associates, Media Planner Buyer, an in-house Graphic Design team, a digital development team, stock management personnel and administrative services. The company was formed in 2001.",+61 395332144,null,2-10 employees,http://www.brandbuild.com,"Malvern East, VIC",Privately Held,null,https://www.linkedin.com/company/brandbuild-pty-ltd/,"177 Darling Road, Malvern East, VIC, 3145, AU",-37.803425,145.01105,Malvern East,Brandbuild Melbourne,null,null,null,null,null,null,null,null,null,null,null,null,null,null,null,null,null,null,null,null,null,null,null,null,null,AU
de.co design studio,"15 Ruthven Avenue, Adelaide, South Australia 5000, AU","Our design company'? is a group of dedicated and committed graphic design professionals with a broad range of individual talents. Together, we create solutions that are relevant coherent and effective. We are based in Adelaide and provide design services for clients both locally and nationally.",null,null,2-10 employees,http://de-co.com.au,"Adelaide, South Australia",Privately Held,null,https://www.linkedin.com/company/de.co-pty-ltd/,"15 Ruthven Avenue, Adelaide, South Australia, 5000, AU",-34.897945,138.59166,Adelaide,null,null,null,null,null,null,null,null,null,null,null,null,null,null,null,null,null,null,null,null,null,null,null,null,null,null,AU
BizziBee Graphic Design,"Melbourne,   AU","BizziBee Graphic Design specialise in fully customised and personalised laser cut wedding stationery. We offer our clients a complete design and manufacturing service. 

Our service starts from a personal consultation with the client, where we discuss their design requirements such as theme, colour, look, size, font and budget. With a wealth of experience behind us, we do not charge our clients for any personalisation they request nor do we charge on the various paper stock they choose.

BizziBee Graphic Design will do your stationery from concept design to home delivery. 

Products that we offer:
- Engagement Invitations
- Save The Date Cards
- Wedding Invitations
- RSVP Cards
- Wishing Well Cards
- Registry Cards
- Map or Direction Cards
- Accommodation Suggestion Card
- Order of Service (covers and inserts)
- Programs
- Seating Charts
- Place Cards
- Menus
- Table Numbers
- Gift Boxes
- Guest Books
- Thank You Cards",null,null,2-10 employees,http://www.bizzibee.com.au,null,Sole Proprietorship,null,https://www.linkedin.com/company/bizzibee-graphic-design/,"null, Melbourne, null, null, AU",-37.803425,145.01105,Melbourne,null,null,null,null,null,null,null,null,null,null,null,null,null,null,null,null,null,null,null,null,null,null,null,null,null,null,AU
Brand Productions,"2/22 Pinacle Street, Brendale, Brisbane, QLD 4500, AU","Brand Productions is the combined strength of two of Australia's leading sign and print manufacturers.

When you call Brand Productions you're calling on over 20 years of industry experience in print production, vinyl production and specialty sign fabrication.

Our friendly staff are ready to assist you at any or all levels of design and production to help make your next project a success.",null,null,11-50 employees,http://www.brandproductions.com.au,"Brisbane, QLD",Public Company,null,https://www.linkedin.com/company/brand-productions/,"2/22 Pinacle Street, Brisbane, QLD, 4500, AU",-27.47126,153.01831,Brisbane,null,null,null,null,null,null,null,null,null,null,null,null,null,null,null,null,null,null,null,null,null,null,null,null,null,null,AU
January Jade,"NA, NA, Frankston, Vic 3199, AU","January Jade is a Melbourne based Creative Design Studio and Print Management Agency that specialises in combining your vision with my creative skills to produce the best outcomes at the right price. Combine that with the best print and media connections and you dont have to go anywhere else.  
Have a wander through the site and if you have any questions, feel free to give me a call.
Jason Nehill
Director",null,null,0-1 employees,http://www.januaryjade.com,"Frankston, Vic",Sole Proprietorship,null,https://www.linkedin.com/company/january-jade/,"NA, Frankston, Vic, 3199, AU",-37.803425,145.01105,Frankston,Head Office,null,null,null,null,null,null,null,null,null,null,null,null,null,null,null,null,null,null,null,null,null,null,null,null,null,AU
Fruitful Creative,"139 Grays Point Road, GRAYS POINT, NSW 2232, AU","Fruitful Creative's Creative Director, Graphic Designer, Web Designer, Business Manager, Sales Director and Secretary - are all one and the same person - Trina Johnson. I don't try to pretend to be a big organisation with loads of staff, but I do promise innovative, great design, above-and-beyond customer service and decent, up-front pricing.",272095300,null,2-10 employees,http://www.fruitfulcreative.com.au,"GRAYS POINT, NSW",Self-Employed,null,https://www.linkedin.com/company/fruitful-creative/,"139 Grays Point Road, GRAYS POINT, NSW, 2232, AU",-33.84907,151.13834,GRAYS POINT,null,null,null,null,null,null,null,null,null,null,null,null,null,null,null,null,null,null,null,null,null,null,null,null,null,null,AU
