Name,Location,Overview,Phone,Industry,Company Size,Website,Headquarter,Type,Founded,Linked In URL,Address_0,Latitude_0,Longitude_0,City_0,Location_description_0,Address_1,Latitude_1,Longitude_1,City_1,Location_description_1,Address_2,Latitude_2,Longitude_2,City_2,Location_description_2,Address_3,Latitude_3,Longitude_3,City_3,Location_description_3,Address_4,Latitude_4,Longitude_4,City_4,Location_description_4,Address_5,Latitude_5,Longitude_5,City_5,Location_description_5,Country
"Black & Gold | Web Design, Graphic Design Melbourne","302/30 Therry st, Melbourne, VIC 3000, AU","Black & Gold is a graphic design and web design studio based in Melbourne. We help businesses across their graphic design, web design, SEO, and printing needs.

Coming from a Marketing background, we understand the need for quick efficient work that is both visually appealing and effectively designed. We employ the best expertise to make sure your business gets functionality and aesthetics at their optimal. 

From design work to websites, SEO to printing, if you have a project that we might be able to help with or an idea you'd like to discuss then we'd love to hear from you.",null,null,2-10 employees,http://www.bgmarketing.com.au,"Melbourne, VIC",Self-Employed,null,https://www.linkedin.com/company/black-&-gold-graphic-design-&-web-design/,"302/30 Therry st, Melbourne, VIC, 3000, AU",-37.803425,145.01105,Melbourne,null,null,null,null,null,null,null,null,null,null,null,null,null,null,null,null,null,null,null,null,null,null,null,null,null,null,AU
Hlne Pourchet,null,"My approach to design is vibrant and colourful with conceptual thinking and attention to detail. I am specialised in illustration, pattern creation, publishing and art direction. I work as a freelance designer providing an adapted service on a broad range of projects. I love meeting new people and contributing to new projects. Feel free to contact me :-)",6.10E+11,null,0-1 employees,http://www.helenepourchet.com,"Hobart, Tasmania",Self-Employed,null,https://www.linkedin.com/company/helenepourchet/,"null, Barcelona, null, null, ES",41.38835,2.167125,Barcelona,null,"null, Hobart, Tasmania, null, AU",-42.876358,147.3237,Hobart,null,"null, Besanon, null, null, FR",47.243168,6.006754,Besanon,null,null,null,null,null,null,null,null,null,null,null,null,null,null,null,null,FR
Little Muriel,"Katoomba, NSW 2780, AU","Introducing a Better Way to PlayLittle Muriels, a new source of stimulating creative products for kids, is the brainchild of Australian Interior and Graphic Designer, Jane Carr.With a background in creating immersive play spaces for children at shopping centres and Universities, shes illustrated a series of bespoke wall murals know as Little Muriels.  Ideal for busy Mums, these beautiful, gender-neutral peel and stick decals go up in minutes.  Theyre wipeable, durable and totally removable.Designed from a childs point of view, an imaginative Little Muriels decal is instant fun. They magically turn that sad space into a happy, creative place, said Jane, in your home, waiting room, community or commercial environment.",0413 622 874,null,0-1 employees,http://www.littlemuriel.com,"Katoomba, NSW",Sole Proprietorship,null,https://www.linkedin.com/company/little-muriel/,null,null,null,null,null,null,null,null,null,null,null,null,null,null,null,null,null,null,null,null,null,null,null,null,null,null,null,null,null,null,null
Creative Jim Multimedia,"12 Fitzgibbon Cres, CAULFIELD NORTH, Vic 3161, AU","May 2017Creative Jim Multimedia offers professional photography, graphic design, website creation & video production services for medium and small-sized businesses, artists and bands.With 29 years professional photography experience and 17 years in the graphic & web design field Creative Jim Multimedia crafts individual solutions for our clients and can offer a one-stop solution for your imaging & design needs from ideas & conception right through to the published product.Since mid-2016 I have been involved in a side-project called The Legends Of Anfield Painting - a 5.5m x 2.3m oil on canvas painting representing 96 players and 10 managers/officials throughout the 125 year history of the club from 1892 right through to the present.The painting is finished and we plan to launch it in June 2107.",null,null,0-1 employees,http://www.creativejim.com,"CAULFIELD NORTH, Vic",Self-Employed,null,https://www.linkedin.com/company/creative-jim-multimedia/,"12 Fitzgibbon Cres, CAULFIELD NORTH, Vic, 3161, AU",-37.803425,145.01105,CAULFIELD NORTH,null,null,null,null,null,null,null,null,null,null,null,null,null,null,null,null,null,null,null,null,null,null,null,null,null,null,AU
NananStudio,"Melbourne, VIC  AU","Nananstudio provides service including graphic design & illustration. Graphic design service:-Logo, Branding-Digital Marketing Design-Textile design-UX/UI designIllustration-Custom watercolour portrait commission-On spot portrait artist-Digital & watercolour Illustration",null,null,0-1 employees,http://nananstudio.com,"Melbourne, VIC",Self-Employed,null,https://www.linkedin.com/company/nananstudio/,null,null,null,null,null,null,null,null,null,null,null,null,null,null,null,null,null,null,null,null,null,null,null,null,null,null,null,null,null,null,null
Altitude Creative Studio,"Perth, wa 6065, AU","Here at Altitude Creative Studio, our heads are always in the clouds but we're very down to earth. Were here to bring a new Atmosphere of Design.",439915412,null,0-1 employees,http://www.altitudecreative.com.au,"Perth, wa",Self-Employed,null,https://www.linkedin.com/company/altitudecreativestudio/,null,50.936907,6.898624,null,null,null,null,null,null,null,null,null,null,null,null,null,null,null,null,null,null,null,null,null,null,null,null,null,null,null,null
Studio Carbon,"Surry Hills, NSW 2010, AU","Carbon brings a set of strict principles to create work that meets the highest local and international standards in branding and design with a focus on strategy and customer engagement. We offer thoughtful, considered and creative design solutions supported by a strategic understanding of the brief. This allows us to get to the heart of your problem and choose the appropriate medium, tone of voice and visual language that best solves it. If you would like to learn more about us and how we can help build your brand, create a new website or maybe design signage for your restaurant, get in touch.  Carbon is lead by Steven Luongo, an award winning designer with over 15 years industry experience. steven@studiocarbon.com.au 0421 926 803",null,null,2-10 employees,http://studiocarbon.com.au,"Surry Hills, NSW",Privately Held,null,https://www.linkedin.com/company/steven-luongo-design/,null,41.074488,16.869821,null,null,null,null,null,null,null,null,null,null,null,null,null,null,null,null,null,null,null,null,null,null,null,null,null,null,null,null
DigIdeas,"62 Bix Rd, Dee Why, NSW 2099, AU","We reinforce our clients online presence with meaningful designs that reinforce their individual visual identities.
We design creative logos, objective-driven websites and efficient newsletters.
We implement digital marketing strategies that include SEO, SEM and social media.
Come and talk to us!",null,null,0-1 employees,http://www.digideas.com.au,"Dee Why, NSW",Public Company,null,https://www.linkedin.com/company/digideas/,"62 Bix Rd, Dee Why, NSW, 2099, AU",-33.84907,151.13834,Dee Why,Sydney,null,null,null,null,null,null,null,null,null,null,null,null,null,null,null,null,null,null,null,null,null,null,null,null,null,AU
White Space,"White Space, Marrickville, NSW 2204, AU","We create brands that move. Brands that stir the emotions of their audience, understand and talk to what people need, to what's personal and important to them, to what drives them. Brands that create bonds with people for lasting success. Brands to fall in love with. We work with our clients to discover what they need and build a team from our tried and tested network to deliver something that does far more than tick the boxes. At White Space we specialise in (but we don't limit ourselves to) Brand Strategy, Brand Creation, Brand Architecture, Name Generation, Logo and Identity Design, Website Design and Build, Brochure Design and Business Stationery Design. We can say that because we let our client relationships drive the deliverables.",null,null,2-10 employees,http://white-space.com.au,"Marrickville, NSW",Sole Proprietorship,null,https://www.linkedin.com/company/nimble-creative-consultancy/,"White Space, Marrickville, NSW, 2204, AU",-33.84907,151.13834,Marrickville,null,null,null,null,null,null,null,null,null,null,null,null,null,null,null,null,null,null,null,null,null,null,null,null,null,null,AU
vStudio Design,"Level 3, 79 Myrtle St, Chippendale, NSW 2008, AU","We are vStudio. We offer creative solutions for every design project you can think of. We dont think of ourselves as experts in any one design area, we are experts in applying the design process to find unique solutions. We dont care if you ask us to design a pop-up shop, a power tool package or an exhibition booth, we will use our process of design thinking to innovate  its what we do.",null,null,2-10 employees,null,"Chippendale, NSW",Privately Held,null,https://www.linkedin.com/company/vstudio-sydney/,"Level 3, 79 Myrtle St, Chippendale, NSW, 2008, AU",-33.84907,151.13834,Chippendale,null,null,null,null,null,null,null,null,null,null,null,null,null,null,null,null,null,null,null,null,null,null,null,null,null,null,AU
John Calabro Design,null,"I've done it in reverse and moved BACK to Gippsland to set up a life in the country, and a design studio too... Get in touch!",null,null,0-1 employees,http://www.johncalabro.com,null,Self-Employed,null,https://www.linkedin.com/company/john-calabro-design/,null,null,null,null,null,null,null,null,null,null,null,null,null,null,null,null,null,null,null,null,null,null,null,null,null,null,null,null,null,null,null
Design Bug,"7 Crown St, Newcastle, NSW 2300, AU","Located in the heart of Newcastle, Design Bug is a boutique graphic design studio crafting distinctive brands. Were visual storytellers specialising in head-turning print and digital design. Across Newcastle and beyond, weve given a range of local businesses the design bug.At Design Bug we create design solutions and branding tools that get businesses seen and heard above the babble.We come from humble beginnings, starting life in a home office and growing to include four university-qualified designers as well as a network of specialists for web development, printing, photography and copywriting.Were excited about telling your story through design, and we do this by getting to know what youre trying to achieve and what your business needs to get there. We love the opportunity to have face-to-face conversations so we can get to know your business from all angles. This enriches the creative process and ensures we can develop solutions that align with your vision.Our mission is to leave the studio each day knowing that weve done everything to help our clients and that weve all had a great time working towards your goals.The most important element in maintaining a strong brand is consistency. For this reason, Design Bug takes a holistic approach to creating and managing your marketing material. We offer a wide range of graphic design services including logo and branding design, brochures and flyers, website design and development, annual reports, press advertisements, business stationery, signage and design for events and conferences.As your partner in design, we get to know your business inside and out so that we come to feel as though we are an extension of your team. We can offer ongoing and personalised design assistance and provide a fresh perspective for creative ideas and solutions for your design problems.Ultimately we want your business to succeed, so we will make sure we do everything we can to foster growth and support you.",null,null,2-10 employees,https://www.designbug.com.au,"Newcastle, NSW",Public Company,null,https://www.linkedin.com/company/design-bug/,null,50.10928,14.47478,null,null,null,null,null,null,null,null,null,null,null,null,null,null,null,null,null,null,null,null,null,null,null,null,null,null,null,null
LogoGarden.com Pty Ltd,null,"More logos are created at LogoGarden than anywhere else on earth. More than 2 million entrepreneurs and startups have made customized, professional-looking logos in minutes at LogoGarden.com, for free, without needing graphic skills or experience. Additionally, large companies competing in the multibillion-dollar small business market partner with LogoGarden to precisely target early-stage businesses. LogoGarden, a privately held company, is based in Queensland, Australia",null,null,2-10 employees,https://www.logogarden.com/,"Stones Corner, Queensland",Privately Held,null,https://www.linkedin.com/company/logogarden/,null,-38.094211,144.368721,null,null,null,null,null,null,null,null,null,null,null,null,null,null,null,null,null,null,null,null,null,null,null,null,null,null,null,null
Slick Design Pty Ltd,"6/454 Roberts Road (Monteath Road entrance), Subiaco, Western Australia 6008, AU","We're passionate about design. From distinctive digital to powerful print, we can bring your brand to life. www.slickdesign.com.au

A boutique company with a global mindset and creativity running through our veins, we develop graphic design Perth can be proud of. We create memorable communication-driven design that tells your story and engages with your audience. 

We love rising to a challenge. Flexible, friendly and accessible, we can adapt to your changing deadlines and make last-minute miracles happen. We approach briefs of any size with the same enthusiasm and dynamic spirit. 

We have a hands-on approach. Clients deal directly with creative professionals at Slick Design, ensuring there's no loss of communication. We are a consultative, multi-disciplinary design agency that will do everything we can to help.",null,null,2-10 employees,http://www.slickdesign.com.au,"Subiaco, Western Australia",Privately Held,null,https://www.linkedin.com/company/slickdesignptyltd/,"6/454 Roberts Road (Monteath Road entrance), Subiaco, Western Australia, 6008, AU",-31.939821,115.8162,Subiaco,HQ,null,null,null,null,null,null,null,null,null,null,null,null,null,null,null,null,null,null,null,null,null,null,null,null,null,AU
Studeo,"Brisbane, Queensland 4066, AU",Were Studeo.We help leaders unlock transformative power of creative thinking to become a creative with impact. We use design to build memorable brands that draw customers in.We commit to helping business owners and tomorrows leaders to build a lasting legacy. Empowering ambitious entrepreneurs and designers alike to level-up their skills and become masters of their craft. Our ultimate mission is to promote creative problem solving and enable everyone to make a positive impact.,null,null,0-1 employees,http://www.studeo.com.au,"Brisbane, Queensland",Self-Employed,null,https://www.linkedin.com/company/wearestudeo/,null,37.083496,15.282418,null,null,null,null,null,null,null,null,null,null,null,null,null,null,null,null,null,null,null,null,null,null,null,null,null,null,null,null
KRD,"PO Box 3050, Auburn, Victoria 3123, AU","At KRD we believe in filling space differently. It all starts by talking to you about what you really need to create a compelling edge. After that, the work we design must speak for itself.

Established in 1995, more than 20 years on were still working with many of our foundation clients to create designs that simply click.

KRD (Kym Ramadge Design Pty Ltd) has a high profile local, national and international client base and is a full service graphic design studio.",null,null,2-10 employees,http://www.krd.com.au,"Auburn, Victoria",Privately Held,null,https://www.linkedin.com/company/krd/,null,53.11582,18.046515,null,null,null,null,null,null,null,null,null,null,null,null,null,null,null,null,null,null,null,null,null,null,null,null,null,null,null,null
xander,"Suite 101, 46-48 East Esplanade, Sydney, NSW  AU","Xander is about ideas. And with ideas comes solutions, creatively lead solutions delivered through beautiful design and clever advertising strategies.

We help guide our clients to where they want to be. Its about communicating and approaching the partnership with an open mind and clear direction. Our goal is to offer a return on investment made by our clients. The best way to achieve this is by effective strategy, experience and lets face it, a whole lot of elbow grease. Above all, we nurture creativity, building on an idea that is both positive and memorable. With a combination of nearly 30 years experience in the Graphic Design and Advertising industry, youre in great hands.",null,null,2-10 employees,http://www.xandercreative.com.au,"Sydney, NSW",Privately Held,null,https://www.linkedin.com/company/xander/,"Suite 101, Sydney, NSW, null, AU",-33.84907,151.13834,Sydney,Manly,null,null,null,null,null,null,null,null,null,null,null,null,null,null,null,null,null,null,null,null,null,null,null,null,null,AU
Spike Creative,"1A Somerset St, Richmond, Victoria 3121, AU","CREATIVITY + PASSION

Established in 2004, Spike Creative has built a reputation for outstanding service and quality, producing a wide variety of work for a vast array of clients. These clients include many of Melbourne, and Australias most successful and elite sporting teams and organisations, as well as several of this countrys largest corporate businesses and service providers.
Spike Creative produce an endless array of corporate branding, advertising, publishing, event and sales collateral in digital and print formats.

We strive to be innovative and proactive  to offer our clients solutions and ideas that go beyond just answering the brief.

On Brief + On Budget + On Time. Everytime.",null,null,2-10 employees,http://www.spikecreative.com.au,"Richmond, Victoria",Partnership,null,https://www.linkedin.com/company/spike-creative/,"1A Somerset St, Richmond, Victoria, 3121, AU",-37.803425,145.01105,Richmond,null,null,null,null,null,null,null,null,null,null,null,null,null,null,null,null,null,null,null,null,null,null,null,null,null,null,AU
Liveworm South Bank,null,"Liveworm is the professional graphic design studio of the Queensland College of Art (QCA), Griffith University. Studios are located in South Bank and on the Gold Coast in Queensland, Australia.

We have been providing a successful bridge between the Queensland College of Art and the visual communication design industry for over twenty-five years  a real world extension of the academic programme.

Our point of difference  and core strength  are the students who undertake our programme. The Queensland College of Art has been nurturing creative thinkers for over 125 years and has a reputation for producing some of Australias leading visual artists and designers. In Liveworm you will you find a dynamic, enthusiastic and fresh thinking studio team.

Students are supervised and directed by a highly qualified and experienced management team  ensuring fresh perspectives and high quality outcomes. These students also benefit from valuable hands on experience as they prepare to graduate and move into the design industry.",null,null,11-50 employees,http://www.liveworm.com.au,"Brisbane, Queensland",Educational Institution,null,https://www.linkedin.com/company/liveworm/,"Queensland College of Art Griffith University, Brisbane, Queensland, 4101, AU",-27.47126,153.01831,Brisbane,Liveworm South Bank,"Queensland College of Art Griffith University, Gold Coast, Queensland, null, AU",-27.994457,153.40938,Gold Coast,Liveworm Gold Coast,null,null,null,null,null,null,null,null,null,null,null,null,null,null,null,null,null,null,null,null,AU
Mandurah Graphics,"20 Tuckey Street, Mandurah, Western Australia 6210, AU","Mandurah Graphics is an award winning graphic design studio servicing medium to large business and government departments in Perth, Mandurah, Rockingham and the Peel region, and is the only qualified professional design studio in Mandurah. We specialise in Graphic Design for packaging, corporate identity packages, advertising, web sites, digital multimedia, large format full colour digital printing. Our motto is creative excellence from concept to finished product. We've been serving Mandurah and the Peel Region since 1993. Our client base extends throughout Perth and the metropolitan area and as we have even done web sites for large Eastern states based companies including ICI/ Orica, Hynes Homeware, Beach Crew, Mambo and Pracom Cellular. Clients include the City of Mandurah, City of Rockingham, City of Bunbury, Shire of Murray, City of Kwinana, Peel Development Commission, Alcoa of Australia, Centro Properties, Mandurah Forum Shopping Centre, Peel Thunder Football Club - Westar Rules, Australian Water Polo Inc, Western Australian Water Polo Inc, Ballantyne Plumbing & Gas WA, Boss Entertainment, PMFM, Fairbridge, Murray Joblink, Mandurah Joblink, Pracom Cellular, Peel Farmtech, West Coast Radio, Coast FM, Roadwise WA, Bike West, Hogs Breath Cafe Mandurah, Roscos Trade Mate, to name a few locals, but with the ever expanding global network our clients range in to the wider state, national and world wide markets.",08 9535 8858,null,2-10 employees,https://www.mandurahgraphics.com.au,"Mandurah, Western Australia",Public Company,null,https://www.linkedin.com/company/mandurah-graphics/,null,-32.52837,115.736444,null,null,null,null,null,null,null,null,null,null,null,null,null,null,null,null,null,null,null,null,null,null,null,null,null,null,null,null
What The Fox Creative,"2/19 George St, Maroochydore, QLD 4558, AU","What The Fox Creative believes that great design can change lives. Its that simple. We create powerful brand identities, marketing collateral & websites.

Were a boutique creative agency, and breathe life into brands with visually stunning digital design. Our mission is simple: To bring great design to the businesses of the Sunshine Coast and help set their foundations for success. By combining creativity, strategic thinking and design craft, we give your brand a personality that connects with customers at an emotional level. 

We call our people Foxy Leaders as theyre a talented and passionate bunch with solid experience across branding, design, coding, publishing, advertising & marketing. We firmly believe that in business, first impressions count, and go out of our way to create an image about your brand that leaves a lasting impression on your customers hearts & minds. 

Brimming with innovative design ideas, we combine our creativity with cutting edge technology to establish a digital presence that is made to wow your audience. But before we put our aesthetic hats on, we believe in truly listening to you and your customers. We follow a methodical yet agile approach, and once we really understand who you are, what you do, who you do it for and most importantly, why you do it, we put ourselves in a position to come up with the best design solutions. 

Our promise is to deliver big agency ideas at amazingly affordable prices, with a team of forward thinking creatives and a realistic and transparent approach. Work with our foxes and give your brand an authentic and creative personality!

To Learn More About Us: Visit www.whatthefox.com.au",null,null,11-50 employees,http://whatthefox.com.au,"Maroochydore, QLD",Privately Held,null,https://www.linkedin.com/company/what-the-fox-creative/,"2/19 George St, Maroochydore, QLD, 4558, AU",-26.668592,153.10637,Maroochydore,What The Fox Creative,null,null,null,null,null,null,null,null,null,null,null,null,null,null,null,null,null,null,null,null,null,null,null,null,null,AU
Poppi Design Studio,"., Caringbah, NSW 2229, AU","POPPI DESIGN STUDIO is a {multidisciplinary} creative studio offering professional GRAPHIC & WEB DESIGN services. Our versatile range of services consist of brand and logo creation, print design, web design, shop image graphics and animation. 

At Poppi Design Studio we believe that effective design will give your business a competitive edge. We focus on client satisfaction through genuine partnership, good advice and high quality solutions. We work with you to extract the essence of where you want to go, what you want to say and how you want to say it..",null,null,0-1 employees,http://www.poppi.com.au,"Caringbah, NSW",Privately Held,null,https://www.linkedin.com/company/poppi-design-studio/,"., Caringbah, NSW, 2229, AU",-33.84907,151.13834,Caringbah,Poppi Design Studio,null,null,null,null,null,null,null,null,null,null,null,null,null,null,null,null,null,null,null,null,null,null,null,null,null,AU
S2 Creative BRAND DESIGN,"Sydney, New South Wales 2224, AU","Award-winning graphic designer, with over 30 years in the design industry, working in various areas of graphic design, marketing, logo design, illustration, infographics, signage, standards, photography, packaging, identity and branding. We love the variety of work and appreciate the creative opportunities our clients challenge us to solve.",null,null,2-10 employees,http://www.s2creative.com.au,"Sydney, New South Wales",Privately Held,null,https://www.linkedin.com/company/s2-creative-pty-ltd/,"null, Sydney, New South Wales, 2224, AU",-33.84907,151.13834,Sydney,null,null,null,null,null,null,null,null,null,null,null,null,null,null,null,null,null,null,null,null,null,null,null,null,null,null,AU
